{
  "title": "af_txt",
  "content": "# af.txt\n\nContent-Type: text/x-zim-wiki\nWiki-Format: zim 0.6\nCreation-Date: 2024-07-23T14:50:00-07:00\n\n====== af.txt ======\nTo get started on leveraging my artificial intelligence capabilities for coding and designing elements of your Unity game engine project, please follow these steps as a basic roadmap:\r\n\r\n\tDefine Your Scope & Objectives: Clearly outline the core features and functionalities you desire in your application, as well as any performance criteria or target audience considerations. Keep in mind that simplicity often leads to better outcomes while prioritizing scalability and maintainability will facilitate future updates and expansions.\r\n\r\n\tBreak Down Complex Tasks: Decompose your grand plan into smaller, manageable units that require less time investment to tackle individually. Making an itemized list of responsibilities allows for efficient execution and reduces procrastination due to overwhelming workloads. Ensuring task dependencies properly align helps streamline development workflows further still.\r\n\r\n\tResearch Relevant Technologies: Familiarize yourself with applicable frameworks, libraries, APIs, toolkits, engines (Unity), and platforms supporting interactivity and immersive experiences according to your project requirements. Explore their respective documentation resources and community repositories to gain insight into recommended usage patterns and troubleshoot potential bottlenecks. Additionally, learn about industry standards and emerging trends to stay competitive.\r\n\r\n\tSketch Out Ideas: Mockup wireframes, sketches, diagrams, prototypes, or any combination representing mockups of what components should comprise various sections or screens in your finished product. Consider visual balance, user navigation paths, accessibility concerns, readability, and overall aesthetics in your initial layout suggestions before moving ahead in detailing your plans. Adjustments made early avoid significant reworks later that consume additional work hours unproductively.\r\n\t\r\nDevelop Initial Prototype: Construct an experimental version featuring some rudimentary functionality or limited scope reflecting your initial vision. Reflect upon t\r\n\r\n\r\n\r\nTo establish the functionality of software systems essential for realizing infrastructure and building new features within the Unity game engine environment geared toward facilitating enhanced social presence for avatar embodiment and nonverbal cues exchange with dynamic camera movement synchronization among local playspaces over the internet, the following steps can serve as starting points:\r\n\r\n\tDesign overall architecture and components: Outline a general layout of elements required to achieve functional objectives specified above, including necessary modules for server integration, low latency multiplayer communication protocols, client-side networking libraries, and efficient rendering pipelines for smooth performance during online play sessions.\r\n\r\n\tDefine APIs and SDKs: Create clearly documented application programming interfaces (API) and Software Development Kits (SDK), making it easier for clients and third-party developers wishing to leverage existing integrations or extend their custom work within Unity's framework while minimizing potential conflicts or unexpected behavior.\r\n\r\n\tDevelop prototype systems: Implement working examples demonstrating individual components functioning individually before piecing them together as modular subsystems supporting higher-level functions crucial to achieving core objectives. Establish baseline performance benchmarks early to identify areas requiring optimization throughout development cycles.\r\n\r\n\tTest extensively: Conduct thorough internal testing involving diverse scenarios simulating realistic scenarios encountered during actual usage to ensure high levels of stability, compatibility with common configurations, and consistent outcomes when interacting with different hardware setups, operating system versions, or middleware implementations. Focus on identifying edge cases presenting potential challenges for developers encountering unforeseen situations while trying to troubleshoot particular bugs or resolve compatibility concerns affecting wide ranges of players. Explore automated test suites designed alongside manual exploratory testing exercises to evaluate both broad coverage\r\n\r\n\r\n\r\nChoosing appropriate open source libraries or frameworks forms an integral aspect when creating sophisticated tools or platforms, as doing so could significantly streamline development, reduce maintenance costs, benefit from community contributions and bug reports, and allow users greater control over their computing environments. For a complex undertaking like embodying avatars with accurate gaze mechanics across varying distance settings for enhanced social connections via webcam capture integration and distributed microphone arrays, employing existing well-established resources might expedite feasibility goals. Although several open source options exist, selecting the most fitting option depends on factors like established adoption rates, ease of incorporation into an existing pipeline, extent of documentation available, active developer communities maintaining and updating packages, and flexibility accommodating different workflow requirements. Researching popular repositories, consulting release notes, examining code quality metrics, analyzing issue trackers, and reviewing feature requests and pull requests could help narrow down choices better aligned with project needs. If you require guidance on evaluating candidates, feel free to ask follow-up questions about assessment criteria or seek recommendations based on shared priorities. Keep in mind that open source solutions may still involve some level of customization to match desired behaviors or adapt to proprietary elements, which makes thorough vetting important to minimize unnecessary reinvention in already solved domains and allocate time effectively within allocated budgets or timelines.\n\n\n## Metadata\n- **Source**: All of it Anything Everything At Once/af.txt.txt\n- **Type**: document\n- **Tags**: document, All_of_it_Anything_Everything_At_Once, item, quest, feature, mechanic, bug\n- **Imported**: 2025-05-05T16:25:37.076Z",
  "source": {
    "type": "notebook",
    "path": "All of it Anything Everything At Once/af.txt.txt",
    "importedAt": "2025-05-05T16:25:37.076Z"
  },
  "created": "2025-05-05T16:25:37.076Z",
  "modified": "2025-05-05T16:25:37.076Z",
  "tags": [
    "document",
    "All_of_it_Anything_Everything_At_Once",
    "item",
    "quest",
    "feature",
    "mechanic",
    "bug"
  ]
}