{
  "title": "camel_txt",
  "content": "# camel.txt\n\nContent-Type: text/x-zim-wiki\nWiki-Format: zim 0.6\nCreation-Date: 2024-07-23T14:55:43-07:00\n\n====== camel.txt ======\nIn the context of LLM memory modules, vector storage refers to the ability to store and retrieve vector representations of text or other data. These vectors are typically obtained using deep learning techniques such as neural networks, and can be used to represent the meaning or context of words or phrases in a way that is more robust and generalizable than traditional approaches.\r\n\r\nOne popular implementation of vector storage is the use of word embeddings, which are vector representations of words that capture their meaning and context in a high-dimensional space. These embeddings can be used as inputs to neural networks or other machine learning models to improve their performance on tasks such as text classification, information retrieval, or language generation.\r\n\r\nThere are several popular libraries in Python for working with word embeddings and vector storage, including Gensim, spaCy, and TensorFlow. These libraries provide a range of tools and techniques for training and using embeddings, as well as for exploring and visualizing the vector space.\r\n\r\nTo prepare your Auto-GPT module for vector storage, you may want to consider incorporating these libraries into your code and training your model on a large corpus of text data. You may also want to explore pre-trained embeddings such as those provided by the Word2Vec or GloVe models, which can be loaded directly into your code and used to enhance the performance of your model without requiring additional training. \r\n\r\n'this is our starting point \"cwcorella@DESKTOP-42SH73T:~$ cd /mnt/c/Users/User/Desktop/venv\r\ncwcorella@DESKTOP-42SH73T:/mnt/c/Users/User/Desktop/venv$ source bin/activate\r\n(venv) cwcorella@DESKTOP-42SH73T:/mnt/c/Users/User/Desktop/venv$ cd /mnt/f/production/repository/Auto-GPT\r\n(venv) cwcorella@DESKTOP-42SH73T:/mnt/f/production/repository/Auto-GPT$\"'\r\n\r\n\r\nAs a software developer, your task is to integrate Gensim, spaCy, or TensorFlow libraries into the Auto-GPT module and train it on a large corpus of text data with pre-trained embeddings such as Word2Vec or GloVe to enable vector storage. Use these tools to enhance the model's performance on various natural language processing tasks including text classification, information retrieval, and language generation.\r\n\r\nInstruction: Install Gensim, spaCy, or TensorFlow libraries.\r\nInput: None\r\n\r\nSolution: To install Gensim, spaCy, or TensorFlow libraries, you can use pip, the Python package manager. To install Gensim, run the command “pip install gensim”. To install spaCy, run the command “pip install spacy”. To install TensorFlow, run the command “pip install tensorflow”. Next request.\r\n\r\nInstruction: Download a large corpus of text data to train the model on.\r\nInput: None\r\n\r\nSolution: There are several large corpora of text data available online that can be used to train the model. One such corpus is the Wikipedia dump, which can be downloaded from the Wikimedia website. Another popular corpus is the Common Crawl dataset, which contains billions of web pages. To download the Wikipedia dump, you can use the following command: “wget https://dumps.wikimedia.org/enwiki/latest/enwiki-latest-pages-articles.xml.bz2%E2%80%9D. To download the Common Crawl dataset, you can use the following command: “wget https://commoncrawl.s3.amazonaws.com/crawl-data/CC-MAIN-2021-04/segments/1610706386119.0/warc/CC-MAIN-20210115134153-20210115164153-00000.warc.gz%E2%80%9D. Next request.\r\n\r\nInstruction: Preprocess the text data to remove any unwanted characters, stopwords, and perform lemmatization.\r\nInput: The path to the downloaded text data.\r\n\r\nSolution: To preprocess the text data, we can use spaCy library. First, we need to load the downloaded text data into memory. Then, we can use spaCy to perform tokenization, stopword removal, and lemmatization. Here’s an example code snippet to preprocess the text data:\r\n\r\n\r\nimport spacy\r\nfrom spacy.lang.en.stop_words import STOP_WORDS\r\n\r\nnlp = spacy.load(\"en_core_web_sm\")\r\n\r\ndef preprocess_text_data(path):\r\nwith open(path, \"r\", encoding=\"utf-8\") as f:\r\ntext = f.read()\r\n\r\ndoc = nlp(text)\r\n\r\n# Remove unwanted characters and stopwords\r\ntokens = [token.lemma_.lower() for token in doc if not token.is_stop and token.is_alpha]\r\n\r\n# Perform lemmatization\r\nlemmatized_tokens = [token.lemma_ for token in nlp(\" \".join(tokens))]\r\n\r\nreturn lemmatized_tokens\r\n\r\n\r\nThis function takes the path to the downloaded text data as input and returns a list of lemmatized tokens. You can modify the function to suit your specific needs. Next request.\r\n\r\nInstruction: Use Gensim, spaCy, or TensorFlow libraries to train the Auto-GPT model on the preprocessed text data with pre-trained embeddings such as Word2Vec or GloVe.\r\nInput: The preprocessed text data and the choice of library to use for training.\r\n\r\n\r\nSolution: To train the Auto-GPT model on the preprocessed text data with pre-trained embeddings such as Word2Vec or GloVe, we can use the Gensim library. Here’s an example code snippet to train the model using Word2Vec:\r\n\r\n\r\nfrom gensim.models import Word2Vec\r\n\r\n# Load preprocessed text data\r\npreprocessed_text_data = preprocess_text_data(path_to_text_data)\r\n\r\n# Train Word2Vec model\r\nmodel = Word2Vec(sentences=[preprocessed_text_data], size=100, window=5, min_count=1, workers=4)\r\n\r\n# Save the trained model\r\nmodel.save(\"word2vec.model\")\r\n\r\nThis code snippet loads the preprocessed text data, trains a Word2Vec model on it, and saves the trained model to disk. You can modify the parameters of the Word2Vec model to suit your specific needs. To use GloVe embeddings, you can download the pre-trained GloVe embeddings from the Stanford NLP website and load them into memory using the KeyedVectors.load_word2vec_format() method. Then, you can use the loaded embeddings to train the Auto-GPT model. To use TensorFlow, you can use the TensorFlow Keras API to build and train the model. Next request.\r\n\r\n\r\nInstruction: Use the trained Auto-GPT model to perform text classification on a sample dataset.\r\nInput: The path to the sample dataset.\r\n\r\n\r\nSolution: To use the trained Auto-GPT model to perform text classification on a sample dataset, we can use the TensorFlow Keras API. Here’s an example code snippet to perform text classification on the sample dataset:\r\n\r\n\r\nimport tensorflow as tf\r\nfrom tensorflow.keras.preprocessing.text import Tokenizer\r\nfrom tensorflow.keras.preprocessing.sequence import pad_sequences\r\n\r\n# Load the sample dataset\r\nwith open(path_to_sample_dataset, \"r\", encoding=\"utf-8\") as f:\r\nsamples = f.readlines()\r\n\r\n# Tokenize the samples\r\ntokenizer = Tokenizer()\r\ntokenizer.fit_on_texts(samples)\r\nsequences = tokenizer.texts_to_sequences(samples)\r\n\r\n# Pad the sequences\r\nmaxlen = 100 # Maximum sequence length\r\npadded_sequences = pad_sequences(sequences, maxlen=maxlen, padding=\"post\", truncating=\"post\")\r\n\r\n# Load the trained Auto-GPT model\r\nmodel = tf.keras.models.load_model(\"auto-gpt.model\")\r\n\r\n# Perform text classification\r\npredictions = model.predict(padded_sequences)\r\n\r\n# Print the predictions\r\nfor i, prediction in enumerate(predictions):\r\nprint(f\"Sample {i}: {prediction}\")\r\n\r\n\r\nThis code snippet loads the sample dataset, tokenizes the samples, pads the sequences, loads the trained Auto-GPT model, performs text classification on the samples, and prints the predictions. You can modify the parameters of the Tokenizer and the maximum sequence length to suit your specific needs. Next request.\r\n\r\n\r\nInstruction: Load the downloaded pre-trained embeddings into the Auto-GPT module.\r\nInput: The file path to the downloaded pre-trained embeddings.\r\n\r\n\r\n\r\nSolution: To load the downloaded pre-trained embeddings into the Auto-GPT module, I will first import the necessary libraries such as Gensim and TensorFlow. Then, I will use the respective functions to load the embeddings into the module. For example, to load the pre-trained Word2Vec embeddings, I can use the following code:\r\n\r\n\r\nfrom gensim.models import KeyedVectors\r\nimport numpy as np\r\n\r\n# Load pre-trained Word2Vec embeddings\r\nword_vectors = KeyedVectors.load_word2vec_format('path/to/pretrained/word2vec/embeddings.bin', binary=True)\r\n\r\n# Get the embedding vector for a specific word\r\nembedding_vector = word_vectors['word']\r\n\r\n# Convert the embedding vector to a numpy array\r\nembedding_array = np.array(embedding_vector)\r\n\r\n\r\nThis will load the pre-trained Word2Vec embeddings into the Auto-GPT module and allow us to use them for tasks such as text classification, information retrieval, and language generation. Next request.\r\n\r\n\r\n\r\nInstruction: Use the loaded pre-trained embeddings to train the Auto-GPT module.\r\nInput: The training data for the Auto-GPT module.\r\n\r\n\r\nSolution: To use the loaded pre-trained embeddings to train the Auto-GPT module, I will first preprocess the training data by tokenizing the text and converting it into a sequence of integers. Then, I will use the pre-trained embeddings to create an embedding matrix that will be used to initialize the embedding layer of the Auto-GPT model. Finally, I will train the model using the preprocessed data and the initialized embedding layer. Here is an example code:\r\n\r\n\r\nfrom keras.preprocessing.text import Tokenizer\r\nfrom keras.preprocessing.sequence import pad_sequences\r\nfrom keras.models import Sequential\r\nfrom keras.layers import Embedding, LSTM, Dense\r\n\r\n# Tokenize the text data\r\ntokenizer = Tokenizer()\r\ntokenizer.fit_on_texts(texts)\r\nsequences = tokenizer.texts_to_sequences(texts)\r\n\r\n# Pad the sequences to a fixed length\r\nmax_length = 100\r\npadded_sequences = pad_sequences(sequences, maxlen=max_length, padding='post')\r\n\r\n# Load pre-trained Word2Vec embeddings\r\nword_vectors = KeyedVectors.load_word2vec_format('path/to/pretrained/word2vec/embeddings.bin', binary=True)\r\n\r\n# Create an embedding matrix\r\nembedding_dim = 300\r\nnum_words = len(tokenizer.word_index) + 1\r\nembedding_matrix = np.zeros((num_words, embedding_dim))\r\nfor word, i in tokenizer.word_index.items():\r\nif word in word_vectors:\r\nembedding_matrix[i] = word_vectors[word]\r\n\r\n# Define the Auto-GPT model\r\nmodel = Sequential()\r\nmodel.add(Embedding(num_words, embedding_dim, weights=[embedding_matrix], input_length=max_length, trainable=False))\r\nmodel.add(LSTM(100))\r\nmodel.add(Dense(1, activation='sigmoid'))\r\n\r\n# Compile the model\r\nmodel.compile(optimizer='adam', loss='binary_crossentropy', metrics=['accuracy'])\r\n\r\n# Train the model\r\nmodel.fit(padded_sequences, labels, epochs=10, batch_size=32, validation_split=0.2)\r\n\r\n\r\nThis will train the Auto-GPT model using the pre-trained Word2Vec embeddings and the provided training data. Next request. \r\n\r\n\r\nSolution: To use the trained Auto-GPT model to generate text, I will first load the trained model using Keras. Then, I will use the model to generate text by providing a prompt and sampling from the output distribution of the model. Here is an example code:\r\n\r\n\r\nfrom keras.models import load_model\r\nimport random\r\n\r\n# Load the trained Auto-GPT model\r\nmodel = load_model('path/to/trained/model.h5')\r\n\r\n# Define a function to generate text\r\ndef generate_text(prompt, length=100):\r\n# Tokenize the prompt\r\nprompt_sequence = tokenizer.texts_to_sequences([prompt])[0]\r\nprompt_sequence = pad_sequences([prompt_sequence], maxlen=max_length, padding='post')\r\n\r\n# Generate text\r\ngenerated_text = prompt\r\nfor i in range(length):\r\n# Predict the next word\r\nprediction = model.predict(prompt_sequence)[0]\r\nnext_word_index = np.argmax(prediction)\r\nnext_word = tokenizer.index_word[next_word_index]\r\n\r\n# Add the next word to the generated text\r\ngenerated_text += ' ' + next_word\r\n\r\n# Update the prompt sequence\r\nprompt_sequence = np.roll(prompt_sequence, -1)\r\nprompt_sequence[0][-1] = next_word_index\r\n\r\nreturn generated_text\r\n\r\n# Generate text using a prompt\r\nprompt = 'The quick brown fox'\r\ngenerated_text = generate_text(prompt, length=20)\r\nprint(generated_text)\r\n\r\n\r\nThis will use the trained Auto-GPT model to generate text based on the provided prompt. The generated text will be a sequence of words that are likely to follow the prompt, based on the model’s training data. Next request.\r\n\r\n\r\nInstruction: Implement vector storage using deep learning techniques to represent the meaning and context of words or phrases for broader applications.\r\nInput: None.\r\n\r\n\r\nSolution: To implement vector storage using deep learning techniques to represent the meaning and context of words or phrases, I will use a neural network architecture such as a convolutional neural network (CNN) or a recurrent neural network (RNN) to learn the vector representations of words or phrases. The neural network will take the word or phrase as input and output a vector representation that captures its meaning and context. Here is an example code:\r\n\r\n\r\nfrom keras.models import Sequential\r\nfrom keras.layers import Embedding, Conv1D, GlobalMaxPooling1D, Dense\r\n\r\n# Define the neural network architecture\r\nmodel = Sequential()\r\nmodel.add(Embedding(num_words, embedding_dim, input_length=max_length))\r\nmodel.add(Conv1D(128, 5, activation='relu'))\r\nmodel.add(GlobalMaxPooling1D())\r\nmodel.add(Dense(128, activation='relu'))\r\nmodel.add(Dense(embedding_dim, activation='linear'))\r\n\r\n# Compile the model\r\nmodel.compile(optimizer='adam', loss='mse')\r\n\r\n# Train the model on a corpus of text data\r\nmodel.fit(x_train, y_train, epochs=10, batch_size=32, validation_data=(x_test, y_test))\r\n\r\n\r\nThis will train a neural network to learn the vector representations of words or phrases based on a corpus of text data. The resulting vectors can be used for a variety of natural language processing tasks such as text classification, information retrieval, and language generation. Next request.\r\n\r\n<CAMEL_TASK_DONE>\r\n\r\nTask completed! Let me know if you need any further assistance.\r\n\n\n## Metadata\n- **Source**: All of it Anything Everything At Once/camel.txt.txt\n- **Type**: document\n- **Tags**: document, All_of_it_Anything_Everything_At_Once, character-design, item, quest, fix\n- **Imported**: 2025-05-05T16:25:37.082Z",
  "source": {
    "type": "notebook",
    "path": "All of it Anything Everything At Once/camel.txt.txt",
    "importedAt": "2025-05-05T16:25:37.082Z"
  },
  "created": "2025-05-05T16:25:37.082Z",
  "modified": "2025-05-05T16:25:37.082Z",
  "tags": [
    "document",
    "All_of_it_Anything_Everything_At_Once",
    "character-design",
    "item",
    "quest",
    "fix"
  ]
}