{
  "title": "channel-langchain_txt",
  "content": "# channel-langchain.txt\n\nContent-Type: text/x-zim-wiki\nWiki-Format: zim 0.6\nCreation-Date: 2024-07-23T14:56:14-07:00\n\n====== channel-langchain.txt ======\nhttps://langchain.readthedocs.io/en/latest/index.html\r\n> Large language models (LLMs) are emerging as a transformative technology, enabling developers to build applications that they previously could not. But using these LLMs in isolation is often not enough to create a truly powerful app - the real power comes when you are able to combine them with other sources of computation or knowledge.\r\n\r\n**Modules**\r\n> There are several main modules that LangChain provides support for. For each module we provide some examples to get started, how-to guides, reference docs, and conceptual guides. These modules are, in increasing order of complexity:\r\n> \r\n> Prompts: This includes prompt management, prompt optimization, and prompt serialization.\r\n> \r\n> LLMs: This includes a generic interface for all LLMs, and common utilities for working with LLMs.\r\n> \r\n> Document Loaders: This includes a standard interface for loading documents, as well as specific integrations to all types of text data sources.\r\n> \r\n> Utils: Language models are often more powerful when interacting with other sources of knowledge or computation. This can include Python REPLs, embeddings, search engines, and more. LangChain provides a large collection of common utils to use in your application.\r\n> \r\n> Chains: Chains go beyond just a single LLM call, and are sequences of calls (whether to an LLM or a different utility). LangChain provides a standard interface for chains, lots of integrations with other tools, and end-to-end chains for common applications.\r\n> \r\n> Indexes: Language models are often more powerful when combined with your own text data - this module covers best practices for doing exactly that.\r\n> \r\n> Agents: Agents involve an LLM making decisions about which Actions to take, taking that Action, seeing an Observation, and repeating that until done. LangChain provides a standard interface for agents, a selection of agents to choose from, and examples of end to end agents.\r\n> \r\n> Memory: Memory is the concept of persisting state between calls of a chain/agent. LangChain provides a standard interface for memory, a collection of memory implementations, and examples of chains/agents that use memory.\r\n\r\n> Chat: Chat models are a variation on Language Models that expose a different API - rather than working with raw text, they work with messages. LangChain provides a standard interface for working with them and doing all the same things as above.\r\n\r\n**Use Cases**\r\n> The above modules can be used in a variety of ways. LangChain also provides guidance and assistance in this. Below are some of the common use cases LangChain supports.\r\n> \r\n> Agents: Agents are systems that use a language model to interact with other tools. These can be used to do more grounded question/answering, interact with APIs, or even take actions.\r\n> \r\n> Chatbots: Since language models are good at producing text, that makes them ideal for creating chatbots.\r\n> \r\n> Data Augmented Generation: Data Augmented Generation involves specific types of chains that first interact with an external datasource to fetch data to use in the generation step. Examples of this include summarization of long pieces of text and question/answering over specific data sources.\r\n> \r\n> Question Answering: Answering questions over specific documents, only utilizing the information in those documents to construct an answer. A type of Data Augmented Generation.\r\n> \r\n> Summarization: Summarizing longer documents into shorter, more condensed chunks of information. A type of Data Augmented Generation.\r\n> \r\n> Evaluation: Generative models are notoriously hard to evaluate with traditional metrics. One new way of evaluating them is using language models themselves to do the evaluation. LangChain provides some prompts/chains for assisting in this.\r\n> \r\n> Generate similar examples: Generating similar examples to a given input. This is a common use case for many applications, and LangChain provides some prompts/chains for assisting in this.\r\n> \r\n> Compare models: Experimenting with different prompts, models, and chains is a big part of developing the best possible application. The ModelLaboratory makes it easy to do so.\r\n\r\nhttps://langchain.readthedocs.io/en/latest/ecosystem.html\r\n> AI21 Labs\r\n> AtlasDB\r\n> Banana\r\n> CerebriumAI\r\n> Chroma\r\n> Cohere\r\n> DeepInfra\r\n> Deep Lake\r\n> ForefrontAI\r\n> Google Search Wrapper\r\n> Google Serper Wrapper\r\n> GooseAI\r\n> Graphsignal\r\n> Hazy Research\r\n> Helicone\r\n> Hugging Face\r\n> Modal\r\n> NLPCloud\r\n> OpenAI\r\n> OpenSearch\r\n> Petals\r\n> Pinecone\r\n> PromptLayer\r\n> Runhouse\r\n> SearxNG Search API\r\n> SerpAPI\r\n> StochasticAI\r\n> Unstructured\r\n> Weaviate\r\n> Wolfram Alpha Wrapper\r\n> Writer\r\n\r\n@everyone all, this can only ever be understated. this technology is it. the thing that will bring all of our digital interfaces together. larger than the internet of things.\r\n\r\nhttps://github.com/hwchase17/notion-qa\r\nhttps://github.com/hwchase17/langchain\r\n\r\nhttps://langchain.readthedocs.io/en/latest/modules/agents.html\r\nhttps://langchain.readthedocs.io/en/latest/use_cases/chatbots.html\r\n\r\nhttps://www.youtube.com/watch?v=kYRB-vJFy38\r\n\r\nhttps://www.pinecone.io/learn/langchain/\r\n\r\n> Natural language processing (NLP) is one of the most exciting and rapidly developing areas of artificial intelligence (AI). With its ability to analyze and understand human language, NLP is changing the way we interact with machines and each other. LangChain is a Python library that takes NLP to the next level, making it easier for developers to build intelligent applications that can understand and respond to human language with remarkable accuracy and sophistication.\r\n> \r\n> As we enter the age of generative AI and Large Language Models (LLMs), the potential applications for NLP are almost limitless. From chatbots and voice assistants to search engines and personalized recommendations, NLP is transforming the way we interact with technology. LangChain is at the forefront of this transformation, offering developers a powerful tool for creating intelligent applications that can learn and adapt over time.\r\n> \r\n> As more and more industries incorporate AI into their operations, the ability to analyze and understand language will become increasingly valuable. From healthcare and finance to law and education, NLP will enable new levels of efficiency, accuracy, and insight, ultimately changing the way we work and live.\r\n> \r\n> So whether youâ€™re a developer looking to build the next generation of intelligent applications, or simply someone interested in the ways that AI is changing the world, this LangChain handbook is your guide into the new world. Read this to understand how LangChain, LLMs, and vector databases are paving the way for a future where machines can truly understand and communicate with humans in ways we never thought possible.\r\n\r\n@here LangChain is a technology company focused on developing natural language processing (NLP) tools for businesses. Their technology helps businesses to process and analyze large amounts of text data quickly and accurately.\r\n\r\nhttps://github.com/logspace-ai/langflow\r\n\r\nhttps://youtu.be/lg3kJvf1kXo\r\n\r\nhttps://github.com/yoheinakajima/babyagi\n\n\n## Metadata\n- **Source**: All of it Anything Everything At Once/channel-langchain.txt.txt\n- **Type**: document\n- **Tags**: document, All_of_it_Anything_Everything_At_Once, quest\n- **Imported**: 2025-05-05T16:25:37.083Z",
  "source": {
    "type": "notebook",
    "path": "All of it Anything Everything At Once/channel-langchain.txt.txt",
    "importedAt": "2025-05-05T16:25:37.083Z"
  },
  "created": "2025-05-05T16:25:37.083Z",
  "modified": "2025-05-05T16:25:37.083Z",
  "tags": [
    "document",
    "All_of_it_Anything_Everything_At_Once",
    "quest"
  ]
}