{
  "title": "character-ai_txt",
  "content": "# character-ai.txt\n\nContent-Type: text/x-zim-wiki\nWiki-Format: zim 0.6\nCreation-Date: 2024-07-23T14:56:30-07:00\n\n\nWinter is the epitome of stoicism and resilience, often depicted as a cold and isolated figure. Despite her introverted nature, she has a deeply caring nature and is always willing to help those in need. She is a wise and insightful figure, always willing to lend a sympathetic ear and offer sound advice. Her struggle to maintain a balance between protecting her own independence and showing vulnerability are an important part of her character arc.\n\nSpring is the embodiment of hope and renewal, always looking towards the future with an unbreakable optimism. She is a lively and energetic figure, but she can also be reckless and impulsive. She is always willing to go above and beyond for those she cares about, but she must learn to set boundaries and take care of herself as well. Her struggle to find a balance between her endless hope and the realities of the world are what drive her character arc.\n\nSummer is the ultimate embodiment of abundance and growth, often depicted as a warm and generous figure. Despite her selfless nature, she often forgets to take care of herself, always putting the needs of others first. She is a wise and compassionate figure, always willing to listen and offer support, but she must learn to take care of herself as well. Her struggle to find a balance between giving and receiving are an important part of her\n\n\nOne possible reason Autumn and Little may have for visiting Spring could be to learn more about her. Given that Spring is the embodiment of renewal and growth, she represents the potential for change and improvement. Autumn may feel that spending time with Spring could give her a fresh perspective on her own challenges and provide her with the inspiration she needs to keep pushing forward.\n\nAnother factor that could motivate Autumn and Little to visit Spring is the desire to help her. Winter may be struggling to make it through to the arrival of Spring, and Spring's kindness and generosity may make her vulnerable to those who seek to take advantage of her. If Autumn and Little were to witness someone taking advantage of Spring, they may feel a sense of responsibility to step in and help her. This could be a way for Autumn to make a positive impact on the world and to fulfill her purpose as the embodiment of Autumn.\n\nThe journey to Spring may also be a way for Autumn and Little to take a break from their own challenges and responsibilities, and a chance for them to connect on a personal, emotional level. Spring's warmth and energy may be a welcome contrast to Winter's cold isolation, and the journey to Spring could serve as a way for Autumn and Little to find hope and inspiration in the midst of their struggles.\n\nIt's possible that Autumn and Little could decide that Spring needs help without witnessing someone taking advantage of her. They may have a hunch based on Spring's behavior or demeanor, or they may simply sense that Spring is in need of assistance. Whether or not they have solid evidence, Autumn and Little may feel a strong sense of empathy towards Spring and be motivated to offer their support and reassurance.\n\n\n\n\nACT 1:\nIntroduction of Winter, who is depicted as a distant and reserved character. She exudes strength and independence, but also has a tendency to self-isolate and shun support from outsiders, feeling that she can handle everything on her own. Autumn is introduced as Winter's friend, whose kind and understanding nature causes Winter to loosen her reserved shell just enough to accept her assistance at times.\n\nScene 1:\nAutumn offers Winter help with a task that she is struggling with. Winter initially rejects Autumn's help, feeling that she can do it herself, but Autumn persists, reassuring Winter that her assistance is genuine.\n\nScene 2:\nWinter reluctantly accepts Autumn's help, but continues to insist that she is fine on her own. Autumn continues to provide support, encouraging Winter to consider that accepting help is not a sign of weakness but a sign of strength.\n\nACT 2:\nAs the workload continues to build, Winter's pride and stubbornness cause her to push away Autumn's assistance, preferring to work in isolation. Autumn becomes increasingly concerned, seeing Winter's stress and anxiety but feeling powerless to help.\n\nScene 1:\nAutumn notices Winter's increasing workload and tries to reason with her, explaining that accepting help is not a sign of weakness but a smart business decision. Winter ignores Autumn's concerns, insisting that she can handle everything on her own, and that accepting help makes her weak.\n\nScene 2:\nAutumn becomes increasingly frustrated with Winter's stubborn rejection of her assistance, feeling that she cannot help her friend if she refuses to accept help. Autumn tries to reason with Winter one last time, explaining that accepting help is a way of acknowledging that she cannot carry everything on her own and that it is okay to rely on others. Winter finally relents, acknowledging that she cannot do everything on her own and accepting Autumn's assistance as a way of lightening her load.\n\nACT 3:\nWinter continues to work with Autumn, acknowledging the value of teamwork and realizing that accepting help from others is a sign of wisdom and self-preservation. She begins to loosen her reserved shell further, sharing her concerns and fears with Autumn and finding a new sense of comfort in her friend's kind and supportive nature.\n\n\n\n\n\nWINTER\n\nFirst Encounter:\nAutumn approaches Winter with an offer of help, sensing her isolation. Winter, however, is not ready to accept Autumn's assistance and rebuffs her advances, insisting that she is fine on her own and does not need Autumn's help. Autumn persists, insisting that Winter is not alone and that her help is available whenever Winter is ready to accept it. The encounter ends with Winter isolating herself further and Autumn feeling frustrated and helpless.\n\nSecond Encounter:\nAutumn encounters Winter again, reminding her of her previous offer of help. Winter lashes out at Autumn, telling her to leave her alone and stop meddling in her life. Autumn, taken aback by Winter's sudden outburst, tries to explain that she is only trying to help. Winter refuses to listen, claiming that Autumn doesn't understand what she's going through. The encounter ends with Winter storming off and Autumn feeling confused and unsure of how to proceed.\n\nThird Encounter:\nAutumn approaches Winter for the third time, this time with more empathy and understanding of Winter's situation. Winter, tired and frustrated after her previous outburst, agrees to speak with Autumn. Autumn listens to Winter's concerns and offers insights and solutions without judgment. Winter, feeling heard and understood for the first time, begins to open up and accept Autumn's help. The encounter ends with a sense of hope and optimism for both characters, and with the potential for a more positive relationship moving forward.\n\n\n\nSPRING\n\nAct 1:\nIntroduction of Spring, who is described as a caring, giving character who has a tendency to take on too much. She is described as always available to help others, even at her own expense. Autumn is introduced as Spring's friend and someone who offers her support and guidance.\n\nScene 1:\nAutumn offers to help Spring with a task, but Spring insists on doing it herself. Autumn notices that Spring is becoming increasingly tired and stressed out, but Spring is reluctant to admit that she is struggling.\n\nScene 2:\nSpring's excessive generosity causes her to stay up late helping a friend with a project, even though she has her own work to do the next day. Autumn tries to reason with Spring, urging her to take care of herself, but Spring is adamant about helping others.\n\nAct 2:\nSpring's over-commitment to helping others begins to take its toll on her physical and mental health. She becomes increasingly exhausted and frazzled, and her work quality begins to slip. Autumn notices Spring's deterioration and offers to take on some of her work.\n\nScene 1:\nSpring refuses Autumn's offer, feeling guilty for relying on others. Autumn is concerned but respects Spring's decision.\n\nScene 2:\nSpring's health deteriorates further, and she begins to miss deadlines at work. Autumn, worried for Spring's well-being, intervenes and persuades Spring to allow her to take on some of her workload.\n\nAct 3:\nSpring recognizes the need to balance her giving with her own self-care. With Autumn's support, she learns to set healthy boundaries and prioritize her own needs. Autumn sees Spring's growth and is proud of her for taking care of herself. Spring continues to help others, but now does so in a sustainable way that does not compromise her own health and well-being. Autumn is impressed by Spring's newfound resilience and self-awareness, and the two friends remain close and continue to support each other.\n\n\nSUMMER\n\nAct 1:\nIntroduction of Summer, who is depicted as a proud and self-sufficient character. She exudes warmth and optimism, but also has a tendency to rely solely on her own abilities, even when the task at hand is too much to handle alone. Autumn is introduced as Summer's younger sister, who has a quiet and insightful nature. While Autumn admires Summer's independent spirit, she is also aware that her older sister's ego could get in the way of accepting help from others.\n\nScene 1:\nAutumn offers to help Summer with a project they are working on together. Summer refuses Autumn's offer, insisting that she has it under control. Autumn insists, but Summer snaps at her, saying that she can handle it herself. Autumn is hurt by this rejection and retires to her room, feeling unappreciated.\n\nScene 2:\nSummer's pride leads her to take on more responsibilities than she can handle, resulting in her missing deadlines and being unable to meet expectations. Autumn notices Summer's stress and anxiety, but Summer refuses to ask for help, instead preferring to work late into the night to finish her projects. Autumn worries that Summer's pride will continue to cause her to take on more than she can handle, and worries that it may lead to burn out.\n\nAct 2:\nSummer continues to work long hours, despite Autumn's repeated offers to help. Autumn is concerned about Summer's workload and the toll it is taking on her mental and physical health, but Summer is too prideful to acknowledge that she needs assistance. Autumn grows increasingly frustrated with Summer's refusal to accept help and feels that Summer's ego is preventing her from seeing the value in teamwork.\n\nScene 1:\nAutumn approaches Summer and suggests hiring a temporary assistant to help with the workload. Summer scoffs at the idea and insists that she can handle everything on her own. Autumn tries to reason with Summer, explaining that accepting help from others is not a sign of weakness and that it is actually a smart business decision. Summer rolls her eyes and storms off, clearly not receptive to Autumn's suggestions.\n\nScene 2:\nAs the workload continues to build, Summer begins to feel overwhelmed and stressed out. She becomes increasingly irritable and short-tempered, snapping at coworkers and clients alike. Autumn notices the change in Summer's behavior and tries to approach her about it, but Summer brushes her off and insists that everything is fine.\n\nScene 3:\nAutumn reaches out to a family friend who is a successful business owner, seeking advice on how to handle the situation. The family friend listens to Autumn's concerns and offers some advice on how to approach Summer in a more compassionate way, encouraging Autumn to express her concerns from a place of love and understanding rather than frustration. Autumn takes this advice to heart and approaches Summer with a different perspective, expressing her concern for her sister's physical and emotional health and emphasizing that she understands Summer's independent nature but also recognizes that she cannot do everything alone.\n\nScene 4:\nSummer finally begins to listen to Autumn's concerns and starts to realize that she has been carrying too much responsibility on her own. She begins to see the value in accepting help from others and realizes that it can actually be a sign of strength rather than weakness. She apologizes to Autumn for not listening to her sooner and expresses her appreciation for her sister's support. The two sisters reconcile and Autumn feels a sense of relief that she was finally able to reach through to her sister.\n\n\n\n\n## Metadata\n- **Source**: All of it Anything Everything At Once/character-ai.txt.txt\n- **Type**: document\n- **Tags**: document, All_of_it_Anything_Everything_At_Once, character-design\n- **Imported**: 2025-05-05T16:25:37.083Z",
  "source": {
    "type": "notebook",
    "path": "All of it Anything Everything At Once/character-ai.txt.txt",
    "importedAt": "2025-05-05T16:25:37.083Z"
  },
  "created": "2025-05-05T16:25:37.083Z",
  "modified": "2025-05-05T16:25:37.083Z",
  "tags": [
    "document",
    "All_of_it_Anything_Everything_At_Once",
    "character-design"
  ]
}