{
  "title": "collection-channel_txt",
  "content": "# collection-channel.txt\n\nContent-Type: text/x-zim-wiki\nWiki-Format: zim 0.6\nCreation-Date: 2024-07-23T14:58:55-07:00\n\n====== collection-channel.txt ======\n5:20 PM]Glitch: These are the references I've collected\r\n⁠autumn-refs: the works of Seneca the Younger compiled, selected; and then so contextualized by James S. Romm.\r\n[I am re-transcribing this text to a Google Doc and further amending it: will be updated here]\r\n\r\n⁠home-body & ⁠milk-and-honey: companion works written by rupi kaur. \r\n\"A sided voice from one half of humanity\", in my personal perspective.\r\n\r\n⁠Unknown Persuasive Games: The Expressive Power of Videogames - Ian Bogost. \r\n[needs further transcription & additive rhetoric]\r\n\r\n⁠rhetoric-minot: Given ideas and concepts of rhetoric. — Rhetoric: Theory and Practice for Composition - Water S. Minot [Gannon University: Winthrop Publishers, Inc.: Cambridge Massachusetts] [1981]\r\n\r\n[this text is unfinished]\r\n\r\n⁠frog-and-toad: Arnold Lobel - Know that, \"being lighthearted is not the same as being \r\nlightweight\". I will be omitting the artwork [so regretfully]\r\n\r\n⁠battle-for-life ref. The Battle for the Life and Beauty of the Earth: A Struggle Between Two World-Systems\r\n\r\n⁠ecocities \r\nref. ecocities: Rebuilding Cities in Balance with Nature; Revised Edition, Richard Register\r\n\r\n⁠arcology-soleri \r\nref. Arcology: The City in the Image of Man, Paolo Soleri\r\nThis book is about miniaturization\r\n\r\nIn the works, I have translation to 'The Mechanism of Human Physiognomy: Electro-Physiological Analysis of the Expression of Emotions Applicable to the Practice of Visual Arts\r\nhttps://archive.org/details/mecanismedelaphy00duch/page/n6/mode/1up?ref=ol&view=theater\r\nhttps://archive.org/details/physiologiedesmo00duch/page/454/mode/2up\r\n\r\nHere, I have a partial transcription of 'How to Work' a room; a book I picked up at random from the library near to where I live. Again, partial. Will resume- [it needs to have an outline]\r\nhttps://docs.google.com/document/d/10dhgrpm-1KbNMDCmtoNN06fP3ZDe-m0J2oV4nzAHupY/edit\r\n \r\nInternet Archive\r\nMécanisme de la physionomie humaine, ou, Analyse électro-physiolo...\r\nPhotographs signed: Duchenne (de Boulogne), phot\r\nImage\r\nInternet Archive\r\nPhysiologie des mouvements démontrée à l'aide de l'experimentation ...\r\nxvi, 872 p. : 22 cm\r\nImage\r\nGoogle Docs: Sign-in\r\nAccess Google Docs with a personal Google account or Google Workspace account (for business use).\r\n[5:23 PM]Glitch:\r\nHow to Give: An Ancient Guide to Giving and Receiving \r\nhttps://docs.google.com/document/d/1KtWez4K4od8T4XbDHWTDIfxngzQwmQV_VMbbY2LveTI/\r\n\r\nThen I have these other books; in no particular order:\r\n- Pocket Neighborhoods\r\n- Architecture: Form, Space, & Order\r\n- RETROSUBURBIA: David Holmgren\r\n- Thinking Fast and Slow\r\n- make it stick\r\n- the accidental universe\r\n- a traveler's guide to the stars\r\n- simulacra & simulation\r\n- the machine question\r\n- FACTFULNESS\r\n- free will: Sam Harris\r\n- Bullshit Jobs\r\n- Utopia for Realistis\r\n- The Art of Frugal Hedonism\r\n- Abundance\r\n- Postcapitalism\r\n- English 3200\r\n- Sapiens: Yuval Noah Harari\r\n- How Language Began\r\n- The Ancestor's Tale: Richard Dawkins\r\n- BEHAVE: Robert M Saplosky\r\n- The Selfish Gene: Richard Dawkins\r\n- loneliness\r\n- Human Nature and the Need for Social Connection\r\n- Conversational Informatics\r\n- Level Design: Christopher W. Totten\r\n- Game Anim:  Video Game Animation Expained\r\n- The Art of Game Design\r\n- situational game design\r\n- The Aesthetic of Play: Upton\r\n- The Design of Everyday Things\r\n- Masters of Doom\r\n- The Anatomy of Story: John Truby\r\n- Blood, Sweat, and Pixels\r\n- How Games Move Us\r\n- The Permaculture Garden\r\n- Future Scenarios: David Holmgren\r\n- The Permaculture Garden: Graham Bell - Sarah Bunker\r\n- Experiencing Architecture: Steen Eiler Rasmussen\r\n- The Image of the City: Kevin Lynch\r\n- Chambers For A Memory Palace: Lyndon and Moore\r\n- The Death and Life of Great American Cities: Jane Jacobs\r\n- Permaculture_Principles & Pathways Beyond Sustainability: David Holmgren\r\n- the urban ideal: conversation with paolo soleri - berkeley hills\r\n- The Timeless Way of Building\r\n- A Pattern Language\r\n- Staying With the Trouble\r\n- Hieroglyph\r\n- SOLARPUNK\r\n- Red Star\r\n \r\nGoogle Docs: Sign-in\r\nAccess Google Docs with a personal Google account or Google Workspace account (for business use).\r\n[5:56 PM]Glitch: These would be transcribed and annotated for our use.\n\n\n## Metadata\n- **Source**: All of it Anything Everything At Once/collection-channel.txt.txt\n- **Type**: document\n- **Tags**: document, All_of_it_Anything_Everything_At_Once, story, quest\n- **Imported**: 2025-05-05T16:25:37.086Z",
  "source": {
    "type": "notebook",
    "path": "All of it Anything Everything At Once/collection-channel.txt.txt",
    "importedAt": "2025-05-05T16:25:37.086Z"
  },
  "created": "2025-05-05T16:25:37.086Z",
  "modified": "2025-05-05T16:25:37.086Z",
  "tags": [
    "document",
    "All_of_it_Anything_Everything_At_Once",
    "story",
    "quest"
  ]
}