{
  "title": "convention_tips_txt",
  "content": "# convention_tips.txt\n\nContent-Type: text/x-zim-wiki\nWiki-Format: zim 0.6\nCreation-Date: 2024-08-15T22:00:59-07:00\n\n====== convention tips.txt ======\n\tContact people before going to an event. Great place to meet publishers.\r\n\tPress can be found at E3.\r\n\tPlayers at Gamescom\r\n\tDevelopers at GDC/Steam Dev Days\r\n\tGo with groups. IndieMegaBooth, IndieArenaBooth, LefFieldCollection, MixMediaIndieExhange, IndieCade, GCDPlay\r\n\tSetup housing two days before the event plus an extra day. book close to event\r\n\tPrints, banners, business cards, others. Colors are important to branding. Roll up banners, keep logos as high as you can. Flyers don't work. Try business card size flyers.\r\n\tAdjust your game around the convention. Short play sessions, runs on its own. Auto restart. (at end and on idle) restarts in case of crash. (program that checks if the application is running, if it's not, auto-restart it)\r\n\tIdle card. gameplay showcase, and encourage players to sit down and try the game\r\n\tsafe environment. don't let players access the options menu or back out of the game\r\n\tpacking, scissors, pliers, box cutter, zip ties, duct tape, invisible tape, double sided tape, construction gloves, throat lozenges or honey. throw in an extension cord\r\n\tUse a wired controller! They're not intimidating or complex, and they're easy to secure.\r\n\tDon't rent screens. booth height is important. have a TV high up so people can spectate the game. sound is important, get portable amps\r\n\tavoid the use or need for headphones\r\n\tuse lights to draw attention\r\n\tget a TV topper to look professional\r\n\tbuy food before doors open\r\n\tfilm everything\r\n\tput webcam on monitor\r\n\tdo giveaways. plushies, pins, shirts, print steamkeys on business cards\r\n\ttreat spectators right. drawing prints, let the audience create unique art for the character armor, draw a photo of it, post it on social media, and have a chance to get a free steam key. use the best one and add them in the game\r\n\thave a quick elevator pitch to tell people\r\n\ttalk to game developers. introduce your friends, say goodbye instead of walking off. talk\r\n\tedit footage. make a video of the event and players enjoying your game\r\n\tdon't contact people you met for 3-4 days after the event\r\n\twrite about your experience\r\n\thave sales after events\r\n\tget spectators to play the game. give them a controller to hold then walk off\n\n\n## Metadata\n- **Source**: All of it Anything Everything At Once/convention_tips.txt.txt\n- **Type**: document\n- **Tags**: document, All_of_it_Anything_Everything_At_Once, character-design, gameplay\n- **Imported**: 2025-05-05T16:25:37.088Z",
  "source": {
    "type": "notebook",
    "path": "All of it Anything Everything At Once/convention_tips.txt.txt",
    "importedAt": "2025-05-05T16:25:37.088Z"
  },
  "created": "2025-05-05T16:25:37.088Z",
  "modified": "2025-05-05T16:25:37.088Z",
  "tags": [
    "document",
    "All_of_it_Anything_Everything_At_Once",
    "character-design",
    "gameplay"
  ]
}