{
  "title": "Creatures_docx",
  "content": "# Creatures.docx\n\nContent-Type: text/x-zim-wiki\nWiki-Format: zim 0.6\nCreation-Date: 2024-08-15T22:23:28-07:00\n\n====== Creatures.docx ======\nCreatures\nThe forest dwelling creatures are quite bothered by the sudden turn of events and will require assistances frequently. Unique personalities and dispositions result in various levels of circumstantial urgency, emotional responses, communication abilities, and detail observation. Creatures you interact with are sentient, anthropomorphized, talking animals.  Those whom you do not interact with appear instinctive or primal. \nBasic Summary\n\nInvolvement in Plot (not all creatures require this)\n\n\nAppearance\n\n\nPersonality \n\n\nPowers (not all creatures require this)\n\n\nGameplay (not all creatures require this)\n\n\n\n## Metadata\n- **Source**: All of it Anything Everything At Once/Creatures.docx.txt\n- **Type**: document\n- **Tags**: document, All_of_it_Anything_Everything_At_Once, gameplay\n- **Imported**: 2025-05-05T16:25:37.052Z",
  "source": {
    "type": "notebook",
    "path": "All of it Anything Everything At Once/Creatures.docx.txt",
    "importedAt": "2025-05-05T16:25:37.052Z"
  },
  "created": "2025-05-05T16:25:37.052Z",
  "modified": "2025-05-05T16:25:37.052Z",
  "tags": [
    "document",
    "All_of_it_Anything_Everything_At_Once",
    "gameplay"
  ]
}