{
  "title": "dete_txt",
  "content": "# dete.txt\n\nContent-Type: text/x-zim-wiki\nWiki-Format: zim 0.6\nCreation-Date: 2024-07-23T15:01:01-07:00\n\n====== dete.txt ======\nM-theory has the fundamental objects of branes which are extended objects spanning more than one spatial dimension instead of the previously believed strings, and can be described as string theory when some of these dimensions become very small. A 1-brane is a string-like object extended in a single spatial dimension. It can be visualized as a line or wire, like a violin string, or a thread. It is the basic building block of string theory, from which the physics and all its properties flow. As you increase the number of dimensions, these branes become membranes, such as the surface of a soap bubble or a drum skin.\r\nIn M-theory, branes are extended objects that can have various dimensions, and strings are one-dimensional objects. When a brane is subjected to a lot of energy, it can vibrate in such a way that it becomes more and more string-like. This transition from a brane to a string is thought to occur when one of the dimensions of the brane becomes very small.\r\nTo understand this concept, it might be helpful to think about a rubber band. A rubber band is an example of a one-dimensional object because it is long and thin, with only one dimension that is significantly larger than the others. However, if you stretch the rubber band enough, it can become more two-dimensional, with its width and thickness becoming more pronounced. Similarly, if you apply enough energy to a brane, it can become more and more one-dimensional, eventually turning into a string.\r\nThis idea of branes turning into strings helps us to understand how the dimensions of space-time can change and how this might affect the behavior of particles. It provides a way to think about how particles might interact with each other in different dimensions, which is one of the key concepts in M-theory.\r\nThe strings of string theory emerge from the M2-branes of M-theory in part by wrapping around the small eleventh dimension and becoming one dimensional. This leads to all five string theories of the 11-dimensional M-theory being various limits of the extra small dimension. By wrapping itself around a long thin wire and shrinking down due to the high tension of the M-brane, the two-dimensional object is able to turn into a one-dimensional object. This is further strengthened by objects under tension wanting to shrink and fold up, leading to the world we experience at a fundamental level being made up of these lower dimensional objects.\r\nHumans may be confined to the surface level, living a life unaware of the great mysteries of the universe outside of what they can observe. Just as the water bugs are trapped by the surface of the water, humans could be similarly trapped by the bounds of their perception, isolated from the greater truth of the universe that lies beyond the edge of their binary view. Even with advances in science, humanity is still confined to the two dimensional brink of its own infinity and unaware of the great expanse of its reality.\r\nI can tell you that gravity is the most universal force, and it does not stay confined to the surface of a brane. Its force lines spread out both within and away from the brane, which explains why it is much weaker than all the other forces.\r\nThe motion of two branes would have created an accelerated expansion of the universe, which is believed to have been responsible for the structure, composition and age of the present-day universe. This accelerated expansion, termed inflation, also solved the long-standing puzzle of why the universe appears so “flat” and uniform, as the brane collision would have led to the formation of huge bubbly patches of space-time, with each patch having an almost identical age, temperature and geometry. By the time the early universe cooled, these patches had already grown to become huge, with the same physical properties across them.\r\nThe legacy of this collision would be a series of small deformations on the surface of our brane, which would subsequently grow under gravity to the cosmic superstructures – galaxies and clusters of galaxies – which we observe today. While the ramifications of living on a brane are intriguing, why imagine exotic and speculative higher-dimensional cosmologies unless we have reason to think they could possibly be correct? (This is where the dualities are relevant)\r\nM-Theory is a cryptographic mathematical model that attempts to explain the relationship between gravity and quantum mechanics. It postulates that the two forces are related by a unified concept of duality: branes exist mathematically and theoretically (as the holographic principle) are real and consistent objects. The deep structure of the theory has revealed connections between theories and calculations that all lead to the same answer, indicating that strings and M-Theory may be the final frontier of physics. Additionally, the notions of branes, dualities, and map of theories all point to a mathematically consistent product that hints at physical correctness, suggesting that strings and M-Theory may be the ultimate answer to the mysteries of the universe.\n\n\n## Metadata\n- **Source**: All of it Anything Everything At Once/dete.txt.txt\n- **Type**: document\n- **Tags**: document, All_of_it_Anything_Everything_At_Once, mechanic, bug\n- **Imported**: 2025-05-05T16:25:37.093Z",
  "source": {
    "type": "notebook",
    "path": "All of it Anything Everything At Once/dete.txt.txt",
    "importedAt": "2025-05-05T16:25:37.093Z"
  },
  "created": "2025-05-05T16:25:37.093Z",
  "modified": "2025-05-05T16:25:37.093Z",
  "tags": [
    "document",
    "All_of_it_Anything_Everything_At_Once",
    "mechanic",
    "bug"
  ]
}