{
  "title": "Docu_txt",
  "content": "# Docu.txt\n\nContent-Type: text/x-zim-wiki\nWiki-Format: zim 0.6\nCreation-Date: 2024-07-23T15:03:04-07:00\n\n====== Docu.txt ======\nThe world of Ether is a beautiful and vast world, full of wonder and mystery. It is populated by characters with their own stories and problems, and it is up to the player to explore the world, meet these characters, and help them with their issues. The game also encourages self-discovery and finding one's place in the world, and players will face difficult choices that will shape their path and the world around them.\r\n\r\nFather Fortune is a practical man who values hard work and perseverance above all else. He dresses in dignified attire that reflects his commitment to function and durability, with a touch of nobility in the details. His bearing exudes competence and confidence, commanding respect from those around him. As the patriarch of the family, Father Fortune believes that a person's worth is measured by their contribution to society and their ability to provide for themselves and their family. He takes great pride in his ability to work with his hands and earn an honest living, but also recognizes the importance of compassion and kindness. Despite his stern visage, Father Fortune has a heart of gold and is always willing to lend a helping hand to those in need. He deeply loves his family and community, and strives to provide for them in every way he can. Father Fortune's role in the world is to be a symbol of hard work, perseverance, and success. He is a leader and mentor to those around him, and an example of what it means to be a responsible and successful member of society.\r\n\r\nMother Nature is an ethereal figure, the embodiment of the natural world, the mother of all living things, and the guardian of the seasons. Her power is great, her wisdom vast, and her presence awe-inspiring. She is a warm and nurturing presence, with a deep love and respect for all living things. Her role is to tend to the needs of her beloved children - the plants, animals, and people of the world - and to maintain balance and harmony with Father Fortune.\r\n\r\nThematic, fabled storytelling in this game would involve players finding paths of conversation that bring them closer to their goals. Players would be presented with narrative issues related to the player and seen in the game world that are interpersonal in nature. The game would also use fables in the context of grounded characters to reflect many problems in our modern society.\r\n\r\nThe larger themes of this game are empathy, mindfulness, self-reflection, relationships, connections, listening, empathizing, caring for those around us, finding meaning and purpose in our lives, and making a positive impact on the world.\r\n\r\nThe game mechanics involve taking on the role of Autumn, who is in charge of bringing balance to the world and ensuring that each season runs smoothly. Along the way, you will encounter challenges and obstacles that require you to use your problem-solving skills and engage with the other characters to find solutions. Each character represents a different aspect of human nature and has their own strengths and weaknesses. For example, Winter represents stoicism and resilience, while Spring represents growth and new beginnings. Throughout the game, you will explore the interconnectedness of all things and learn about the importance of caring for yourself and others. The game aims to promote empathy, mindfulness, and self-reflection through its narrative and gameplay mechanics.\r\n\r\nSummer is traditionally associated with warmth, growth, and abundance. She is the embodiment of sincerity and positivity, and she exudes an air of unwavering confidence. She is the lifeblood of her village, always ready to lend a helping hand to anyone in need. Summer differs from the other sister seasons in that she is the most selfless and generous of them all. She often puts others before herself and forgets to save some for herself. The common flaw or theme we might explore in her writing is the struggle to find a balance between giving and receiving. Autumn can help Summer by reaching out to her and offering her the support she needs, as well as helping her find a balance between giving and receiving.\r\n\r\nSummer may be reluctant to accept help from Autumn because she is used to taking care of herself and her village and is not comfortable asking for help. She may also be afraid of burdening her sister with her own struggles and worries.\r\n\r\nSpring is the embodiment of generosity and kindness, always putting others before herself. She has a boundless well of love to offer, but often forgets to save some for herself. She is more lively and energetic than the other sister seasons, and her flaws include forgetting to take care of herself and not setting boundaries. Autumn can help her by reminding her to take care of herself and to set boundaries with others. She may refuse help because she is used to taking care of others and may not be used to asking for help.\r\n\r\nFor Spring to give means to be generous and kind, always putting others before herself. She has a boundless well of love to offer, but often forgets to save some for herself.\r\n\r\nWinter is a loner who sees no value in building relationships with the people in her village. She is content with her responsibilities but lost in her own world. She has destructive habits that she keeps hidden from others. She differs from her sister seasons in that she is stoic and reserved, while Spring is more lively and energetic, and Summer is warm in abundance. Autumn can help her by understanding her struggles and offering her support. She may refuse help because she is used to being independent and not relying on others.\r\n\r\nThere are some contradictions in this work, such as Father Fortune's hard-lined ideals of work and labor being in contrast to Mother Nature's belief that people are our home and hearth. The language is a bit overly verbose in some places, so I would suggest cutting down on the amount of words used to express an idea. The world of this work is a narrative-driven adventure game called \"Seasons of Life,\" which explores the different seasons of life through the lens of Mother Nature and Father Fortune and their children, Winter, Spring, Summer, and Autumn. The characters have abstract negatives in terms of human relation, and the game incentivizes them to stay at home and rest. The themes of this work include the importance of relationships, the value of giving and receiving, and the power of a good heart.\n\n\n## Metadata\n- **Source**: All of it Anything Everything At Once/Docu.txt.txt\n- **Type**: document\n- **Tags**: document, All_of_it_Anything_Everything_At_Once, character-design, story, gameplay, mechanic\n- **Imported**: 2025-05-05T16:25:37.053Z",
  "source": {
    "type": "notebook",
    "path": "All of it Anything Everything At Once/Docu.txt.txt",
    "importedAt": "2025-05-05T16:25:37.053Z"
  },
  "created": "2025-05-05T16:25:37.053Z",
  "modified": "2025-05-05T16:25:37.053Z",
  "tags": [
    "document",
    "All_of_it_Anything_Everything_At_Once",
    "character-design",
    "story",
    "gameplay",
    "mechanic"
  ]
}