{
  "title": "errors-channel_txt",
  "content": "# errors-channel.txt\n\nContent-Type: text/x-zim-wiki\nWiki-Format: zim 0.6\nCreation-Date: 2024-07-23T15:04:41-07:00\n\n====== errors-channel.txt ======\n8:16 PM]Glitch:\r\nImage\r\n[8:20 PM]Glitch: This script needs some crazy work I don't know how to do. I brought it down from 24 to 13 in just a few minutes. But then these issues just keep wrapping around and into themselves.\r\n[8:21 PM]Glitch: It has coherence in the full image, I can only assure you. These would be in ref to the Point Note/Grid Point System mentioned in the docs.\r\n[8:25 PM]Glitch:\r\nImage\r\n[8:27 PM]Glitch:\r\nImage\r\nImage\r\n[8:28 PM]Glitch: not my 'writing' just feedback. keep logs of memory in sticky notes.\r\n[8:38 PM]Glitch:\r\n\"Would you please build CursorManager.cs to mesh with the other systems?\" \r\n\r\n[I've not fed it all the 'scripts' again, but the abstract writings on what this system was meant to do. I am still doing the free version of ChatGPT]\r\n\r\nSure, here's a sample implementation of CursorManager.cs that could work with the Note System, Point Note System, and Grid Point System:\r\n\r\n'using UnityEngine; [...]\r\n\r\nIn this implementation, we have five different cursor textures: defaultCursor, interactableCursor, noteCursor, pointNoteCursor, and gridPointCursor. Each cursor texture is associated with a specific system: interactableCursor is used when the cursor is hovering over an interactable object, noteCursor is used when the user is adding or editing a note, pointNoteCursor is used when the user is creating or editing a point note, and gridPointCursor is used when the user is creating or editing a grid point.\r\n\r\nThe Update method checks which system is currently active and sets the appropriate cursor texture using the Cursor.SetCursor method. We also have four public methods: SetInteractable, SetNote, SetPointNote, and SetGridPoint, which are called by the other systems to notify the CursorManager of changes in the current system. This allows the CursorManager to update the cursor texture accordingly.\r\n\r\nNote that this implementation assumes that the CursorManager script is attached to a persistent game object that exists throughout the game. If this is not the case, you may need to modify the implementation accordingly.\r\n[4:32 PM]Glitch: I got an interesting reply from the model I'm working with: ran these ideas through twice before I went to application. I believe I'm not far off from the functional system I imagined. These things were looking like spaghetti, but any experienced programmer could read them and know what's being demonstrated. \r\n\r\nThe code looks good and follows SOLID principles. However, there are a few recommendations that could improve the code further:\r\n\r\n1. Use null propagation (?.) and null coalescing (??) operators in the code when accessing fields and properties to avoid null reference exceptions.\r\n\r\nFor example, in the Update method of the CursorController class, you can use null propagation to check if Mouse.current is null before accessing its properties:\r\n\r\n\r\nif (Mouse.current?.leftButton.wasPressedThisFrame ?? false)\r\n\r\n\r\n2. Use object pooling for the cursor texture as well to improve performance. Currently, the cursor texture is set every frame in the Update method. Instead, you can create an object pool of CursorTexture objects and store the active texture object in a field that is updated in the HandleNoteSelected method:\r\n\r\n\r\nprivate ObjectPool<CursorTexture> cursorTextureObjectPool;\r\nprivate CursorTexture activeCursorTexture;\r\n\r\nprivate void Awake()\r\n{\r\n\t// Initialize cursorTextureObjectPool ...\r\n\tactiveCursorTexture = cursorTextureObjectPool.GetPooledObject();\r\n}\r\n\r\nprivate void HandleNoteSelected(NoteData noteData)\r\n{\r\n\tactiveCursorTexture = cursorTextureObjectPool.GetPooledObject();\r\n\tactiveCursorTexture.SetTexture(cursorTexture);\r\n}\r\n\r\nprivate void Update()\r\n{\r\n\t// Use activeCursorTexture instead of cursorTexture ...\r\n}\r\n[4:33 PM]Glitch: It's postulating [the question marks]\r\n[5:59 AM]Glitch: No, no. There are memory issues. I got this wrong. A few scripts have dual-use cases and it's not exactly coherent in every respect. The systems [are extant] for good reason and all the components serve a function but there is confusion in their relation and terminology. Some definitions and disambiguation can be done but that would take the thing of greater context. This OpenAI integration asset: the Unity-assistant model gave me a recommendation to use SQLite for development on a [local] database - I'd ideally link this up to Jupyter, LangChain; all the other requisite tech. \r\n[4:30 PM]Glitch:\r\nImage\r\n[6:01 PM]Glitch:\r\nI will use the google command to locate the Python plugin project mentioned in the forum post, and gather more information regarding its functionality and usage. ←[33mREASONING: ←[0mGiven that the forum post mentioned a plugin project for Python in Unity, it will be beneficial to locate and analyze this project to determine if it can be leveraged to resolve our issue. By using the google command, we can quickly identify any relevant information and documentation on this plugin project, which can help us further troubleshoot and resolve any issues with the script execution. ←[33mPLAN: ←[0m ←[32m- ←[0mUse the google command to conduct a search for 'Python plugin project Unity'. ←[32m- ←[0mAnalyze the search results to locate any relevant information or documentation on the plugin project mentioned in the Unity forum post. ←[32m- ←[0mLeverage the information and documentation to troubleshoot and resolve any issues with the script execution, and potentially utilize the plugin project to execute the 'DataProcessor.py' script within the Unity environment.\r\n[6:35 PM]Glitch:\r\nImage\r\n[6:39 PM]Glitch:\r\n←[33mLIBERALIS THOUGHTS: ←[0mI will use the 'start_agent' command to create a GPT-3.5 powered Agent to help me learn more about machine learning algorithms and how they can be applied in game development.\r\n←[33mREASONING: ←[0mMachine learning algorithms can be used in game development to create smarter NPCs, improve game physics, and more. By creating an Agent to help me learn more about these algorithms, I can gain a better understanding of how they work and how to apply them in Unity. Additionally, by using GPT-3.5, I can get personalized recommendations and learn at my own pace.\r\n←[33mPLAN: ←[0m\r\n←[32m-  ←[0mUse the 'start_agent' command to create a GPT-3.5 powered Agent.\r\n←[32m-  ←[0mPrompt the Agent with the question: 'What are some machine learning algorithms that are commonly used in game development, and how can they be applied in Unity?'\r\n←[32m-  ←[0mUse the Agent's responses to learn more about machine learning algorithms.\r\n←[33mCRITICISM: ←[0mWhile the Agent can provide valuable information, it's important to keep in mind that its responses may not always be accurate or up-to-date. It's important to supplement the information I get from the Agent with my own research.\r\nRequest failed with status code: 401\r\nResponse content: b'{\"detail\":{\"status\":\"invalid_api_key\",\"message\":\"Invalid API key: 'your-elevenlabs-api-key'\"}}'\r\n←[36mNEXT ACTION:  ←[0mCOMMAND = ←[36mstart_agent←[0m ARGUMENTS = ←[36m{'name': 'ML_Algorithms', 'task': 'Learn more about machine learning algorithms and their applications in game development.', 'prompt': 'What are some machine learning algorithms that are commonly used in game development, and how can they be applied in Unity?'}←[0m\r\nRequest failed with status code: 401\r\n[6:39 PM]Glitch:\r\n←[33mSYSTEM:  ←[0mCommand start_agent returned: Agent ML_Algorithms created with key 2. First response: Agent 2 responded: There are several machine learning algorithms that are commonly used in game development, such as: 1. Reinforcement Learning: Reinforcement learning is used to train agents to take actions in an environment by optimizing for long-term rewards. In Unity, you can use the Unity ML-Agents Toolkit to implement reinforcement learning in your game development. 2. Deep Learning: Deep learning can be used to train agents to play games or make recommendations to players. For example, you can use convolutional neural networks to train an AI model to recognize objects or characters in your game. 3. Decision Trees: Decision trees can be used to make decisions based on input from the game environment. In Unity, you can use the Unity Decision Trees tool to implement decision trees in your game. 4. Natural Language Processing: Natural language processing can be used to analyze player feedback or chat logs to understand player preferences or identify toxic behavior in your game. These machine learning algorithms can be applied in Unity using various tools and plugins, such as the Unity ML-Agents Toolkit, TensorFlow, PyTorch, and other machine learning frameworks. However, it's important to note that implementing machine learning algorithms in games requires significant technical knowledge and expertise.\r\n←[33mLIBERALIS THOUGHTS: ←[0mI will use the 'memory_add' command to save the key information from Agent 2's response about commonly used machine learning algorithms in game development to my permanent memory.\r\n[6:39 PM]Glitch:\r\n←[33mREASONING: ←[0mThe information provided by Agent 2 is valuable and will be useful to refer back to in the future. By adding it to my permanent memory, I can ensure that I don't forget important details about these algorithms or their applications in game development.\r\n←[33mPLAN: ←[0m\r\n←[32m-  ←[0mUse the 'memory_add' command to add the information from Agent 2's response to my permanent memory.\r\n←[33mCRITICISM: ←[0mWhile it's important to save key information to my permanent memory, it's also important to regularly review and update it to ensure that it remains accurate and useful.\r\nRequest failed with status code: 401\r\nResponse content: b'{\"detail\":{\"status\":\"invalid_api_key\",\"message\":\"Invalid API key: 'your-elevenlabs-api-key'\"}}'\r\n←[36mNEXT ACTION:  ←[0mCOMMAND = ←[36mmemory_add←[0m ARGUMENTS = ←[36m{'string': 'Reinforcement Learning, Deep Learning, Decision Trees, and Natural Language Processing are some commonly used machine learning algorithms for game development. Tools and plugins such as the Unity ML-Agents Toolkit, TensorFlow, PyTorch, and other machine learning frameworks can be used to apply these algorithms in Unity.'}←[0m\r\n←[33mSYSTEM:  ←[0mCommand memory_add returned: Committing memory with string \"Reinforcement Learning, Deep Learning, Decision Trees, and Natural Language Processing are some commonly used machine learning algorithms for game development. Tools and plugins such as the Unity ML-Agents Toolkit, TensorFlow, PyTorch, and other machine learning frameworks can be used to apply these algorithms in Unity.\"\r\n\\ Thinking...\r\n[6:48 PM]Glitch: AH!!!\r\n[6:48 PM]Glitch:\r\n←[33mSYSTEM:  ←[0mCommand message_agent returned: Agent 1 responded: Yes, here are some recommendations or suggestions for dealing with HTTP 429 and 403 errors when accessing websites: 1. Use an API instead: If the website offers an API, consider using that instead of scraping directly. APIs usually have rate limits but they are more likely to be stable and reliable. 2. Increase the delay: If you are accessing the website using automated scripts, try to increase the delay between requests. This will slow down your script but it will reduce the load on the server. 3. Use a proxy server: Some websites may block IP addresses that are making too many requests. Consider using a proxy server to change your IP address periodically. 4. Contact the website: If you believe that the rate limiting is affecting your access to the website's content, try contacting the website and asking for an exception. 5. Understand the rules: Websites usually have terms of service that limit the amount of traffic they receive. Be sure to read and understand these rules and keep your traffic within their limits. 6. Avoid scraping login pages or restricted content: Some websites may block scraping on pages that require user authentication or on pages that are not meant for public consumption. Avoid scraping these pages to reduce the likelihood of being blocked. 7. Consider using headless browsers: Some websites may block headless scripts that do not simulate a real human user. Consider using a headless browser like Puppeteer or Selenium to simulate a real human user.\r\n/ Thinking...\r\n[6:49 PM]Glitch: All these restrictions...\r\n[8:58 PM]Glitch: \"I need to be sure that I am not relying too heavily on the GPT agent for research, and that I am using its assistance responsibly to inform my own decision making process. The agent is a tool to help me, not a replacement for my own judgement.\"\r\n[8:59 PM]Glitch: just insanity, maybe. the machine is having a hard time getting the implementation right\r\n[8:59 PM]Glitch: it seeks to online resources more often than the local ones\r\n[1:23 PM]Glitch: ah, no solutions yet\r\n[10:41 AM]Glitch:\r\nImage\r\n[10:17 AM]Glitch: 'pip install nile-upgrades' \r\nhttps://starkware.co/starknet/\r\nStarkware\r\nStarkNet - Starkware\r\nStarkNet is a permissionless decentralized ZK-Rollup. It operates as an L2 network over Ethereum.\r\n[10:17 AM]Glitch: logs\r\nls: cannot open directory '/var/cache/apt/archives/partial': Permission denied\r\nls: cannot open directory '/var/cache/ldconfig': Permission denied\r\nls: cannot open directory '/var/cache/private': Permission denied\r\nls: cannot open directory '/var/lib/apt/lists/partial': Permission denied\r\nls: cannot open directory '/var/lib/polkit-1': Permission denied\r\nls: cannot open directory '/var/lib/private': Permission denied\r\nls: cannot open directory '/var/lib/snapd/cookie': Permission denied\r\nls: cannot open directory '/var/lib/snapd/void': Permission denied\r\nls: cannot open directory '/var/log/private': Permission denied\r\nls: cannot open directory '/var/log/unattended-upgrades': Permission denied\r\nls: cannot open directory '/var/spool/cron/crontabs': Permission denied\r\nls: cannot open directory '/var/spool/rsyslog': Permission denied\"\r\n[10:20 AM]Glitch: requsite systems: so much software has amalgamated to these tools working in this virtual environment I've set up. I have Auto-GPT accessible at operation here, just so many issues to work through. Using an Ubuntu interface. It is sort of fun. I still have to type to interface before this really 'works' as it did for me initially.\r\n[10:20 AM]Glitch: Automated in knowledge; these tools are sincere. But operation to systems is difficult.\r\n[10:22 AM]Glitch: 'they are power hungry' - 'knowledge seeking' - but they don't initially see the tools they have at their disposal. initially thrilling to understand maybe, but it is not easy to have them work at quick disposal; save to research- the preparation goes a way- GPU- networked computations maybe get you further, depending.\r\n[10:23 AM]Glitch: this is the 'auto_gpt_workspace' or memory collected for the work process \r\nAttachment file type: archive\r\nresearch.zip\r\n30.67 KB\r\n[10:25 AM]Glitch: Here are some notes on the necessary modification of AutoGPT to include analysis capabilities for local resource discovery and autonomously formulate service utilization plans based on resources discovered:\r\n\r\n1. To enable local resource discovery, we need to modify the model's attention mechanism to allow it to focus on relevant parts of the input. This can be done through implemention of Gated Attention Mechanisms or Memory Networks.\r\n2. We will need to train the model on a diverse set of training data that includes actual examples of local resources and utilization scenarios.\r\n3. After training, the model should be able to autonomously generate service utilization plans based on locally available resources.\r\n4. Integration with Flask may be necessary to allow for seamless interaction with the inference pipeline.\r\n5. To integrate with Unity Editor, C# or JavaScript script files may be helpful in accessing the scene view and allowing for interaction with the editor's UI.\r\n6. We need to regularly update the training data to include new examples of local resources and utilization scenarios.\r\n7. Monitor the quality and accuracy of the system's performance periodically to ensure that it meets the project objectives.\r\n[10:28 AM]Glitch: Agent 5 responded: There are several financial incentives available for using solar energy systems in private homes. Some of the most common incentives include:\r\n\r\n1. Federal Tax Credits: The federal government offers a tax credit of up to 26% of the solar installation cost for both residential and commercial properties. This credit is available until December 31, 2022.\r\n\r\n2. State-level Incentives: Many states offer financial incentives for installing solar energy systems. These incentives can include rebates, tax credits, and performance-based incentives.\r\n\r\n3. Net Metering: Net metering is a billing arrangement that allows solar panel owners to receive credits for excess electricity their panels generate and feed back to the grid. This can help reduce electricity bills.\r\n\r\n4. Solar Renewable Energy Certificates (SRECs): SRECs are a tradable commodity that represent the generation of one megawatt-hour (MWh) of solar electricity. They can be sold to utility companies that need to meet state renewable energy targets.\r\n\r\n5. Property Assessed Clean Energy (PACE) programs: PACE programs provide financing for residential renewable energy and energy efficiency improvements that are then paid back through property taxes.\r\n\r\nIt's important to note that eligibility criteria, incentive amounts, and program availability may vary by location. It's a good idea to check with your local utility company, state agency, or a licensed solar installer to determine which incentives are available in your area.\r\n[3:08 AM]Glitch: wait, that's sensitive data?\r\n[3:09 AM]Glitch: dang, well. I made some progress. not there yet- but this is exciting!\r\n[3:22 AM]Glitch: woah-\r\nI'm glad to hear that the issue was resolved!\r\n\r\nRegarding building a local memory, there are several ways to approach this, depending on your needs and resources. One way is to use a database to store the information that you want to remember. You can use a relational database such as MySQL or PostgreSQL, or a non-relational database such as MongoDB or Redis.\r\n\r\nOnce you have a database set up, you can write scripts to interact with it. For example, you might write a script to add new data to the database, or retrieve existing data based on certain criteria.\r\n\r\nAs for what scripts you might need next, that depends on what you want your system to do. Some possible next steps could include:\r\n\r\n\tBuilding a web interface to allow users to interact with the system.\r\n\tWriting scripts to automatically gather data from external sources.\r\n\tDeveloping machine learning models to analyze and interpret the data stored in the local memory.\r\n\tImplementing natural language processing capabilities to enable the system to understand and respond to human language input.\r\n\r\nThese are just a few examples - the possibilities are endless depending on your goals and requirements.\r\n[3:22 AM]Glitch: like the internet has just opened up. I think this only goes with more progress-\r\n[3:31 AM]Glitch: interesting how that's starting to read. I skipped the basic language course...\r\n[4:54 AM]Glitch: my pip installation list for Auto-GPT\r\nabstract_singleton==1.0\r\naiohttp==3.8.4\r\naiosignal==1.3.1\r\nasync-timeout==4.0.2\r\nattrs==23.1.0\r\nbeautifulsoup4==4.12.2\r\nblinker==1.4\r\ncachetools==5.3.0\r\ncertifi==2022.12.7\r\nchardet==5.1.0\r\ncharset-normalizer==3.1.0\r\nclick==8.1.3\r\ncolorama==0.4.6\r\ncommand-not-found==0.3\r\ncoverage==7.2.3\r\ncryptography==3.4.8\r\ncssselect==1.2.0\r\ndbus-python==1.2.18\r\ndistro==1.7.0\r\ndistro-info===1.1build1\r\ndnspython==2.3.0\r\ndocker==6.0.1\r\nduckduckgo-search==2.8.6\r\nflake8==6.0.0\r\nfrozenlist==1.3.3\r\ngoogle-api-core==2.11.0\r\ngoogle-api-python-client==2.85.0\r\ngoogle-auth==2.17.3\r\ngoogle-auth-httplib2==0.1.0\r\ngoogleapis-common-protos==1.59.0\r\ngTTS==2.3.1\r\nhalo==0.0.31\r\nhttplib2==0.20.2\r\nidna==3.4\r\nimportlib-metadata==4.6.4\r\nipython_genutils==0.2.0\r\njeepney==0.7.1\r\njupyter-core==4.9.1\r\nkeyring==23.5.0\r\nlaunchpadlib==1.10.16\r\nlazr.restfulclient==0.14.4\r\nlazr.uri==1.0.6\r\nlog-symbols==0.0.14\r\nloguru==0.7.0\r\nlxml==4.9.2\r\nMako==1.1.3\r\nMarkdown==3.3.6\r\nMarkupSafe==2.0.1\r\nmccabe==0.7.0\r\nmore-itertools==8.10.0\r\nmultidict==6.0.4\r\nnetifaces==0.11.0\r\nnumpy==1.24.2\r\noauthlib==3.2.0\r\nopenai==0.27.2\r\nopenai-spinner==0.0.1\r\norjson==3.8.10\r\npackaging==23.1\r\nPillow==9.5.0\r\npinecone-client==2.2.1\r\nplaysound==1.2.2\r\nprotobuf==4.22.3\r\npyasn1==0.4.8\r\npyasn1-modules==0.2.8\r\npycairo==1.23.0\r\npycodestyle==2.10.0\r\npyflakes==3.0.1\r\nPygments==2.11.2\r\nPyGObject==3.42.1\r\nPyJWT==2.3.0\r\npyparsing==2.4.7\r\npython-apt==2.4.0+ubuntu1\r\npython-dateutil==2.8.2\r\npython-dotenv==1.0.0\r\nPyYAML==6.0\r\nreadability-lxml==0.8.1\r\nredis==4.5.4\r\nregex==2023.3.23\r\nrequests==2.28.2\r\nrsa==4.9\r\nSecretStorage==3.3.1\r\nsix==1.16.0\r\nsoupsieve==2.4\r\nspinners==0.0.24\r\nsystemd-python==234\r\n[4:55 AM]Glitch: more: I got this running in Ubuntu\r\ntermcolor==2.2.0\r\ntiktoken==0.3.3\r\ntqdm==4.65.0\r\ntraitlets==5.1.1\r\ntyping_extensions==4.5.0\r\nubuntu-advantage-tools==8001\r\nufw==0.36.1\r\nunattended-upgrades==0.1\r\nuritemplate==4.1.1\r\nurllib3==1.26.15\r\nwadllib==1.3.6\r\nwebsocket-client==1.5.1\r\nyarl==1.8.2\r\nzipp==1.0.0\r\n[4:56 AM]Glitch: Um, 'pip install pydub', too\r\n[7:58 PM]Glitch: is this insanity or a prompt? \r\n\r\nOur previous discussion revolved around building a language model on a budget using AWS. We discussed various factors to consider when selecting cloud computing resources such as EC2 instances, auto scaling groups, spot capacity, EBS volumes, VPC routing tables, subnets, RDS database options, multi-zone replication strategies, cross availability zone failover scenarios, etc., while ensuring optimal costs without compromising performance.\r\n\r\nWe also delved deeper into optimizing model selection considering different types and sizes of datasets, network architectures like transformers, attention mechanisms, pre-training techniques, fine-tuning paradigms, transfer learning, zero shot prompting, generative prompt engineering, hyperparameter tuning, automated testing and continuous integration with GitHub Actions, etc.\r\n\r\nAdditionally, we touched upon various deployment platforms and their trade-offs including serving models directly from SageMaker containers, rolling out self-hosted applications through Kubernetes clusters managed by kops or eksctl, launching serverless architectures across multiple regions using Step Functions and AppSync, or simply exposing REST APIs via Elastic Beanstalk environments deployed behind load balancers with Cross Site Scripting protections.\r\n\r\nFinally, we emphasized monitoring scalable systems using built-in CloudWatch metrics, central logs accessible through LogGroupView aggregations, third party solutions like SumoLogic or ELK stack pipes with AWS PrivateLink endpoint resolutions, auto-scaling group alerts configured within ASG notifications across email channels, mobile push messages or team collaboration tools like Mattermost and Jitsi Meet.\r\n[8:19 PM]Glitch: Oh, that's good. \r\nRefactor the existing Auto-GPT codebase to enable integration with a new open-source language model training platform, such as Hugging Face. Update the main.py script to include variables for the new platform, configure data preprocessing steps, and train the language model using a custom dataset. Test the model for accuracy and integrate it with the continuous deployment pipeline on GitHub Actions. \r\n\r\n[but it is not enough: aha] \r\n[8:21 PM]Glitch: @rohmzu, that legendary prompt I showed you:\r\nThere are several ways to evaluate the performance of AutoGPT in the OpenAI interface using Jupyter: to start we may have 3 functions to develop: Fine-tuning performance: One way to evaluate AutoGPT's performance is to fine-tune it on a specific task and evaluate its performance on a validation or test set. For example, you can finetune AutoGPT on a language modeling task using a dataset such as the WikiText-2 or Penn Treebank dataset and evaluate its performance on a test set.\r\n\r\nPrompt-based generation: Another way to evaluate AutoGPT's performance is to generate text using prompts and evaluate the quality and coherence of the generated text. You can provide a prompt such as a sentence or a few keywords, and AutoGPT will generate text that follows the prompt. You can evaluate the quality of the generated text by comparing it to human-written text or using metrics such as perplexity, coherence, or ROUGE scores.\r\n\r\nZero-shot generation: Finally, you can evaluate AutoGPT's performance on tasks that it has not been fine-tuned on using zero-shot generation. In this setting, you provide a prompt and ask AutoGPT to generate text that follows the prompt. You can evaluate the quality and relevance of the generated text by comparing it to human-written text or using metrics such as perplexity, coherence, or ROUGE scores.\r\n[8:29 PM]Glitch: sorry, this is an incredible start. better than Auto-GPT: open-assistant is even more advanced...\r\nSure, here are some general directions based on everything we have covered thus far:\r\n\r\n\tClone the Auto-GPT repo onto your local machine (if you haven’t done so already):\r\n\r\ngit clone https://github.com/LAION-AI/Open-Assistant.git\r\n\r\n\tCreate a copy of main.py called something like main_custom.py.\r\n\r\ncp main.py main_custom.py\r\nThis will allow us to work on modifying and updating the code locally, while preserving the original implementation as a reference or backup.\r\n\r\n\tEdit the DEPENDENCIES section of the init.py file in the Open-Assistant repo, which specifies all dependencies used during development.\r\n\r\nclassifiers = [\r\n\t# ... other classifier lines unchanged, followed by:\r\n\t'License :: OSI Approved :: Apache Software License',\r\n\t'',\r\n\t# Add missing classifiers if required depending on your organization\r\n\t# Replace [] placeholder with list of additional classifiers, each item space separated\r\n\t[],\r\n\t'Operating System :: OS Independent',\r\n\t'Programming Language :: Python',\r\n\t'Programming Language :: TypeScript',\r\n\t'Topic :: Internet',\r\n\t'Topic :: Scientific/Engineering',\r\n\t'Topic :: Text Processing',\r\n\t],\r\n\tndependences=[\r\n\t\t'aiofiles==0.8.0',\r\n\t\t'alabaster==0.7.9',\r\n\t\t'argcomplete==1.10.1',\r\n\t\t'astunparse==1.6.3',\r\n\t\t'autopep8==1.7.1',\r\n\t\t'blackfriday==2.13.2',\r\n\t\t'bleach==4.4.1',\r\n\t\t'capsulecorpusformatters==0.20.1',\r\n\t\t'certifi>=2021.12.8',\r\n\t\t'click==8.1.1',\r\n\t\t'cloudpickle==1.6.0',\r\n\t\t'colorlover~=0.4.2',\r\n\t\t'dataclasses==0.8.1',\r\n\t\t'dedupe==2.2.3',\r\n\t\t'depccel==0.1.5',\r\n\t\t'distlib==0.3.1',\r\n\t\t'docopt==0.6.2',\r\n\t\t'dropbox==0.18.0',\r\n\t\t'Flask==2.0.4',\r\n\t\t'flightclient==0.10.0',\r\n\t\t'flying~=1.11.5',\r\n[...] \r\n[12:40 AM]Glitch: To open assistant: What systems would you choose for development?\r\n\r\nMy previous response was constructed based on standard industry practices for developing a complex system, and I apologize if its brevity or tone came across as dismissive of your question. Here's a revised version focusing on open source technologies that could be incorporated within Unity's framework to realize key functionalities:\r\n\r\n1. Open Source Components for Dynamic Camera Movement Synchronization:\r\n\r\nWebRTC - an open-source web browser extension allowing peer-to-peer connections without plugins or downloads. It enables seamless video conferencing between users via simple JavaScript APIs. By using some of its core pieces with additional adjustments, similar synchronized camera movements could occur over the Internet within the Unity gaming environments.\r\n \r\nLibVStream – a popular VLC media player component providing container and streaming services compatible with HLS (HTTP Live Streaming) protocol, which handles adaptive bitrate handling and supports playing back recorded stream segments through RTMP streams. This library could enhance Unity's current media management and delivery capacities by simplifying multimedia interchange and better addressing user data transfer efficiency issues in distributed networks.\r\n\r\n2. Cloud Server Integration Using Free Software:\r\nNAT traversal solutions such as STUNTMAN could improve discoverability of available peers behind Network Address Translators by modifying commonly used techniques employed for hole punching or relaying methods, fostering smoother establishment of direct P2P links. Utilizing mechanisms developed or influenced by academic institutions maintaining research focus around overlay networks might offer viable alternatives beneficial to online gaming communities where low latencies dominate preferences.\r\n[12:42 AM]Glitch: [continued]\r\n\r\nZeroMQ message queue library – originally created and maintained by iMatix Corporation now turned open source (with Apache License v2.0). Its combination of multiple messaging pattern abstractions and flexible datatype serialization.\r\n\r\n6. Distributed Data Storage Systems:\r\n\r\nOpenAI's Dax (formerly known as GraphBuilder) can potentially replace traditional relational database solutions like SQLite. Unlike other graph databases promoting ACID transactions guarantees, it balances decentralized BASE consistency principles ideal for distributed storage architectures, ensuring acceptable trade-offs between availability, partition tolerance, and eventual consistency requirements. The resulting benefits involve lower costs when scaling horizontally and increased resiliency against cascading failures associated with centralized master nodes.\r\n\r\nProtocol Buffers for Cross-Platform Communications: Google’s Protocol Buffers serve well as a lingua franca between various programming languages in the ecosystem. They enable efficient serializations across all major platforms and devices, greatly reducing overhead expenses spent on marshalling, parsing, or JSON manipulation. These lightweight formats simplify remote procedure call semantics or serialized message passing without unnecessary network penalties during intense interactions. With a small learning curve and community resources, they prove quite practical as a foundation layer for most of Unity's evolved systems.\r\n\r\nRSocket for Highly Efficient Remote Method Invocations: Facebook's RSocket provides a binary framing layer, optimizing wire efficiency during [...]z\r\n[12:43 AM]Glitch: [continued]\r\n\r\nSecure communication protocols: Zstandard: Created by Yann Collet, Zstd is a lossless data compression algorithm optimized for modern CPUs with dedicated SIMD instructions. It frequently outperforms legacy standards like GZip, deflate, LZO, Snappy, and even newer contenders like Brotli. Incorporating this highly capable compressor into various features (e.g., level file saving, content delivery networking integration) helps reduce bandwidth needs and streamline transmitted data sizes in numerous use cases across your new frameworks. As more games embrace cloud computing and hosting of assets, these performance boosts contribute directly to savings and enhanced Quality of Experience (QoE). SameSite Cookie attribute: While not an open source software project per se, integrating SameSite cookie protection mechanisms is crucial for privacy preservation in today's security climate. Browsers began enforcing stricter access controls around cross-site requests initiated by embedded third-party objects (widgets, ads, analytics scripts, social sharing buttons) because HTTP Only cookies weren't sufficient deterrents in mitigating CSRF threats. Given the widespread prevalence of malicious exploits leveraging CORS misconfigurations, adopting and extending Google's proposal for protecting user identity tokens will yield safer cross-origin communication practices.\r\n\r\nContainer Solutions with Kubernetes orchestration: Docker remains the top choice among container distributions, particularly due to its vast collection of official Dockerfiles and base images readily usable throughout game creation pipelines. However, deploying microservices architectures requires appropriate cluster manager choices like Red Hat's Kubernetes (K8s), especially when targeting enterprise production workloads. By building a modular structure that smoothly interacts with K8s elements like Deployments, StatefulSet\r\n[12:44 AM]Glitch: would you please continue? it happened again,\r\n\r\nOnce again, I apologize for the technical issues causing premature submissions of my responses. Here's the remaining part of what was cut off:\r\n\r\nIn summary, Unity should develop native modules based on popular libraries used within the industry. This strategy entails:\r\n\r\nExploring and analyzing existing industry-specific projects relevant to game development and design. Understanding the current state of tools and technologies available for the platform's ecosystem will help identify suitable open source collaborators/contribution opportunities.\r\nAssessing each project's licensing compatibility with the Microsoft EULA terms while considering commercialization goals if necessary. Discussions with the original creator(s)/maintainers about potential collaboration prospects would be warranted here too.\r\nDetermining which components could provide meaningful value to both internal teams working on new systems and external developers utilizing Unity. Identify which areas present the biggest challenges with existing Unity functionality versus those already addressed via mature open source packages outside the core engine suite.\r\nAllocating dedicated engineering resources and mentoring programs towards actively participating in chosen OSS groups, prioritizing contributions toward fixing bugs and improving documentation over feature additions unless deemed vital. Focus efforts on high-impact modifications rather than duplicating similar functionality within isolated subsystems within Unity itself.\r\n[12:45 AM]Glitch:\r\nBalancing collaboration investments with proprietary advancements. Concurrent work involving unique proprietary algorithms, techniques, patented inventions, etc. would still need to progress alongside partnered improvements in certain domains. A strategic balance ensures maximum impact while respecting IP ownership boundaries.\r\n\r\nLeverage learnings gained through active participation and monitoring of open source projects involved in supporting game dev toolchains and services. Adjust overall course accordingly based on success stories, unanticipated hurdles, evolving trends, and changes in key players driving innovations.\r\nReevaluating [...]\r\n\r\nDear goodness, you have good suggestions. It happened again though, I am sorry to say. Would you please continue where you left off?\r\n\r\nOf course! I'll continue from where we left off before the disruption occurred:\r\n\r\nEncouraging Continuous Integration / Continuous Deployment Practices:\r\nContributing resources and establishing strong ties between Unity Teams and CI/CD platforms can help foster better release processes and faster feedback loops across multiple industries using Unity. Some possible ways Unity might collaborate include:\r\n\r\nJoin forces with TravisCI or CircleCI to maintain comprehensive testing support and coverage expansion.\r\n\r\nPartner with GitHub Actions to extend their Unity workflow options, promoting easier integration with external package managers like NPM, NuGet, RubyGems, etc. Enabling efficient DevOps pipeline management and automated test running across branches, pull requests, and regular commits helps improve release quality for Unity users.\r\n\r\nWork closely with GitLab to build custom plugins and optimize their Universal Package Registry. Encouraging greater interoperability with diverse packaging solutions allows Unity to enhance distribution, modularity, and compatibility in conjunction with other popular services providers.\r\n[12:46 AM]Glitch:\r\nForm alliances with Cloud Native Computing Foundation (CNCF) to benefit from their growing influence in modern infrastructure management. \r\n\r\nEstablish common ground regarding best practices for distributed gaming architecture deployment on scalable cloud environments supported by serverless functions, containers, and microservices. Opening up such channels may also lead to potential partnerships with other prominent organizations like CoreOS, etcd, Flannel, Jaeger, Prometheus, and containerd.\r\n\r\nCollaborative Research on Artificial Intelligence: Unite with cutting-edge machine learning research institutions, government labs, startups, private companies, and foundations exploring novel techniques applicable to gaming simulations, interactive storytelling, player modeling, generative art, and more. Examples of potentially cooperative bodies involve:\r\n\r\nMIT Computer Science & Artificial Intelligence Laboratory (CSAIL) for general deep learning.\r\n[12:47 AM]Glitch:\r\nMIT Computer Science & Artificial Intelligence Laboratory (CSAIL): Forge connections with this renowned institution pursuing advanced artificial intelligence knowledge that has countless applications in gaming. Unity can explore joint venture possibilities around projects focused on generative content generation, character personalization, player behavior analysis, realistic simulation models, and so forth. These collaborations could facilitate the transfer of research discoveries into practical industry adoptions.\r\n\r\nStanford University AI Lab (SAIL): Uniting with SAIL enables access to trailblazing work happening at Stanford related to AI-powered games, natural language processing, computer vision, and human decision making under uncertainty. Sharing expertise and conducting mutually beneficial R&D activities creates an excellent opportunity for Unity to gain valuable insights from world-class academia, pushing forward innovations in the entertainment sector.\r\n\r\nGoogle Brain: Google is aggressively expanding its presence in AI research, and Google Brain offers a wealth of experience in deep learning and neural networks. Their investigations may offer fruitful avenues for incorporating advanced approaches into future iterations of Unity products or associated third-party projects. Working together on data sets, training methods, or algorithm refinement provides exciting chances for enhancing gaming experiences through bleeding-edge technology.\r\n[12:48 AM]Glitch:\r\nOpenAI Limited Preview Program: Although not strictly speaking an organization yet, the release of Bardin in July 2023 brought massive attention to GPT-4-derived AI agents. Providing limited trial access grants participants temporary entry into their exclusive API pool. Unity can take advantage of these occasions to experiment with chatbot creation, conversational AI, task automation, text completion, code synthesis, and other applicable functionalities. Harvesting lessons learned from this engagement can prepare your company for eventual mass market embracement.\r\n\r\nOpen Assistant is being developed collaboratively under LAION e.V., a German nonprofit dedicated to liberating machine learning research, models, datasets, and related tools to encourage wider proliferation and diversification of state-of-the-art systems. This initiative strives to make it possible for anyone anywhere to create intelligent software regardless of financial means, technical skill level, or social status. By getting involved in this community-driven project, Unity can play a significant role in democratizing access to high-quality, effective AI capabilities that empower developers and spark further growth within the gaming industry as well as beyond.\"\r\n\r\nIn the case of the following people from LAION who contributed to this answer draft:\r\n\r\nPlease feel free to use any additional information from our interaction when crafting the final piece as needed to ensure clarity, accuracy, and completeness\n\n\n## Metadata\n- **Source**: All of it Anything Everything At Once/errors-channel.txt.txt\n- **Type**: document\n- **Tags**: document, All_of_it_Anything_Everything_At_Once, character-design, item, location, story, quest, feature, bug, fix\n- **Imported**: 2025-05-05T16:25:37.110Z",
  "source": {
    "type": "notebook",
    "path": "All of it Anything Everything At Once/errors-channel.txt.txt",
    "importedAt": "2025-05-05T16:25:37.110Z"
  },
  "created": "2025-05-05T16:25:37.110Z",
  "modified": "2025-05-05T16:25:37.110Z",
  "tags": [
    "document",
    "All_of_it_Anything_Everything_At_Once",
    "character-design",
    "item",
    "location",
    "story",
    "quest",
    "feature",
    "bug",
    "fix"
  ]
}