{
  "title": "Grand_Voss_txt",
  "content": "# Grand_Voss.txt\n\nContent-Type: text/x-zim-wiki\nWiki-Format: zim 0.6\nCreation-Date: 2024-08-15T21:58:37-07:00\n\n====== Grand Voss.txt ======\n- Summary\r\nMotivations\r\nLocations\r\n- Nordis The city of Northern Light (Mistranslated from Nordlys; north ice, by the humans)\r\n\r\n- Language\r\nDemonym (Vossan)\r\n\r\n- Technology\r\nAgriculture\r\nThe menesk harvesting areas use cloned plants for a food source (potential for widespread infection)\r\n\r\n- Culture\r\nMenesk must pass a test before they get a parenting license. Classes for those who need it and you can always re-apply. If you can't demonstrate the basic ability to raise a child, you just don't get to have one.\r\neco burial pods for Evolutis_menesk death\r\nBokmål (Norwegian), Homo ludens (binomial nomenclature that means 'playing man'), Cank (derogatory term), Svalbard 'Svalh-barr' (cool/cold edge, referencing the mountains and steep shores)\r\n\r\n- Government\r\nMenesk have Universal basic income.\r\nArmy (Hæren) Motto: For alt vi har. Og alt vi er. (For all we have. And all we are.)\n\n\n## Metadata\n- **Source**: All of it Anything Everything At Once/Grand_Voss.txt.txt\n- **Type**: document\n- **Tags**: document, All_of_it_Anything_Everything_At_Once, location\n- **Imported**: 2025-05-05T16:25:37.059Z",
  "source": {
    "type": "notebook",
    "path": "All of it Anything Everything At Once/Grand_Voss.txt.txt",
    "importedAt": "2025-05-05T16:25:37.059Z"
  },
  "created": "2025-05-05T16:25:37.059Z",
  "modified": "2025-05-05T16:25:37.059Z",
  "tags": [
    "document",
    "All_of_it_Anything_Everything_At_Once",
    "location"
  ]
}