{
  "title": "help-imp_txt",
  "content": "# help-imp.txt\n\nContent-Type: text/x-zim-wiki\nWiki-Format: zim 0.6\nCreation-Date: 2024-07-23T15:11:09-07:00\n\n====== help-imp.txt ======\ninstall --help\r\nUsage: install [OPTION]... [-T] SOURCE DEST\r\n  or:  install [OPTION]... SOURCE... DIRECTORY\r\n  or:  install [OPTION]... -t DIRECTORY SOURCE...\r\n  or:  install [OPTION]... -d DIRECTORY...\r\n\r\nThis install program copies files (often just compiled) into destination\r\nlocations you choose.  If you want to download and install a ready-to-use\r\npackage on a GNU/Linux system, you should instead be using a package manager\r\nlike yum(1) or apt-get(1).\r\n\r\nIn the first three forms, copy SOURCE to DEST or multiple SOURCE(s) to\r\nthe existing DIRECTORY, while setting permission modes and owner/group.\r\nIn the 4th form, create all components of the given DIRECTORY(ies).\r\n\r\nMandatory arguments to long options are mandatory for short options too.\r\n\t  --backup[=CONTROL]  make a backup of each existing destination file\r\n  -b                  like --backup but does not accept an argument\r\n  -c                  (ignored)\r\n  -C, --compare       compare each pair of source and destination files, and\r\n\t\t\t\t\t\tin some cases, do not modify the destination at all\r\n  -d, --directory     treat all arguments as directory names; create all\r\n\t\t\t\t\t\tcomponents of the specified directories\r\n  -D                  create all leading components of DEST except the last,\r\n\t\t\t\t\t\tor all components of --target-directory,\r\n\t\t\t\t\t\tthen copy SOURCE to DEST\r\n  -g, --group=GROUP   set group ownership, instead of process' current group\r\n  -m, --mode=MODE     set permission mode (as in chmod), instead of rwxr-xr-x\r\n  -o, --owner=OWNER   set ownership (super-user only)\r\n  -p, --preserve-timestamps   apply access/modification times of SOURCE files\r\n\t\t\t\t\t\tto corresponding destination files\r\n  -s, --strip         strip symbol tables\r\n\t  --strip-program=PROGRAM  program used to strip binaries\r\n  -S, --suffix=SUFFIX  override the usual backup suffix\r\n  -t, --target-directory=DIRECTORY  copy all SOURCE arguments into DIRECTORY\r\n  -T, --no-target-directory  treat DEST as a normal file\r\n  -v, --verbose       print the name of each directory as it is created\r\n\t  --preserve-context  preserve SELinux security context\r\n  -Z                      set SELinux security context of destination\r\n\t\t\t\t\t\t\tfile and each created directory to default type\r\n\t  --context[=CTX]     like -Z, or if CTX is specified then set the\r\n\t\t\t\t\t\t\tSELinux or SMACK security context to CTX\r\n\t  --help     display this help and exit\r\n\t  --version  output version information and exit\r\n\r\nThe backup suffix is '~', unless set with --suffix or SIMPLE_BACKUP_SUFFIX.\r\nThe version control method may be selected via the --backup option or through\r\nthe VERSION_CONTROL environment variable.  Here are the values:\r\n\r\n  none, off       never make backups (even if --backup is given)\r\n  numbered, t     make numbered backups\r\n  existing, nil   numbered if numbered backups exist, simple otherwise\r\n  simple, never   always make simple backups\r\n\r\nGNU coreutils online help: <https://www.gnu.org/software/coreutils/>\r\nReport any translation bugs to <https://translationproject.org/team/>\r\nFull documentation <https://www.gnu.org/software/coreutils/install>\r\nor available locally via: info '(coreutils) install invocation'\n\n\n## Metadata\n- **Source**: All of it Anything Everything At Once/help-imp.txt.txt\n- **Type**: document\n- **Tags**: document, All_of_it_Anything_Everything_At_Once, location, bug, fix\n- **Imported**: 2025-05-05T16:25:37.139Z",
  "source": {
    "type": "notebook",
    "path": "All of it Anything Everything At Once/help-imp.txt.txt",
    "importedAt": "2025-05-05T16:25:37.139Z"
  },
  "created": "2025-05-05T16:25:37.139Z",
  "modified": "2025-05-05T16:25:37.139Z",
  "tags": [
    "document",
    "All_of_it_Anything_Everything_At_Once",
    "location",
    "bug",
    "fix"
  ]
}