{
  "title": "HSE_Suit",
  "content": "# HSE_Suit\n\nContent-Type: text/x-zim-wiki\nWiki-Format: zim 0.6\nCreation-Date: 2025-03-10T15:45:02-07:00\n\n====== HSE Suit ======\nHermetically Sealed Environment Suit\noriginal armor looks like EVA suits. Newer armor looks more akin to Halo power armor\ndaredevil mask - no eye sockets. possible design for helmet\narmor addons create visual variation if the armor design never changes (with exception to skins, of course)\nEVA Suits are essentially 'under-armor' and the defense plating is stacked on top of it.\nUse exo-armor to augment strength. Male and Female soldiers only differ in weight. It can also be used in sports to balance physical power.\n\n\n\n## Metadata\n- **Source**: on-command-wiki-pages/HSE_Suit.txt\n- **Type**: wiki\n- **Tags**: wiki, on-command-wiki-pages\n- **Imported**: 2025-05-05T16:25:37.226Z",
  "source": {
    "type": "notebook",
    "path": "on-command-wiki-pages/HSE_Suit.txt",
    "importedAt": "2025-05-05T16:25:37.226Z"
  },
  "created": "2025-05-05T16:25:37.226Z",
  "modified": "2025-05-05T16:25:37.226Z",
  "tags": [
    "wiki",
    "on-command-wiki-pages"
  ]
}