{
  "title": "ICON_Interview_txt",
  "content": "# ICON_Interview.txt\n\nContent-Type: text/x-zim-wiki\nWiki-Format: zim 0.6\nCreation-Date: 2024-07-23T15:13:22-07:00\n\n====== ICON Interview.txt ======\nTHINGS I LIKE ABOUT IT - Construction Print Technician\r\n- We're providing housing for people in need all over the world!\r\n- CONSTRUCTION & DEMOLITION ARE RESPONSIBLE FOR ALMOST 40% OF GLOBAL EMISSIONS!\r\n- Printing your home comes with greater freedom of design!\r\n- over 1 billion people live without adequate, sustainable shelter.\r\n- these homes are affordable and rapid-production means we can meet those needs quickly.\r\n- can withstand the changing climate for generations as we try to undo damage\r\n\r\nMY OWN OUTLOOK\r\n- I thought my siblings and I would be renting for the rest of our lives\r\n- Eager to effect some positive change in the world and I can see myself doing this.\r\n- If congress can't extend the moratorium tomorrow, millions will face eviction\r\n- According to the NAA, 10 million people have a collective rent debt of over 57 billion\r\n- of the 46 billion in renters assistance given to the U.S. Secretary, only 3 billion--\r\n- I'll happily give you decades of my life if this is what I'll be living it for.\r\n- I'm prepared to travel as much as needed and would be willing to relocate.\r\n- comfortable outdoors; (Florida) in high heat, (Michigan) freezing cold, rain\r\n\r\nQUESTIONS (to Joshua)\r\n- What's your ERG? Mentions 'space for community, sharing, learning, and growth'\r\n- Size of teams, transport of supplies, replacement parts, repairs and maintence.\r\n- Supplying materials, supervising machines, and answering resident questions.\r\n- How do you insulate the homes and is there any intent to make them passively cooled?\r\n- How do you conduct training? Could I train in Texas and still live in Nevada?\r\n\r\nRESPONSIBILITIES\r\n- Supports large-scale concrete 3D printers for the construction of houses.\r\n- Setup, operation, and troubleshooting of ICON’s Vulcan concrete 3D printing equipment on construction sites in Texas and worldwide.\r\n- Daily setup and cleaning of all required tools and equipment.\r\n- Interacting and understanding the various Vulcan 3D printing subsystems: pumps, hoses, electrical, motors, controls, and software.\r\n\r\nVULCAN 3D PRINTING EQUIPMENT\r\n- single-story homes up to 3,000 square feet\r\n- avoids material waste bricks, plaster, drywall, and general derbis.\r\n- BuildOS Software directs the Magma System in printing Lavacrete blends.\r\n- Lavacrete's ability to retain its form enables quickly printed homes.\r\n- str. of 6,000 psi can withstand extreme weather and Natural Disasters\r\n\r\nCOMMUNITY FIRST! VILLAGE - Austin, TX\r\n- 400 sq. ft. 1 bedroom, 1 bath, livingroom, bathroom, and expansive porch.\r\n- Austin, TX; non-profit organization to shelter the chronically homeless\r\n\r\nTABASCO, MEXICO\r\n- Non-profit organization New Story\r\n- granted to local families facing extreme poverty\r\n- 500 sq. ft. Homes printed in 24 hours! \r\n- kitchen, bath, two bedrooms, and a livingroom\r\n- engineered to withstand seismic conditions above the safety standard\r\n- Homes that will last generations!\r\n\r\nEAST 17TH STREET RESIDENCES\r\n- with developer 3Strands; producing the first 3d printed homes in America\r\n- ranging from 900 sq. ft. to 2,000 sq. ft. 2 and 4 bedroom configurations\r\n\r\nOVERLAND PARTNERS & 3Strands\r\n- considerations to ecology, energy efficiency, and water management.\r\n- single-family home that helps to address the loneliness epidemic by facilitating natural, informal interactions with neighbors to foster a community.\r\n\r\nBENEFITS AND PERKS\r\n- medical, dental, vison, disability, life insurance, FSA, HSA\r\n- family and parental leave\r\n- catered snacks and beverages on-site\r\n- ERG 'Just ICON' makes space for community, sharing, learning, and growth\r\n- Work hard, play hard. Enjoy our 'use what you need' time away from work\r\n- BUILD FOR THE FUTURE; includes employee stock options, 401K, and Roth IRA\r\n\r\nConstruction Print Technician\r\nReports to: \t\tHead of Construction\r\nVacation: \t\tOpen\r\nTravel Requirements: \tHeavy (At least 50% of the time)\r\nStart Date: \t\tASAP\r\nLocation: \t\tAustin, TX\r\n\r\nQUALIFICATIONS\r\n- Highly detailed, checking modules for raised cells, dents, and other imperfections\r\n- Familiar with both manual and automated gantry, and note the differences\r\n- Building relationships to improve productivity and our overall social health\r\n- Advocate for quality control to ensure safe products when they're off the line\r\n\r\nDESIRED QUALIFICATIONS\r\n- Technical degree, professional certification, or 2+ years’ experience in a related field\r\n- Strong verbal and written communications skills\r\n- Experience in the construction or mechanical industry \r\n- Desire to work in a team setting\r\n- Innovative, driven, out of the box thinker, self-motivated to investigate and - implement new ideas, and proactive in overcoming obstacles\r\n- Ability to prioritize and stay calm in a dynamic start-up environment\r\n- Must be able to lift 50 pounds.\r\n\r\nPREFERRED SKILLS AND EXPERIENCE\r\n- Prior experience working with heavy machinery \r\n- Speaks Spanish\r\n- Prior start-up experience\r\n- Comfortable in rigorous physical outdoor situations\n\n\n## Metadata\n- **Source**: All of it Anything Everything At Once/ICON_Interview.txt.txt\n- **Type**: document\n- **Tags**: document, All_of_it_Anything_Everything_At_Once, location, story, quest, mechanic\n- **Imported**: 2025-05-05T16:25:37.062Z",
  "source": {
    "type": "notebook",
    "path": "All of it Anything Everything At Once/ICON_Interview.txt.txt",
    "importedAt": "2025-05-05T16:25:37.062Z"
  },
  "created": "2025-05-05T16:25:37.062Z",
  "modified": "2025-05-05T16:25:37.062Z",
  "tags": [
    "document",
    "All_of_it_Anything_Everything_At_Once",
    "location",
    "story",
    "quest",
    "mechanic"
  ]
}