{
  "title": "if_only_i_might_see_others",
  "content": "# if_only_i_might_see_others\n\nContent-Type: text/x-zim-wiki\nWiki-Format: zim 0.6\nCreation-Date: 2024-07-23T15:14:12-07:00\n\n====== ~~if only i might see others~~ ======\ni have not done enough\n\n\"To find them again though, in this labyrinth? \n\nPlease tell me you have a plan, buddy.\"\n\nThe Gyre: Self-forwarding machines with an isolated language: largely pacifists but do not heed attention to humans. Though they have a strange moral compass as seen in their behavior.\n\n\"Those machines were our allies, dear friend. They may not help us. We are stuck. Effectively unusable like we are! A waste!!\n\n\"Pip: ...You would give up because they could not talk to you? \n\nWilmet: ... They threw me Pip. I could have died just like that. You could not have caught me- HAHA let alone carry my weight! \n\nPip: ... I am glad you are okay, despite it.\n\nWilmet: Well, yeah- you need a Lever like me for this. (scoffs)\n\n-- Why would I fret over a thing like losing the one soul I have?\n\nYou are right, Pip. \n\nLet's catch up so we can spare them the agony of it.\"\n\n\n## Metadata\n- **Source**: All of it Anything Everything At Once/if_only_i_might_see_others.txt\n- **Type**: document\n- **Tags**: document, All_of_it_Anything_Everything_At_Once\n- **Imported**: 2025-05-05T16:25:37.141Z",
  "source": {
    "type": "notebook",
    "path": "All of it Anything Everything At Once/if_only_i_might_see_others.txt",
    "importedAt": "2025-05-05T16:25:37.141Z"
  },
  "created": "2025-05-05T16:25:37.141Z",
  "modified": "2025-05-05T16:25:37.141Z",
  "tags": [
    "document",
    "All_of_it_Anything_Everything_At_Once"
  ]
}