{
  "title": "Instead_of_Said_txt",
  "content": "# Instead_of_Said.txt\n\nContent-Type: text/x-zim-wiki\nWiki-Format: zim 0.6\nCreation-Date: 2024-08-15T21:58:18-07:00\n\n====== Instead of Said.txt ======\naccuse \r\nacknowledged\t\r\nadded\t\r\naddressed\t\r\nadmitted\r\nadvised\t\r\naffirmed\t\r\nagreed\t\r\nannounced\t\r\nanswered\r\napologized\t\r\napproved\t\r\nargued\t\r\narticulated \r\nasked\r\nasserted\t\r\nassured \r\navowed: that has been asserted, admitted, or stated publicly.\r\nbabbled\t\r\nbadgered: ask (someone) repeatedly and annoyingly for something; pester.\r\nbarked\t\r\nbawled\t\r\nbeamed\t\r\nbegan\t\r\nbegged\r\nbellowed\t\r\nbet\t\r\nbickered\t\r\nbleated\t\r\nblubbered \r\nblurted\t\r\nboasted \r\nboomed\t\r\nbragged\t\r\nbreathed\r\nbroke in\t\r\nbubbled\t\r\nbugged\t\r\nburst out\t\r\ncackled \r\ncajoled: persuade someone to do something by sustained coaxing or flattery.\r\ncalled\t\r\ncautioned\t\r\nchallenged\t\r\nchatted\r\nchattered\t\r\ncheered\t\r\nchided: scold or rebuke.\r\nchimed in\t\r\nchirped\r\nchittered\t\r\nchoked\t\r\nchortled\t\r\nchorused\t\r\nchuckled\r\nclaimed\t\r\nclarified\t\r\nclipped: having short, sharp vowel sounds and clear pronunciation.\r\nclucked\t\r\ncoached\r\ncoaxed\t\r\ncomforted\t\r\ncommanded\t\r\ncommented\t\r\ncomplained\r\ncomplimented \r\nconceded\t\r\nconcluded\t\r\nconcurred \r\nconfessed\r\nconfided\t\r\nconfirmed \r\ncongratulated\t\r\ncontinued\t\r\ncontributed \r\nconvinced\t\r\ncooed\t\r\ncorrected\t\r\ncoughed\t\r\ncountered\r\ncried\t\r\ncroaked\t\r\ncrowed\t\r\ncursed\t\r\ndared\r\ndecided\t\r\ndeclared\t\r\ndefended \r\ndemanded\t\r\ndemurred: to make objection, especially on the grounds of scruples; take exception; object.\r\ndenied\t\r\ndescribed\t\r\ndisagreed\t\r\ndisclosed\t\r\ndivulged\r\ndoubted\t\r\ndrawled\t\r\ndribbled\t\r\nechoed\t\r\neffused: to talk in an unrestrained, excited manner.\r\nencouraged \r\nended\t\r\nexasperated: to irritate or provoke high degree; annoy extremely.\r\nexclaimed \r\nexplained\r\nexploded: to burst forth violently or emotionally, especially with noise, laughter, or violent speech.\r\nexulted: to show or feel a lively or triumphant joy; rejoice exceedingly; be highly elated or jubilant.\r\nfinished\t\r\nfretted: be constantly or visibly worried or anxious.\r\ngasped\r\ngawked\t\r\ngently\t\r\ngibed: to make insulting, taunting, heckling, or jeering remarks.\r\ngiggled\t\r\ngloated\r\ngoaded: provoke or annoy (someone) so as to stimulate some action or reaction.\r\ngreeted\t\r\ngrimaced \r\ngroaned\t\r\ngrowled\r\ngrunted\t\r\ngrumbled\t\r\nguessed\t\r\ngulped\t\r\ngurgled\r\ngushed\t\r\nharshley\r\nhinted\t\r\nhissed\t\r\nhollered\r\nhowled\t\r\nhuffed\t\r\nhummed: an inarticulate sound uttered in contemplation, hesitation, dissatisfaction, doubt, etc.\r\nhypothesized\t\r\nimitated\r\nimplied\t\r\ninformed\t\r\ninquired\t\r\ninsisted\t\r\ninsulted\r\ninterjected\t\r\ninterrupted\t\r\nintoned: say or recite with little rise and fall of the pitch of the voice.\r\ninstructed\t\r\njeered\r\njested\t\r\njibed: make insulting or mocking remarks.\r\njoked\t\r\nlamented: a conventional way of describing someone who has died or something that has been lost or that has ceased to exist.\r\nlaughed\r\nlectured\t\r\nlied\t\r\nlisped\t\r\nmaintained\t\r\nmarveled \r\nmentioned\t\r\nmimicked\t\r\nmoaned\t\r\nmumbled\t\r\nmurmured\r\nmused: to be absorbed in thought.\r\nmocked \r\nmotioned\t\r\nmuttered\t\r\nnagged\r\nnodded\t\r\nnoted\t\r\nnotified\t\r\nobjected\t\r\nobserved\r\noffered\t\r\nopined \r\nordered\t\r\npanted\t\r\nperplexed \r\npestered\t\r\npiped\t\r\npleaded\t\r\npled\t\r\npointed out\r\npondered\t\r\npraised\tprayed\t\r\nproclaimed\t\r\npromised\r\npronounced\t\r\nproposed\t\r\nprotested\t\r\nprovoked\t\r\npurred\r\nput in\t\r\npuzzled \r\nquavered\t\r\nqueried\t\r\nquestioned\r\nquietly \r\nquipped\t\r\nquizzed \r\nquoted\t\r\nraged \r\nranted\t\r\nreasoned \r\nreassured\t\r\nrecalled\t\r\nreckoned\r\nrecounted \r\nreiterated \r\nrelated\t\r\nremarked\t\r\nremembered\r\nreminded\t\r\nrepeated\t\r\nreplied\t\r\nreported\t\r\nrequested\r\nresounded\t\r\nresponded\t\r\nretaliated \r\nretorted\t\r\nrevealed\r\nridiculed\t\r\nroared\t\r\nsang\t\r\nsassed\t\r\nscreamed\r\nscoffed\t\r\nscolded\t\r\nseethed\t\r\nshot\t\r\nshouted\r\nshrieked\t\r\nshrilled\t\r\nsighed\t\r\nsimpered: to smile in a silly, self-conscious way.\r\nslurred\r\nsmiled\t\r\nsmirked\t\r\nsnapped\t\r\nsnarled\t\r\nsneered\r\nsneezed \r\nsnickered\t\r\nsniffed\t\r\nsniffled\t\r\nsnorted\r\nspat \r\nspeculated\t\r\nspoke\t\r\nsobbed\t\r\nspilled: to divulge, disclose, or tell.\r\nspluttered \t\r\nsqueaked\t\r\nsquealed\t \r\nstammered\t\r\nstarted \r\nstated\t\r\nstormed\t\r\nstressed \r\nstuttered\t\r\nsuggested\t\r\nsurmised\t\r\ntaunted\t\r\ntauntingly\r\nteased\t\r\ntempted\t\r\ntested\t\r\ntestified \r\nthreatened\t\r\ntold\t\r\ntrilled\t\r\nthanked\t\r\nuttered\r\nvolunteered\t\r\nvowed\t\r\nwailed\t\r\nurged\t\r\nwarned\r\nwent on\t\r\nwept\t\r\nwheezed\t\r\nwhimpered\t\r\nwhined\r\nwhispered\t\r\nwondered \r\nworried\t\r\nyawned\t\r\nyakked\r\nyelled \r\nyelped\n\n\n## Metadata\n- **Source**: All of it Anything Everything At Once/Instead_of_Said.txt.txt\n- **Type**: document\n- **Tags**: document, All_of_it_Anything_Everything_At_Once, quest, bug\n- **Imported**: 2025-05-05T16:25:37.063Z",
  "source": {
    "type": "notebook",
    "path": "All of it Anything Everything At Once/Instead_of_Said.txt.txt",
    "importedAt": "2025-05-05T16:25:37.063Z"
  },
  "created": "2025-05-05T16:25:37.063Z",
  "modified": "2025-05-05T16:25:37.063Z",
  "tags": [
    "document",
    "All_of_it_Anything_Everything_At_Once",
    "quest",
    "bug"
  ]
}