{
  "title": "jupyter-text-channel_txt",
  "content": "# jupyter-text-channel.txt\n\nContent-Type: text/x-zim-wiki\nWiki-Format: zim 0.6\nCreation-Date: 2024-07-23T15:16:01-07:00\n\n====== jupyter-text-channel.txt ======\n9:26 AM]Glitch: https://docs.jupyter.org/en/latest/index.html\r\nImage\r\n[9:26 AM]Glitch: https://docs.jupyter.org/en/latest/use/use-cases/content-user.html\r\nNarratives are collaborative, shareable, publishable, and reproducible. We believe that Narratives help both yourself and other researchers by sharing your use of Jupyter projects, technical specifics of your deployment, and installation and configuration tips so that others can learn from your experiences.\r\n[9:27 AM]Glitch: https://docs.jupyter.org/en/latest/projects/content-projects.html\r\nThe Jupyter community is composed of several sub-communities and projects. These are organized around particular use-cases, users, or other aspects of the Jupyter community. This section contains information to help navigate these projects both from the perspective of a user and a community member.\r\n[5:08 PM]Glitch: https://github.com/jupyter/jupyter\r\n\r\nhttps://github.com/jupyterhub/jupyterhub\r\n\r\nhttps://github.com/jupyterhub/jupyterhub-deploy-teaching\r\n\r\nhttps://github.com/jupyterhub/jupyterhub-deploy-docker\r\n\r\nhttps://github.com/jupyterhub/dockerspawner \r\nGitHub\r\nGitHub - jupyter/jupyter: Jupyter metapackage for installation, doc...\r\nJupyter metapackage for installation, docs and chat - GitHub - jupyter/jupyter: Jupyter metapackage for installation, docs and chat\r\nGitHub - jupyter/jupyter: Jupyter metapackage for installation, doc...\r\nGitHub\r\nGitHub - jupyterhub/jupyterhub: Multi-user server for Jupyter noteb...\r\nMulti-user server for Jupyter notebooks. Contribute to jupyterhub/jupyterhub development by creating an account on GitHub.\r\nGitHub - jupyterhub/jupyterhub: Multi-user server for Jupyter noteb...\r\nGitHub\r\nGitHub - jupyterhub/jupyterhub-deploy-teaching: Reference deploymen...\r\nReference deployment of JupyterHub and nbgrader on a single server - GitHub - jupyterhub/jupyterhub-deploy-teaching: Reference deployment of JupyterHub and nbgrader on a single server\r\nGitHub - jupyterhub/jupyterhub-deploy-teaching: Reference deploymen...\r\nGitHub\r\nGitHub - jupyterhub/jupyterhub-deploy-docker: Reference deployment ...\r\nReference deployment of JupyterHub with docker. Contribute to jupyterhub/jupyterhub-deploy-docker development by creating an account on GitHub.\r\nGitHub - jupyterhub/jupyterhub-deploy-docker: Reference deployment ...\r\nGitHub\r\nGitHub - jupyterhub/dockerspawner: Spawns JupyterHub single user se...\r\nSpawns JupyterHub single user servers in Docker containers - GitHub - jupyterhub/dockerspawner: Spawns JupyterHub single user servers in Docker containers\r\nGitHub - jupyterhub/dockerspawner: Spawns JupyterHub single user se...\r\n[7:36 PM]Glitch: https://www.youtube.com/watch?v=iRJ4uab_NIg\r\nhttps://www.youtube.com/watch?v=IEeV19J4-zE\r\nhttps://youtu.be/rdZ9rHelX8c \r\nYouTube\r\ngiant_neural_network\r\nIs AI going too far? ü§ñ + üåé (LangChain + OpenAI)\r\nImage\r\nYouTube\r\ngiant_neural_network\r\nRobot Corp ü§ñü§ñü§ñ\r\nImage\r\nYouTube\r\ngiant_neural_network\r\nTalking to Robots ü§ñ‚Üîüë®üèæ‚Äçüíª\r\nImage\r\n[2:00 PM]Glitch: @hereJupyter is an open-source platform for creating and sharing data science projects. It provides an interactive environment for data analysis, visualization and machine learning.\r\n\r\n6:54 PM]Glitch: https://anaconda.cloud/getting-started-with-anaconda-distribution\n\n\n## Metadata\n- **Source**: All of it Anything Everything At Once/jupyter-text-channel.txt.txt\n- **Type**: document\n- **Tags**: document, All_of_it_Anything_Everything_At_Once\n- **Imported**: 2025-05-05T16:25:37.143Z",
  "source": {
    "type": "notebook",
    "path": "All of it Anything Everything At Once/jupyter-text-channel.txt.txt",
    "importedAt": "2025-05-05T16:25:37.143Z"
  },
  "created": "2025-05-05T16:25:37.143Z",
  "modified": "2025-05-05T16:25:37.143Z",
  "tags": [
    "document",
    "All_of_it_Anything_Everything_At_Once"
  ]
}