{
  "title": "key_points_txt",
  "content": "# key_points.txt\n\nContent-Type: text/x-zim-wiki\nWiki-Format: zim 0.6\nCreation-Date: 2024-08-15T21:58:06-07:00\n\n====== key points.txt ======\nStasis\r\n-- Player begins story during combat, this is the stasis for the story.\r\n- An injured renlei is found, they player must decide to help them or a squad mate.\r\n- Moments after rejoining the squad, a hostage situation arises. Player must take action.\r\n- The squad is promoted and Arrisi is introduced. She fills the 7th squad position.\r\n-- Contrasting this are the brief periods within the cities or down time with squad.\r\n- Introduction to the player's home and the city they reside in; establishing setting.\r\n- Player can choose to explore the city, learning more about the war and time period.\r\nTrigger\r\n- \"This world was not designed for us. Life does not exist with our species in mind.\"\r\n- Player encounters a facility unearthed by renlei machinery. It contains preserved humans.\r\n-- Mystery behind the cryofrozen corpses encourages protagonists to learn more about the past.\r\n- \"Do you fear death; the cessation of life? What? No, but I don't look forward to it either.\"\r\n- Corpse is transported back to the city; radiocarbon dating is used to estimate its age.\r\n- \"We can assign meaning to our lives, but I don't believe there is any innate purpose to be found.\"\r\n-- The squad is tasked with hunting down rogue Sentinels, this results in a squad mates death.\r\n- Squad redirects their anger towards a rouge left behind. Player can choose to save her life.\r\nThe Quest\r\n- \"Death is not the flatline of a pulse, rather, the cessation of conciousness. Loss of one's self.\"\r\n- Squad says the Rouges are psychologically damaged; revealing perception of these disorders.\r\n-- Player vows to capture the rogue Sentinels after they've killed a squad mate and escaped.\r\n- Player visits the TDC to check on the renlei; or brother, hint at Chinese values & tradition.\r\n-- The reneli mention an obscure location encountered on Svalbard, a long-standing seed vault.\r\n- The squad encounters burned Menesk buildings. Talk about how the renlei gain territory.\r\n- Squad talks about citys, Arrisi mentions her own. Talk about structure and geothermal energy.\r\n- This talk goes on a tangent relating to the renlei use of fossil fuels, how this drives the war.\r\nSurprise\r\n- A study is published on the findings from the ancient corpse, hint toward human and renlei similarity.\r\n-- The player discovers how the Renlei and Menesk are related to Humans, but how? Corpse is a clue.\r\n- The squad locates the facility the renlei captives mentioned. Surprised as it requires an HSE suit to enter.\r\n- Squad mate recognizes that the seed vault looks almost identical to human technology and uses nanites.\r\n-- Player encounters an ancient AEI known formally as 'Robert' in the seed vault; he's severely damaged.\r\n- Squad decides to take the AEI back to the city. Partially repairing it in preperation of body transfer.\r\n- The AEI plays a recording that is spoken in Chinese. They succeed in powering it on, he speaks in English.\r\n- AEI estimates time passed with city database. Moon is 6.21371 miles further. Days, 8.5 seconds longer. \r\n- Robert objects to an immediate transfer and suggests gradual transition; discussion on consciousness.\r\n- He also mentions that the solar system's gas giants no longer exist, creating more holes in the archive.\r\nCritical Choice\r\n- Conversation with Arrisi about human family; explain genomic fluidity and the lack of genetic relation.\r\n- A tangent about how the menesk are enslaved by the renlei. How they're used in immense factories.\r\n- Squad encounters a feral canine after a child; domesticated by the menesk, injured by renlei weapons.\r\n- Sorrel protects the Menesk child and decides to adopt her after discovering that her parents are dead.\r\n- Travel reveals several horrors of war. Renlei De'humanize' the Menesk. Entire cities are depopulated.\r\n- A renlei mining facility is found. The squad is able to neutralize the footsoldiers, but one enters a vehicle.\r\n- It's essentially a mechanized soldier that cannot be fought non-lethally. No other option than to kill.\r\n- Squad encounters the rouge Sentinels again. They offer the squad a chance to join the 'renlei' cause.\r\nClimax & Reversal\r\n- Robert talks about the lack of free will in choices made. How the paths taken are an intricate illusion.\r\n- The AEI continues with this \"No one can dictate your purpose in life. The meaning you find is your own.\"\r\n- The player encounters a group of injured menesk civillians. Player can leave squadmate behind to help.\r\n-- Commands remaining squad mates as they fight the rogue squad. Squad member is sniped and killed.\r\n-- Robert saves a second squad mate if the player wasn't able to, one dies instead of two if he's there.\r\n-- Rogue squad reveals why they fought against humanity, for those with mental affliction.\r\n-- Player learns that humanity's ancestors left Earth long ago, traveling to the stars. \r\nResolution\r\n-- Months after the war and about two years from the climax; player will express the renlei's desired fate. \r\n- Robert left behind information detailing the LORE project 500,000 years ago. Why humanity left Earth.\r\n- Awareness of human ancestors rises, desire to follow them spreads. Space travel ignites human curiosity.\r\n- \"You are the result of 3.8 billion years of evolution.\"\r\n- \"The innumerable generations that precede us, have long since perished.\"\r\n- \"You are not the final product. We are not the last generation.\" \n\n\n## Metadata\n- **Source**: All of it Anything Everything At Once/key_points.txt.txt\n- **Type**: document\n- **Tags**: document, All_of_it_Anything_Everything_At_Once, weapon, location, story, quest\n- **Imported**: 2025-05-05T16:25:37.143Z",
  "source": {
    "type": "notebook",
    "path": "All of it Anything Everything At Once/key_points.txt.txt",
    "importedAt": "2025-05-05T16:25:37.143Z"
  },
  "created": "2025-05-05T16:25:37.143Z",
  "modified": "2025-05-05T16:25:37.143Z",
  "tags": [
    "document",
    "All_of_it_Anything_Everything_At_Once",
    "weapon",
    "location",
    "story",
    "quest"
  ]
}