{
  "title": "media-channel_text",
  "content": "# media-channel.text\n\nContent-Type: text/x-zim-wiki\nWiki-Format: zim 0.6\nCreation-Date: 2024-07-23T15:19:46-07:00\n\n====== media-channel.text ======\n4:28 PM]CycadaAcolyte: https://twitter.com/i/status/1185706875624415232\r\n\r\nBannon Whodis? The call is coming from inside! (@BannonRudis)\r\nHow games look when you first start developing them. #gamedev #gaming https://t.co/Fs2Q5QRaHr\r\nRetweets\r\n1935\r\nLikes\r\n7980\r\n\r\nTwitter\r\n[4:37 PM]Glitch: Great find. 😄\r\n[3:17 AM]CycadaAcolyte: the future is now\r\nhttps://twitter.com/i/status/1181971606228393984\r\n\r\nbeeple (@beeple)\r\nZUCKERBORG'S NIPPLE FREE TECHNO-UTOPIA #everydays https://t.co/nPGlLkemie\r\nRetweets\r\n1146\r\nLikes\r\n5374\r\nImage\r\n\r\nTwitter\r\n[2:24 AM]Glitch:\r\nImage\r\n[2:38 AM]CycadaAcolyte: https://www.youtube.com/watch?v=1wAVpcvIrQM\r\nYouTube\r\nkenny lauderdale\r\nWhen You Fire all The Animators\r\n[12:29 AM]Glitch:\r\nImage\r\n[3:11 AM]Bords:\r\nImage\r\n[4:42 AM]Glitch:\r\nImage\r\n[11:56 PM]Glitch:\r\nImage\r\n[12:57 AM]CycadaAcolyte:\r\nImage\r\n[12:57 AM]CycadaAcolyte: clearly not mine but gave me a good chuckle\r\n[9:50 AM](411) TWINKEYRUNAWAY: https://www.youtube.com/watch?v=PkOMIpmbHwM\r\n[8:46 PM](411) TWINKEYRUNAWAY: https://www.youtube.com/watch?v=GiYwczu28Cg&feature=youtu.be\r\n[6:49 AM](411) TWINKEYRUNAWAY: https://www.youtube.com/watch?v=hWH_sPRrIAE&feature=youtu.be\r\nYouTube\r\n411Remnant\r\nNom Carver Be like...\r\nImage\r\n[5:40 PM](411) TWINKEYRUNAWAY: https://youtu.be/F05XF9fFhIc\r\nYouTube\r\n411Remnant\r\nStar Wars Battlefront 2 Gonks Vibe\r\nImage\r\n[12:23 PM](411) TWINKEYRUNAWAY: https://www.youtube.com/watch?v=-L8SYz6qSpo&feature=youtu.be\r\nYouTube\r\n411Remnant\r\nStar Wars Battlefront 2 Machinima - Pizza Time (Slight Mando Spoilers)\r\nImage\r\n[7:04 AM](411) TWINKEYRUNAWAY: https://www.youtube.com/watch?v=suog1Vw-KU4\r\nYouTube\r\n411Remnant\r\nStar Wars Battlefront 2 Machinima #5\r\nImage\r\n[8:16 AM]Scuds:\r\nImage\r\n[8:18 AM]Glitch: ahahaha, no criticals though. idle-bouncing dog should level up more\r\n[10:19 AM]Glitch: https://www.youtube.com/watch?v=wqbZlAEUb5w\r\nYouTube\r\nNetflix\r\nThe House | Official Trailer | Netflix\r\nImage\r\n[10:19 AM]Glitch: animation like this just sets an atmosphere I can't get enough of\r\n[10:23 AM]Glitch: audio design does so much for a work, too. like you were saying @Anarco (Rorschach)\r\n[6:43 PM]Anarco (Rorschach): I've watched a couple weeks ago, fantastic movie. \r\n\r\nI have a little soft spot for stop-motion animation.\r\n[11:00 AM]Glitch: @rothus66 Tell me about the movie.\r\n[11:04 AM]rothus66: Smile, therapist gets a new patient complaining about something following her that's keeps smiling at her\r\n[11:04 AM]rothus66: I'll link the trailer\r\n[11:05 AM]rothus66: https://youtu.be/BcDK7lkzzsU\r\nYouTube\r\nParamount Pictures\r\nSmile | Official Trailer (2022 Movie)\r\nImage\r\n[11:11 AM]Glitch: Those upside down shots are so unnerving. I don't have full audio right now but I'm watching it.\r\n[11:19 AM]Glitch: It might be worthwhile. Haven't seen horror in a good long time.\r\n[8:35 AM]KARIN: This was from a while ago, but I had seen this movie in theatres when it first came out and it was good!\r\n[8:37 AM]Glitch: How is it that a smile can both give us so much reassurance, and potentially so much unease?\r\n[4:47 PM]Glitch: Dr. Gabor Maté on \"The Myth of Normal,\" He speaks to our collective trauma, issues that will always weigh on our bias for the moment. How this society gives us so many numerous pathologies. Trauma isn't what happens to us, it's the \"psychic wound that we sustain\"; underlying much of our disease, damage that goes across a spectrum. Wounds that endure over a lifetime. \"Social stress and trauma translate into physiological stress of the individual. You can't separate the mind from the body and you cannot separate the individual from the environment.\" \r\n\r\nhttps://youtu.be/e4PyQGBvFEU\r\nYouTube\r\nDemocracy Now!\r\nDr. Gabor Maté on \"The Myth of Normal,\" Healing in a Toxic Culture ...\r\nImage\r\n[4:25 AM]Glitch: https://www.youtube.com/watch?v=Ba5rL-jaX8I\r\nYouTube\r\nDemocracy At Work\r\nCapitalism = Selfishness, according to Adam Smith & Milton Freidman...\r\nImage\r\n[4:26 AM]Glitch: well, um. this is almost perfect.\r\n[4:26 AM]Glitch: only 3 minutes; says exactly what it is all this relates to.\r\n[4:26 AM]Glitch: incidental, mind. I'm watching it now...\r\n[4:29 AM]Glitch: I don't have to add any words to his rhetoric, it's perfect.\r\n[4:34 AM]Glitch: https://www.youtube.com/watch?v=yANLp_dw1wI\r\nYouTube\r\nAnRel\r\nwhat even IS hierarchy?\r\nImage\r\n[4:35 AM]Glitch: AnRel, a modern philosopher in her own right. Her stuff enlightened me to a lot; definitely give this one a listen.\r\n[4:36 AM]Glitch: \"who eats first?\"\r\n[5:10 PM]Glitch: the video essayist goes on to ask on how these people and companies can 'make more value'\r\n[5:10 PM]Glitch: I've lost interest in his understanding; 'growth' is not what we ought to seek in our economic drives\r\n[10:33 PM]Glitch: https://www.youtube.com/watch?v=oet62-F2Q9c\r\nYouTube\r\nSome More News\r\nWhy Being Poor Is So Expensive - SOME MORE NEWS\r\nImage\r\n[6:17 PM]Glitch: These videos are so well-known, but this was so incredible I can't not post it.\r\nhttps://www.youtube.com/watch?v=TYPFenJQciw\r\nImage\r\nYouTube\r\nKurzgesagt – In a Nutshell\r\nYou Are an Impossible Machine\r\nImage\r\n[6:56 AM]Glitch: https://www.youtube.com/watch?v=A2hOWShiYoM\r\nYouTube\r\nTwo Minute Papers\r\nDeepMind’s New AI: 10 Years of Learning In Seconds!\r\nImage\r\n[7:13 AM]Glitch: here's the full paper:\r\nhttps://arxiv.org/pdf/2301.07608.pdf\r\n[7:14 AM]Glitch: their full site. really, really incredible work.\r\nhttps://sites.google.com/view/adaptive-agent/\r\nHome\r\nFoundation models have shown impressive adaptation and scalability in supervised and self-supervised learning problems, but so far these successes have not fully translated to reinforcement learning (RL). In this work, we demonstrate that training an RL agent at scale leads to a general in-context\r\nImage\r\n[3:02 AM]Glitch: https://www.youtube.com/watch?v=emqbkAjH0dc\r\nright to work did not protect us. union votes used to win 100% of the time- aha\r\nYouTube\r\nMore Perfect Union\r\nMichigan Is On The Verge of Historic Action To Save Union Jobs\r\nImage\r\n[10:36 AM]Glitch: https://youtu.be/0z6FC2znehQ\r\n\"to make public college tuition free\"\r\nYouTube\r\nSenator Bernie Sanders\r\nNo one should have to go hundreds of thousands of dollars into debt...\r\nImage\r\n[10:49 AM]Glitch: https://www.youtube.com/watch?v=sB1kE5iqKh0\r\nYouTube\r\nBernie Sanders\r\nEli Lily has SIGNIFICANTLY lowered its insulin price.\r\nImage\r\n[4:39 PM]Glitch: https://youtu.be/G1dXEM_7lh8\r\nYouTube\r\nTwo Minute Papers\r\nGoogle’s Video Editor AI: Absolute Magic!\r\nImage\r\n[9:23 AM]Glitch: https://krystalkyleandfriends.substack.com/p/episode-114-audio-marianne-williamson#details\r\nEpisode 114 Audio: Marianne Williamson\r\nListen now | This week it’s our pleasure to bring you an exclusive conversation with 2024 presidential candidate Marianne Williamson. Like you, we’re interested in hearing about Marianne’s plans to address class warfare and social injustice in the United States, how her political journey led her to become an advocate for key progressive policies...\r\nImage\r\n[7:25 PM]Glitch: https://youtu.be/jN7mSXMruEo\r\nYouTube\r\nNot Just Bikes\r\nThese Stupid Trucks are Literally Killing Us\r\nImage\r\n[7:25 PM]Glitch: 80% of all new U.S. car sales are SUVs, w t f\r\n[7:39 PM]Glitch: \"75% of light truck owners tow something once a year or less and 70% go off-road once a year or less.\"\r\n[3:01 PM]Glitch: https://www.youtube.com/watch?v=plEcfhexzEw\r\nYouTube\r\nSenator Bernie Sanders\r\nLIVE: Starbucks CEO Howard Schultz has finally agreed to testify be...\r\nImage\r\n[9:33 PM]Glitch: https://www.youtube.com/watch?v=6pWoVRYNWws\r\n[10:13 PM]Glitch: https://github.com/mochi-neko/ChatGPT-API-unity\r\n[10:14 PM]Glitch: the first link is missing resources in the github repository, this other one may be promising; asset store one almost worked.\r\n[8:40 AM]Glitch: https://www.youtube.com/watch?v=LMCs-qE1hmo\r\nYouTube\r\nnature video\r\nFeeding immunity\r\nImage\r\n[10:04 AM]Glitch: https://www.youtube.com/watch?v=qIpCtiGUusY\r\nYouTube\r\nDemocracy At Work\r\nWe Need Housing Justice, Not Home-Ownership - Cities After...\r\nImage\r\n[10:34 AM]Glitch: https://www.youtube.com/watch?v=CkcQzbRfXOM\r\nYouTube\r\nFOX 5 Atlanta\r\n'Cop City agitators' make first appearance in Georgia court\r\nImage\r\n[10:35 AM]Glitch: All have private attorneys. None have a criminal background.\r\n[10:37 AM]Glitch: https://www.youtube.com/watch?v=2OlT2KTnaec\r\nYouTube\r\nHasanAbi\r\nNO COP CITY\r\nImage\r\n[10:39 AM]Glitch: anarchy through and through. for a good cause?\r\nImage\r\n[10:41 AM]Glitch: again, this one. but I'm so mesmerized. people vs cops.\r\nImage\r\n[10:42 AM]Glitch: https://www.youtube.com/watch?v=qpHDk7oSp7I\r\nYouTube\r\nLaw&Crime Network\r\nVideos Show Atlanta ‘Cop City’ Chaos That Ended with 23 People Faci...\r\nImage\r\n[10:47 AM]Glitch: https://www.youtube.com/watch?v=JuikFQtmdPY\r\nYouTube\r\n350.org\r\nWhat is #STOPCOPCITY? An Atlanta resident explains.\r\nImage\r\n[10:58 AM]Glitch: this just gets more interesting. it goes back to MLK?\r\nhttps://www.youtube.com/watch?v=8dXn-LVXfII\r\nYouTube\r\nDemocracy Now!\r\nAtlanta Police Kill Forest Defender at Protest Encampment Near Prop...\r\nImage\r\n[11:01 AM]Glitch: All those gunshots could not have been 'fearful'. This cop committed an execution.\r\n[11:09 AM]Glitch: Woah\r\nhttps://theintercept.com/2023/02/09/cop-city-body-camera-footage/\r\nThe Intercept\r\nOfficer in Cop City Bodycam Footage Suggests Fellow Cop Was Shot by...\r\nFootage from the aftermath of a deadly police raid on anti-Cop City protesters shows an Atlanta cop asking, “They shoot their own man?”\r\nOfficer in Cop City Bodycam Footage Suggests Fellow Cop Was Shot by...\r\n[11:09 AM]Glitch: \"shot by his own man\" It was a literal fucking execution if that's true. Chills, we'd have chills if this was believed.\r\n[11:10 AM]Glitch: https://youtu.be/W3sZMYjMKek?t=1081\r\nAt the eighteen minute mark here, it sounds like there was a back and forth. Maybe not so much an 'execution', maybe this kid got scared. But if he had a gun and shot at the cop, then it can't have been what I imagined. He shouldn't have used it.\r\n\r\nUgh. They better investigate the hell out of this.\r\nWhy was there a single cop out there on his own?\r\n\r\n\"Some #StopCopCity activists have claimed that Georgia authorities' claim that Terán shot a trooper is false, and the officer was actually shot by friendly fire.\" \r\n[4:33 PM]Glitch: https://www.youtube.com/watch?v=IOcDlFgQ30A\r\nYouTube\r\nUnicorn Riot\r\n\"#StopCopCity\" Rally at King Center in Atlanta\r\nImage\r\n[4:35 PM]Glitch: \"We're in the business of creating a world where we all have the right to exist, where we all have the right to self-determination.\" - A right to exist, right to be free.\r\n[5:14 PM]Glitch:\r\nImage\r\n[9:58 AM]Glitch: https://prospect.org/economy/how-we-broke-the-supply-chain-intro/\r\nThe American Prospect\r\nHow We Broke the Supply Chain\r\nRampant outsourcing, financialization, monopolization, deregulation, and just-in-time logistics are the culprits.\r\nHow We Broke the Supply Chain\r\n[10:01 AM]Glitch: https://www.youtube.com/watch?v=a-Aq2PT1Uj4\r\nYouTube\r\n51-49 with James Li\r\nSaying Goodbye\r\nImage\r\n[10:03 AM]Glitch: https://www.youtube.com/watch?v=0yPytxeIDpE \r\nYouTube\r\nDemocracy At Work\r\nCapitalism's Ponzi Scheme Investments - David Harvey's Anti-Capital...\r\nImage\r\n[10:04 AM]Glitch: capital investing in capital: absurdity to fiction\r\n[10:15 AM]Glitch: https://youtu.be/jtBvRRfL6Rw\r\nthis is historic\r\nYouTube\r\nDemocracy Now!\r\n\"Barbaric Restrictions\": 5 Women Sue Texas After Being Denied Abort...\r\nImage\r\n[10:24 AM]Glitch: Christ, yeah. Roe V. Wade has a predecessor.\r\n[11:33 AM]Glitch: https://youtu.be/4UmU1dSe3n0\r\nYouTube\r\nAndrewism\r\nHow To Build A Solarpunk City\r\nImage\r\n[6:23 AM]Glitch: @everyone The new internet? https://langchain.readthedocs.io/en/latest/index.html\r\nhttps://www.youtube.com/watch?v=nE2skSRWTTs\r\n[6:26 AM]Glitch: this is still so esoteric: I haven't been able to set it up yet\r\n[1:47 PM]Glitch: https://www.wired.com/story/alphabet-layoffs-hit-trash-sorting-robots/\r\nWIRED\r\nAlphabet’s Layoffs Include Its Cafeteria-Cleaning Robots\r\nThe company recently laid off thousands of human employees—it is also shutting down a unit working on robots that learned to open doors and clean tables.\r\nAlphabet’s Layoffs Include Its Cafeteria-Cleaning Robots\r\n[12:17 AM]Glitch: https://youtu.be/EzEuylNSn-Q\r\nYouTube\r\nAI Explained\r\nWhat's Left Before AGI? PaLM-E, 'GPT 4' and Multi-Modality\r\nImage\r\n[2:46 PM]Glitch: https://www.youtube.com/watch?v=Qr48ZxlYxOs\r\nYouTube\r\nAdam Something\r\nHow Suburbs Destroyed America\r\nImage\r\n[7:21 PM]Glitch: https://www.youtube.com/watch?v=iiqH36CBrwA\r\n\r\nhttps://www.youtube.com/watch?v=n7cepz4iOAc\r\n\r\nhttps://www.youtube.com/watch?v=0mCN3GSavJQ\r\n\r\nhttps://www.youtube.com/watch?v=j1r-iorSKOU \r\nYouTube\r\nABC News\r\nMarianne Williamson on her presidential bid\r\nImage\r\nYouTube\r\nLA Progressive\r\nMarianne Williamson talks to Dick Price and Sharon Kyle of the LA P...\r\nImage\r\nYouTube\r\nWMUR-TV\r\nWilliamson questions why government bails out banks but won't help ...\r\nImage\r\nYouTube\r\nMarianne 2024\r\nMarianne Williamson Campaigns for President in Portsmouth, New Hamp...\r\nImage\r\n[7:22 PM]Glitch: Hard to believe someone would be out there saying exactingly on what's wrong. — Her ideals are clear. She does not mince words. We'd only be so lucky. \r\n[7:49 PM]Glitch: She talked about cop city. she recognizes banning books as that dreaded thing. Does not shy from calling out neoliberalism, admonishes capitalism: the 'exacting say' on these economic giants that preside over us. Advocates healthcare for all, tuition free college for all. She says, \"The yearning of the American heart is to repair what has obviously been broken.\" A legend among us; rhetorical genius. \r\n\r\nThis woman would upend the system, save us, give us a future, and then amend every wrong that the United States would owe the world all at once. Marianne Williamson for 2024. \r\n[6:41 PM]Glitch: https://www.youtube.com/watch?v=EzEuylNSn-Q\r\n\r\nhttps://www.youtube.com/watch?v=xslW5sQOkC8 \r\nYouTube\r\nAI Explained\r\nWhat's Left Before AGI? PaLM-E, 'GPT 4' and Multi-Modality\r\nImage\r\nYouTube\r\nAI Explained\r\nThe Model That Changes Everything: Alpaca Breakthrough (ft. Apple's...\r\nImage\n\n\n## Metadata\n- **Source**: All of it Anything Everything At Once/media-channel.text.txt\n- **Type**: document\n- **Tags**: document, All_of_it_Anything_Everything_At_Once, story, quest, feature\n- **Imported**: 2025-05-05T16:25:37.148Z",
  "source": {
    "type": "notebook",
    "path": "All of it Anything Everything At Once/media-channel.text.txt",
    "importedAt": "2025-05-05T16:25:37.148Z"
  },
  "created": "2025-05-05T16:25:37.148Z",
  "modified": "2025-05-05T16:25:37.148Z",
  "tags": [
    "document",
    "All_of_it_Anything_Everything_At_Once",
    "story",
    "quest",
    "feature"
  ]
}