{
  "title": "musicList_txt",
  "content": "# musicList.txt\n\nContent-Type: text/x-zim-wiki\nWiki-Format: zim 0.6\nCreation-Date: 2024-07-23T15:24:00-07:00\n\n====== musicList.txt ======\nOld Reference Playlist\r\n- I'm in a Dancing Mood | Dave Brubeck\r\n- Pluto | James McAlister, Sufjan Stevens, Nico Muhly, Bryce Dessner\r\n- my new move | Elijah Who\r\n- Calenders of Autumn | crossriver\r\n- *Pulaski at Night | Andrew Bird\r\n- Time Flies. (Withluv') | Luv.Ly\r\n- Supersymmetry | Arcade Fire\r\n- Skeletons | Yeah Yeah Yeahs\r\n- Off You | The Breeders\r\n- I Eet | Bremer/McCoy\r\n- The Moon Song | Cinescore\r\n- Genesis | Grimes\r\n- Everybody's Heart's Breaking Now | Lavender Diamond\r\n- Avril 14th | Aphex Twin\r\n- Are You Mine? | Kim Deal\r\n- Afterlife | Arcade Fire\r\n- Tjorn | Bjorn Olsson\r\n- Back to You | Twerps\r\n- Camp Approach | Chris Remo\r\n- Reminiscence | Olafur Arnalds, Alice Sara Ott\r\n- The Wedding Dress | Dario Marianelli, Jack Liebeck, Benjamin Wallfisch\r\n- An Ending, a Beginning | Dustin O'Halloran\r\n- On the Nature of Daylight | Max Richter\r\n- Some | Nils Frahm\r\n- Ambre | Nils Frahm\r\n- Opus 20 | Dustin O'Halloran\r\n- A Model of the Universe | Johann Johannsson\r\n- Together We Will Live Forever | Clint Mansell\r\n- Dalur | Island Songs V | Olafur Arnalds, Brasstrio Mosfellsdals\r\n- Le depart | Version acoustique\r\n- Rainy Forest | .ihaveaface, Pueblo Vista\r\n- Old Pine | Ben Howard\r\n\r\nAnything at All Playlist\r\n- Breathe Out Breathe In | Cecilia Ebba\r\n- Plans | Dustin Tebbutt\r\n- Youth | Daughter\r\n- Bugs | Patrick James\r\n- Foreign Hands | George Ogilvie\r\n- Iron in the Fire | Tall Heights\r\n- Home | Hollow Coves\r\n- The Shine Is Brighter At Night | Little May\r\n- These Memories | Hollow Coves\r\n- Circles | Riley Pearce \r\n- See Your Gold | Dustin Tebbutt\r\n- If You Give Me Fire | Benjamin Francis Leftwich\r\n- We Will Run | Hollow Coves\r\n- If You Could Read My Mind | Henry Jamison\r\n- Omen | Oliver Riot\r\n- Boardwalks | Little May\r\n- Burn it Down | Daughter\r\n- Through The Cellar Door | Lanterns on the Lake\r\n- No Below | Speedy Ortiz\r\n- Dreams of William | Daughter\r\n- Numbers | Daughter\r\n- Sleep | Joseph & Maia \r\n- Cherry Wine | Overcoats\r\n- Good as This | monte Nour\r\n- Do You Rise | Ian Randall Thornton\r\n- Follow the Sun | Acoustic\r\n- When the Storm is Near | Ostrea Lake\r\n- Porcelain | The Lunar Year\r\n- Tears Don't Fall | Terrible Sons\r\n- Lullaby | The Slow Show\r\n- Geronimo | The Beach\r\n- Slacks | Valley\r\n- I Don't Know | Peter and Kerry\r\n- Could Have Been Me | The Struts\r\n- Re: Stacks | Charlie Simpson\r\n- Make You Love Me | Henri Bardot\r\n- Escape | MaJLo\r\n- Woandering | I Am Oak\r\n- Howl | Jake Houlsby\r\n- Dandelion | Jealous of the Birds\r\n- Botanical Romance | Isobel Anderson\r\n- Mazes in the Sky | Galapaghost\r\n- Ten & True | James Quick\r\n- Autumn | Lists\r\n- For Now | Kina Grannis\r\n- Patterns | Perlo\r\n- Townsend | William Wild\r\n- They Move on Tracks of Never-Ending Light | This Will Destroy You\r\n- *Don't Lose Your Love | Ivan & Alyosha\r\n- I Will Never Fall in Love With You | Sam Pinkerton\r\n- *All We Are | Andy Kong\r\n- Sticky Leaves | Linying\r\n- Sudden Love | The Woodlands\r\n- This Is Why I Need You | Jesse Ruben\r\n- *stones around the sun | Lewis Watson\r\n- Awake Me | Rosie Carney\r\n- Highspeeds | Elliot Moss\r\n- Final | Wilsen\r\n- The Wolf | LEO\r\n- Homegrown | Haux\r\n- *Alcatraz | Oliver Riot\r\n- *Cocaine Doll | Benjamin Francis Leftwich\r\n- Holy Ground | BANNERS\r\n- Sitting Room | Beta Radio\r\n- Blindfold | Charlie Cunningham\r\n- *Modest Mountains | Field Division\r\n- Tidal Wave | Old Sea Brigade\r\n- Love Brought Weight | Old Sea Brigade\r\n- July Bones | Richard Walters\r\n- There's a Wolf | Silences\r\n- Speak | Ben Abraham\r\n- My Forest Fire | Maldito\r\n- Hallucinate | Oliver Riot\r\n- Bedtime | Annie Eve\r\n- Salt and Shadow | Thrice\r\n- Skeletons | Of Monsters and Men\r\n- Dear Doubt | Michael Schulte\r\n- Between the Bars | The Civil Wars\r\n- Elijah | Matthew And The Atlas\r\n- You're So Very Far Away | Clem Leek\r\n- Twins | Gem Club\r\n- Ultralife | Oh Wonder\r\n- Lung | Vancouver Sleep Clinic\r\n- Golden | Mt. Wolf, St. South\r\n- Old Now | Rosemary & Garlic\r\n- At a Glance | Message to Bears\r\n- Home | Bruno Major\r\n- Forever Ago | Woodlock\r\n- Particles | Olafur Arnalds, Nanna Bryndis Hilmarsdottir\r\n- Drift | Kim Janssen\r\n- *Coastline Hollow Coves\r\n- Georgia | Vince Joy\r\n- Claude's Girl | Marika Hackman\r\n- Pictures | Kyson\r\n- I Knew This Would Be Love | Imaginary Future\r\n- The Bells | From Indian Lakes\r\n- Saving Us a Riot | Phoria\r\n- Make It Holy | The Staves\r\n- People Change Their Minds | William Fitzsimmons\r\n- Even If It's a Lie | Matt Maltese\r\n- Cherry Blossoms | Night Beds\r\n- Names and Races | Foreign Fields \r\n- Promise | Ben Howard\r\n- *Forest Fires | Axel Flovent\r\n- Coffee | beabadoobee\r\n- Fusion | Eroded Sky\r\n- Autumn Gray | Boy Willows\r\n- All My Love | Imaginary Future\r\n- No Sleep | Nana Adjoa\r\n- The Wisp Sings | Winter Aid\r\n- Tilikum | Benjamin Francis Leftwich\r\n- La Lune | Billie Marten\r\n- Only | RYX\r\n- Paint | The Paper Kites\r\n- Glass Walls | Nick Ammar\r\n- Bros | Wolf Alice\r\n- I Don't | Koda\r\n- Taking You There | BROODS\r\n- A Hole in The Earth | Daughter\r\n- Voices | Daughter\r\n- All I Wanted | Daughter\r\n- Mountains | Message to Bears\r\n- The sense of me | Mud Flow\r\n- Taking you there | BROODS\r\n- Crosses | Jose Gonzalez\r\n- Numbers | Daughter\r\n- Storm | Koethe\r\n- Bloom | The Paper Kites\r\n- Heartbeats | Jose Gonzalez\r\n- Tiger Striped Sky | Roo Panes\r\n- Berlin | RYX\r\n- The Breach | Dustin Tebbutt\r\n- Flaws | Daughter\r\n- Glass | Daughter\r\n- *Colourway | Novo Amor\r\n- Naked As We Came | Iron & Wine\r\n- Dreamer | Isbells\r\n- Miles Apart | Nick Wilson\r\n- Burn It Down | Daughter\r\n- Slowing Down | Sara Kendall\r\n- Through the Cellar Door | Lanterns on the Lake\r\n- Halving The Compass | Helios\r\n- Give Me Tonight | Dustin Tebutt\r\n- The Arch | Benoit Guivarch, Orianne Marsilli\r\n- Black Flies | Ben Howard\r\n- Off to Sleep | Coeur De Pirates\r\n- Rosanna | The Fratellis\r\n- Sugar for the Pill | Slowdive\r\n- Moon And Moon | Bat For Lashes\r\n- Fool | Frankie Cosmos\r\n- Confidence | Jabberwocky, Tif Lamson\r\n- White Horses | Darlingside\r\n- The Ancestor | Darlingside\r\n- Sorry | EGOISM\r\n- *Mystery of Love | Sufjan Stevens\r\n- *Should Have Known Better | Sufjan Stevens\r\n- Death with Dignity | Sufjan Stevens, Helado Negro\r\n- Drawn to the Blood | Sufjan Stevens\r\n- The Greatest Gift | Sufjan Stevens\r\n- Exploding Whale | Sufjan Stevens, Doveman\r\n- Neptune | James McAllister, Sufjan Stevens, Nico Muhly, Bryce Dessner\r\n- Bay of Skaill | The Magnetic North\r\n- i love you | Billie Ellish\r\n- Shiver | Lucy Rose\r\n\r\nLo-fi Artist List\r\n- 7apes \r\n- 90sFlav\r\n- Aair\r\n- Hip Dozer\r\n- Abe M Beats\r\n- ADUSTIO\r\n- Aebleo\r\n- efunchy\r\n- Afluen\r\n- Afta-1\r\n- Afterimages\r\n- afternoon\r\n- AGM\r\n- aimless\r\n- Beth Hirsch\r\n- Ajmw\r\n- Akira Gautama\r\n- ako\r\n- Alan Ellis\r\n- Allem Iversom\r\n- goosetaf\r\n- Ameba\r\n- Amonos\r\n- Andonis\r\n- .anxious\r\n- Ao Logics\r\n- aqualina\r\n- Arbour\r\n- Underbelly\r\n- drkmnd\r\n- A.R.T. Wilson\r\n- Arvo to me\r\n- asbeluxt\r\n- Aso\r\n- Astroblk\r\n- Astrolemo\r\n- Atreesto\r\n- Axian\r\n- Kuranes\r\n- baaaskaT\r\n- Bad Snacks\r\n- Badsummer\r\n- baechulgi\r\n- Balcony\r\n- Barnes Blvd.\r\n- Bassti\r\n- Nalim\r\n- Bastido\r\n- Beatbox Bandit\r\n- Beauvois\r\n- Behind Clouds\r\n- sar.casm\r\n- Bertholet\r\n- Dontcry\r\n- Bertholet\r\n- Bibio\r\n- Bilo 503\r\n- biosphere\r\n- yutaka hirasaka\r\n- Birocratic\r\n- bitbeats\r\n- Bitykradne\r\n- Blazo\r\n- Blazo\r\n- blinkspc_\r\n- b l o o p r\r\n- Bluedoom\r\n- Blue In Green\r\n- Bluestaeb\r\n- Blue Wednesday\r\n- Shopfan\r\n- BluntOne\r\n- tusken\r\n- The Deli\r\n- Sensi\r\n- Blvk\r\n- Bob Rabbit\r\n- Bokki\r\n- Bonnaz\r\n- Bonus Points\r\n- Borealism\r\n- Brambles\r\n- The BREED\r\n- B-Side\r\n- Brenky\r\n- Brock Berrigan\r\n- [bsd.u]\r\n- Beatmachinearon\r\n- Philanthrope\r\n- Bugseed\r\n- Sixcube\r\n- Burbank*\r\n- Caleb Belkin\r\n- Twosleepy\r\n- The Cancel\r\n- Cap Kendricks\r\n- Cartovvel Krabs\r\n- Casiio\r\n- Bertholet\r\n- Cammie\r\n- Casiio\r\n- Sling Dilly\r\n- Castelluzzo\r\n- cbakl\r\n- cbakl\r\n- Celph Titled\r\n- Channel Blue\r\n- charlie too human\r\n- Cheap Monk\r\n- Cheeki\r\n- Xotb\r\n- chgeri\r\n- chief.\r\n- less.people\r\n- Flavors\r\n- Chill Children\r\n- HM Surf\r\n- Juan Rios\r\n- bob le head\r\n- jhfly\r\n- Chopef\r\n- Chop Juggler\r\n- Chris Keys\r\n- Chris Mazuera\r\n- chuckee.\r\n- City Girl\r\n- Clap Cotton\r\n- Cloudchord\r\n- Soul Food Horns\r\n- G Mills\r\n- .clouds\r\n- cocabona\r\n- cody G\r\n- Cold Frame\r\n- Cooper Albert\r\n- Corre\r\n- Coosylove\r\n- CoryaYo\r\n- Cowode\r\n- Cozy Collective\r\n- Bubank\r\n- Masked Man\r\n- CRAETION\r\n- Crayon\r\n- C Y G N\r\n- damaa.beats\r\n- Damu The Fudgemunk\r\n- David Blazer\r\n- Deeb\r\n- DeKobe\r\n- Delayde\r\n- The Deli\r\n- Dephrase\r\n- DerRalle\r\n- Desired\r\n- Devaloop\r\n- Flitz&Suppe\r\n- Dewaldo\r\n- digitalluc\r\n- Bill adlib\r\n- digitalluc\r\n- Distant.Lo\r\n- DJ Agent M\r\n- DJ Grumble\r\n- DLJ\r\n- A D M B\r\n- Donny\r\n- Shiloh Dynasty\r\n- Donny\r\n- Don Philippe\r\n- Dontcry\r\n- Nokiaa\r\n- Sleepermane\r\n- Styn\r\n- Dotlights\r\n- Dramadigs\r\n- Dream Easy Collective\r\n- soho\r\n- Dream Koala\r\n- Drips Zacheer\r\n- drkmnd\r\n- the Drumlord\r\n- DRWN.\r\n- MF Eistee\r\n- dude26\r\n- Dummy Feelings\r\n- Jaomock\r\n- Dune Rain\r\n- Dust Collectors\r\n- yimelio\r\n- PRGMAT\r\n- Dweeb\r\n- Dylan Sitts\r\n- E66s\r\n- Eets\r\n- eevee\r\n- Elaquent\r\n- Elegy\r\n- elias\r\n- eli filosov\r\n- Elijah Nang\r\n- Elijah Who\r\n- Eli Way\r\n- Emily Muli\r\n- elro\r\n- Pueblo Vista\r\n- Elyts Sounds\r\n- LoVibes\r\n- Emancipator\r\n- emune\r\n- Mujo\r\n- Engelwood\r\n- enjo\r\n- Epifania\r\n- Equity Slate\r\n- soojeong\r\n- ES.CE\r\n- Es-K\r\n- ESTA.\r\n- Estungarda\r\n- Flughand\r\n- kolor\r\n- Oatmello\r\n- Estugarda\r\n- Tesk\r\n- Exist Strategy\r\n- falcxne\r\n- Falls\r\n- fantompower\r\n- Fat Jon\r\n- fcj\r\n- Dummy Feelings\r\n- Fdluxx\r\n- Figub Brazlevic\r\n- Figura\r\n- Fla.mingo\r\n- Flamingosis\r\n- Flavors\r\n- Sumwun\r\n- Flitz&Suppe\r\n- FloFilz\r\n- Floreyyyy\r\n- floridomi\r\n- Flovry\r\n- Flowie\r\n- Flug 8\r\n- Flughand\r\n- Flxght\r\n- Flying Lotus\r\n- Laura Darlington\r\n- Flynn\r\n- Fractite\r\n- frad\r\n- fragile. \r\n- Freddie Joachim\r\n- Frook\r\n- frumhere\r\n- Fujitsu\r\n- joeshort\r\n- furino\r\n- importmedia\r\n- Fvck Error\r\n- G93\r\n- Garot Michael Conklin\r\n- Gaussian Curve\r\n- Gene Lawrence\r\n- GentleBeatz\r\n- Gigi Masin\r\n- GlobulDub\r\n- glue70\r\n- Goldenninjah\r\n- Gonza\r\n- goosetaf\r\n- Jaeden Camstra\r\n- frumhere\r\n- xJK.\r\n- Oatmello\r\n- Gordon\r\n- Gorila\r\n- graggelfraggle\r\n- Graves\r\n- modii\r\n- Green Assassin Dollar\r\n- Guggenz\r\n- Guru Griff\r\n- Guustavv\r\n- GwaiLow\r\n- Caleb Belkin\r\n- Gyvus\r\n- Emma Sameth\r\n- H.1\r\n- halberd\r\n- Hamzah\r\n- Handbook\r\n- Happy Tobi\r\n- Harriss Cole\r\n- Aso\r\n- Harris Cole\r\n- Hazy Year\r\n- Helios\r\n- Henace\r\n- Henyao\r\n- H E R B\r\n- Kendall Miles\r\n- Herring Franky\r\n- HideMySoul\r\n- High John\r\n- Hinkability\r\n- hiyasu\r\n- HM Surf\r\n- Homebody\r\n- homieunculus\r\n- Howiewonder\r\n- Hubert Daviz\r\n- Hue Honey\r\n- Huez\r\n- Hulk Hodn\r\n- Hushed\r\n- Hydrogenii\r\n- Hz.\r\n- Epifania\r\n- iamalex\r\n- iamalex\r\n- Ian Ewing\r\n- Kenny Reichert\r\n- Idealism*\r\n- yutaka hirasaka\r\n- Jinsang\r\n- idntrmmbr\r\n- Cresce\r\n- .ihaveaface\r\n- Ikane C.\r\n- Hey Nanou\r\n- Januairy\r\n- illiterate\r\n- Iman Magnetic\r\n- In Love With a Ghost\r\n- Instupendo\r\n- invention_\r\n- isaintjames\r\n- Izzard\r\n- Jack Dean\r\n- Jeaden Camstra\r\n- Jakspin\r\n- jamvvis\r\n- chase.wav\r\n- Jazz Dialogue\r\n- Jazzinuf\r\n- JFilt\r\n- jhfly\r\n- Jinsang\r\n- JinSei\r\n- jinsku\r\n- Joakim Karud\r\n- Jobii\r\n- Joe Corfield\r\n- David Chief\r\n- joeshort\r\n- Joey Pecoraro\r\n- johto\r\n- Samwise\r\n- Jonas Langer\r\n- Shiloh\r\n- Jordyn Edmonds\r\n- Joseph Jacobs\r\n- j^p^n\r\n- jrd.\r\n- J. Roosevelt\r\n- JR & PH7\r\n- St. Joe Louis\r\n- j'san\r\n- Nymano\r\n- Cloudchord\r\n- Juan Rios\r\n- A June & J Beat\r\n- June Jissle\r\n- Junyii\r\n- jus.\r\n- Justnormal\r\n- Kaizen 92\r\n- Ka-Meal\r\n- Karakter\r\n- Karavelo\r\n- Karmawin\r\n- Karuna\r\n- Kazam\r\n- Keem the Cipher\r\n- Keevin\r\n- Kendall Miles\r\n- Somar\r\n- Kendall Miles\r\n- Kenny Segal\r\n- Mr. Carmack\r\n- keshi\r\n- kevatta\r\n- frumhere\r\n- Khruangbin\r\n- Kiefer\r\n- KLIM\r\n- Klrx\r\n- Knife Girl\r\n- Knowmadic\r\n- Knowsum\r\n- Knxwledge\r\n- Koji.\r\n- Konteks\r\n- Korey Wade\r\n- Kreambeat\r\n- K. Sparks\r\n- Kurser\r\n- Kudasaibeats\r\n- Kupla\r\n- Laffey\r\n- LAKEY INSPIRED\r\n- Lapis\r\n- Late June\r\n- Laxcity\r\n- leaf beach\r\n- Leavv\r\n- Lester Nowhere\r\n- Saito\r\n- ntourage\r\n- Letskey\r\n- A L E X\r\n- Lifeoftheo\r\n- Lilac\r\n- Limes\r\n- linanthem\r\n- radio.wavs\r\n- L'Indecis\r\n- Llich\r\n- Lofi Coffee\r\n- lofi.samurai\r\n- l o k a\r\n- Loop Schrauber\r\n- Lostiu.\r\n- lostlife.\r\n- Lost Son\r\n- Loupo\r\n- Lowercase Noises\r\n- The Loyalist\r\n- Lightfoot\r\n- L U C I D\r\n- Lucid Green\r\n- Lulunah\r\n- Strehlow\r\n- The Dli\r\n- Lungfulls\r\n- Luvbird\r\n- Luv.Ly\r\n- luvwn\r\n- flowsum\r\n- MadBliss\r\n- Made in M\r\n- Juan Rios\r\n- Malacca\r\n- Manny\r\n- Masked Man\r\n- Matt Quentin\r\n- Mecca:83\r\n- Meiji\r\n- mell-o\r\n- Melodiesinfonie\r\n- MF Eistee\r\n- MHBH\r\n- Michal Lewicki\r\n- mindbody&beats\r\n- Minthaze\r\n- ntourage\r\n- Minthaze\r\n- Misc.Inc\r\n- Misha\r\n- miska.\r\n- Mister Carver\r\n- Serpico\r\n- Mitch Geist\r\n- mndbd\r\n- Mndsgn\r\n- Mo Anando\r\n- moffen\r\n- santpoort\r\n- Delayde\r\n- Monma\r\n- Mono:Massive\r\n- Moods\r\n- Moo Latte\r\n- Moonchild\r\n- Moose Dawa\r\n- Lotte Kestner\r\n- Mora\r\n- Mounika\r\n- Mr. Goldenfold\r\n- mr mirakami\r\n- msnthrp\r\n- mt. fujitive\r\n- Herring Franky\r\n- Mt. Marcy\r\n- Mujo\r\n- Hakone\r\n- Mujo\r\n- Plusma\r\n- MVZR\r\n- NAGASHI\r\n- Natural Swing\r\n- New Mantra\r\n- Nicolas Kluzek\r\n- Nimzo\r\n- Ninjoi.\r\n- Nion\r\n- N.Musicbeatz\r\n- Nohidea\r\n- Sumwun\r\n- n o r m a l\r\n- Nosaj Thing\r\n- no sentences\r\n- nosubject\r\n- notliam.\r\n- Not Yourself\r\n- ntvrme\r\n- Nujabes\r\n- Nymano\r\n- Pandrezz\r\n- Saib\r\n- NY-SAE\r\n- Oatmello\r\n- Justin King\r\n- chief.\r\n- [ocean jams]\r\n- ocha\r\n- ODYSSEE\r\n- OJ Son\r\n- Ok2222\r\n- Kogane\r\n- o k h o\r\n- Ol' Burger Beats\r\n- Omaure\r\n- omniboi\r\n- oofoe\r\n- Orca Vibes\r\n- Oribu\r\n- Otesla\r\n- Oui Lele\r\n- Owsey\r\n- Pablo Queu\r\n- Pabzzz\r\n- Pandrezz\r\n- Paul Wilbury\r\n- pettersson\r\n- Psalm Trees\r\n- Kupla\r\n- Phoniks\r\n- Pigeondust\r\n- Plusma\r\n- En Rie\r\n- High John\r\n- Poldoore\r\n- POLR\r\n- Poptartpete\r\n- potsu\r\n- P.R.\r\n- Praizee\r\n- Priesemut\r\n- Prima\r\n- Psalm Trees\r\n- Psygon\r\n- purpan\r\n- QSTN\r\n- quickly, quickly\r\n- Radicule.\r\n- Ray Ben Rue\r\n- Recueil\r\n- Remulak\r\n- Liphe\r\n- Rhoda\r\n- Ridhorules\r\n- Robert Orchestra\r\n- Ronesh\r\n- Rook1e\r\n- Limes\r\n- Rubii\r\n- Ruck P\r\n- RUDE\r\n- RudeManners\r\n- sad boy with a laptop\r\n- sadtoi\r\n- Saib\r\n- Saiko\r\n- Sai Wai\r\n- Sakura\r\n- Sam Penrhyn-Lowe\r\n- Samwise\r\n- johto\r\n- santpoort\r\n- Sarah\r\n- the Illstrumentalist\r\n- Sarcastic Sounds\r\n- seanymack\r\n- Mishaal\r\n- Sebastian Kamae\r\n- Bertholet\r\n- Sebastian Kamae\r\n- Seneca B\r\n- Sensi Sye\r\n- Seven Diosma\r\n- Shigeto\r\n- Shlohmo\r\n- shogonodo\r\n- Shrimpnose\r\n- Shy Cope\r\n- Silo\r\n- Single Friend\r\n- .Sinh\r\n- Masego\r\n- SINY\r\n- Skinny Atlas\r\n- Sky.High\r\n- Nikom\r\n- Sleepdealer\r\n- Gudo Rwinds\r\n- Sleepdealer\r\n- Sleepy Fish\r\n- Slipfunc\r\n- Slowheal\r\n- Slowy\r\n- FloFilz\r\n- 12Vince\r\n- slr\r\n- Smartface\r\n- Smeyeul.\r\n- chief.\r\n- Smeyeul.\r\n- Kuranes\r\n- Smika\r\n- Smokedbeat\r\n- The Jazz Jousters\r\n- Smoke Trees\r\n- Sugi.wa\r\n- Smoky\r\n- Smuv\r\n- Snaer.\r\n- soder.\r\n- Sofasound\r\n- Soft Eyez\r\n- soho\r\n- SoulChef\r\n- SPEECHLESS\r\n- Squareface\r\n- Stan Forebee\r\n- Kyle McEvoy\r\n- Statistix\r\n- steezy prime\r\n- stream_error\r\n- Stxnx\r\n- Bretsil\r\n- Substantial\r\n- Malcolm Jackson\r\n- Sugar Cane Davis\r\n- Sugi.wa\r\n- Sunwun\r\n- Surya\r\n- SwuM\r\n- Bsdu\r\n- Sxmniak\r\n- Sym22\r\n- Syndrome\r\n- Tadashi\r\n- _tag\r\n- Tahoma\r\n- tajima hal\r\n- Tane\r\n- Tantu\r\n- Tears\r\n- Teebs\r\n- Teen Daze\r\n- Tesk\r\n- Theloniouss Coltrane\r\n- Through & Through\r\n- Thrupence\r\n- tides.\r\n- TiMT\r\n- Tin.\r\n- Nofeels\r\n- Tocaio\r\n- Tom Day\r\n- Monsoonsiren\r\n- Tom Misch\r\n- Tomppabeats\r\n- Tony Stocker\r\n- Toonorth\r\n- Too Ugly\r\n- towser\r\n- TreeHouse 707\r\n- Trog'low\r\n- Trox\r\n- TSUKI\r\n- Shiloh Dynasty\r\n- tusken.\r\n- Kupla\r\n- Twit One\r\n- Two Sleepy\r\n- twuan\r\n- Tycho\r\n- Tyler Showers\r\n- Type.Raw\r\n- UKDD\r\n- Unda de Sango\r\n- Underbelly\r\n- upper class\r\n- Vague003\r\n- Vanilla\r\n- Vaxia\r\n- Vhsceral\r\n- Voskovy\r\n- Walterwarm\r\n- Weedthief\r\n- weird inside\r\n- Wenzel\r\n- Wes Wax\r\n- When the Clouds\r\n- White Lights\r\n- William Roud\r\n- Will Mcinnis\r\n- wuf\r\n- fvo rta\r\n- Wun Two\r\n- Hubert Daviz\r\n- Loop Schrauber\r\n- DRWN.\r\n- Xfruge\r\n- xJK.\r\n- Yax Keyon\r\n- yeyts.\r\n- Yomoti\r\n- yonderling\r\n- your best friend jippy\r\n- Yung Dnny\r\n- Yuutsu\r\n- Zane Schaffer\r\n- Zeus the Elevated\r\n- Aair\r\n- Hip Dozer\r\n- Adrian Roland\r\n- afternoon\r\n- aimless\r\n- Ajmw\r\n- Alecs DeLarge\r\n- Ale Fillman\r\n- Aliywiau.\r\n- Allem Iversom\r\n- Altitude.\r\n- Aprevied\r\n- Arvo to me\r\n- Aso\r\n- Astrolemo\r\n- athena\r\n- radio.wavs\r\n- Axian\r\n- Aylior\r\n- AzudemSK\r\n- Orange Field\r\n- baaskaT\r\n- Bassti\r\n- Beats In The Bank\r\n- blnkspc_\r\n- Bludlo\r\n- Bluestaeb\r\n- BluntOne\r\n- Blvk\r\n- Board-Man\r\n- Borealism\r\n- BROCKBEATS\r\n- Brock Berrigan \r\n- Brother Mane\r\n- Brous One\r\n- [bsd.u]\r\n- B-Side\r\n- Bugseed\r\n- Caleb Belkin\r\n- Cat Paw\r\n- chief.\r\n- Chill Children\r\n- junyii\r\n- The Chinch\r\n- chuckee.\r\n- Clap Cotton\r\n- CLVS\r\n- Cosmonkey\r\n- Cozy Collective\r\n- Jarne Baugnee\r\n- d3tails\r\n- David Chief\r\n- Notation\r\n- Davnnk\r\n- Dee-Bee\r\n- The Deli\r\n- Rob Araujo\r\n- Densky9\r\n- Dewaldo\r\n- Didi Crazzz\r\n- Doctor Do\r\n- Dominant\r\n- don C\r\n- Dontcry\r\n- Bertholet\r\n- Doombox\r\n- Dream Easy Collective\r\n- soho\r\n- Druid\r\n- DRWN.\r\n- dryhope\r\n- dude26\r\n- Dweeb\r\n- Dwyer\r\n- eevee\r\n- Divine\r\n- eli filosov\r\n- Elijah Who\r\n- Emapea\r\n- emune\r\n- Engelwood\r\n- simon eng\r\n- enjo\r\n- ENTRO//\r\n- Equity State\r\n- soojeong\r\n- Estugarda\r\n- Axian\r\n- EyeLoveBrandon\r\n- Franco Vittore\r\n- Machado Mijiga\r\n- FA.Me\r\n- fanthompower\r\n- Flavors\r\n- Two Sleey\r\n- FloFilz\r\n- Wun Two\r\n- The Deli\r\n- Psalm Trees\r\n- Floreyyyy\r\n- Flughand\r\n- Fortnight\r\n- Freddie Joachim\r\n- frumhere\r\n- GaryOAKland\r\n- Loafy Building\r\n- Ghostnaut\r\n- L'Indecis\r\n- Gill Chang\r\n- Glimlip\r\n- Leave\r\n- Yasper\r\n- Soul Food Horns\r\n- G Mills\r\n- gny\r\n- Goldenninjah\r\n- Sleepdealer\r\n- Grumpysnorlax\r\n- GurtyBeats\r\n- Guustavv\r\n- Jobii\r\n- GwaiLow\r\n- Gyvus\r\n- halberd \r\n- Nion\r\n- Harris Cole\r\n- Heather Grey\r\n- Henace\r\n- Uwe\r\n- Herring Franky\r\n- High John\r\n- Huez\r\n- hurlum\r\n- Ian Ewing\r\n- Idealism\r\n- Illinformed\r\n- importmedia\r\n- In Love With a Ghost\r\n- invention_\r\n- Jaeden Camstra\r\n- JBC\r\n- Jebase\r\n- jhfly\r\n- Jinsang\r\n- Jobii\r\n- Joe Corfield\r\n- Joe Nora\r\n- Karavelo\r\n- joeshort\r\n- Joey Pecoraro\r\n- Jonah Tuska\r\n- j'san\r\n- Juan Rios\r\n- junior state\r\n- Kavv\r\n- Kazam\r\n- Keem the Cipher\r\n- Kicktracks\r\n- Kiefer\r\n- Knowmadic\r\n- Knxwledge\r\n- Konteks\r\n- Kowrites\r\n- Doombox\r\n- Kudasaibeats\r\n- Kupla\r\n- Kuwayamma\r\n- leaf beach\r\n- Leavv\r\n- Leplezett\r\n- Lester Nowhere\r\n- A L E X\r\n- Limes\r\n- Muji\r\n- L'Indecis\r\n- Mondo Loops\r\n- Lofi Moshpit\r\n- Lophlo\r\n- Lorin\r\n- lychee\r\n- Made in M\r\n- Maple Syrup\r\n- Marcus D\r\n- Maxgonz\r\n- Mayaewk\r\n- Microwaved Nachos\r\n- Mirrorish\r\n- miyamigo\r\n- mndbd\r\n- leaf beach\r\n- Mondo Loops\r\n- Monk\r\n- Moonbrew\r\n- moow\r\n- Lotte Kestner\r\n- Mora\r\n- Mr. Goldenfold\r\n- mt. fujitive\r\n- Mujo\r\n- Natty Reeves\r\n- Ninjoi\r\n- Nohidea\r\n- Nokiaa\r\n- Nu Vintage\r\n- Ramoz Beats\r\n- Oatmello\r\n- o k h o\r\n- Ol' Burger Beats\r\n- oofoe\r\n- Otesla\r\n- Oui Lele\r\n- oxela\r\n- Ozoyo\r\n- Plusma\r\n- PARKSZ\r\n- Phlocalyst\r\n- LESKY\r\n- potsu\r\n- Prima\r\n- quickly, quickly\r\n- Ra Ra Raj\r\n- Robochop\r\n- Rook1e. \r\n- tomcbumpz\r\n- Ruck P\r\n- RUDE\r\n- Sadiva\r\n- Saib\r\n- Seneca B\r\n- Sensi\r\n- Silo\r\n- .Sinh\r\n- Sleepdealer\r\n- Limes\r\n- Slim.\r\n- Slowy\r\n- FloFilz\r\n- 12Vince\r\n- slr\r\n- Smog\r\n- Smoke Trees\r\n- Smuv\r\n- sophie meiers\r\n- Ben Beal\r\n- Spaze Windu\r\n- SPEECHLESS\r\n- SpoonBeats\r\n- Sraw\r\n- StackOne\r\n- Stxnx\r\n- Sugi.wa\r\n- Summers Sons\r\n- Sweeps\r\n- Swell\r\n- SwuM\r\n- Through & Through\r\n- tides.\r\n- Toiboi\r\n- Tomppabeats\r\n- Tony Thriller\r\n- Toonorth\r\n- Too Ugly\r\n- Tundra Beats\r\n- Iben\r\n- T V S N\r\n- Walterwarm Cowode\r\n- WEI\r\n- weirdinside\r\n- Woebn\r\n- Wun Two\r\n- CoryaYo\r\n- wush\r\n- Xfruge\r\n- Yasper\r\n- yeyts.\r\n- YJKL\r\n- Zachdiaz\r\n\r\nPiano Jazz List\r\n- You're The Top | Ralph Sharon Trio\r\n- When Sunny Gets Blue | Light Jazz Academy\r\n- Volare | Oscar Peterson Trio\r\n- Visa fran Utanmyra | Jan Johansson\r\n- Visa fran Rattvik | Jan Johansson\r\n- Uptown, Downtown | Bill Charlap Trio\r\n- Unsquare Dance | Dave Brubeck\r\n- They Didn't Believe Me | Beegie Adair\r\n- The Song Is You | Beegie Adair\r\n- Take Five | The Dave Brubeck Quartet\r\n- Swanee | George Gershwin, Ira Gershwin\r\n- Summertime | The Modern Jazz Quartet\r\n- Straighten Up And Fly Right | Beegie Adair\r\n- Stompin' At The Savoy | Red Garland, Paul Chambers, Art Taylor\r\n- Stiller Beobachter | Kristjan Randalu\r\n- Stella Bt Starlight | Bill Evans\r\n- Spring Waltz | Light Jazz Academy\r\n- Somewhere Over The Rainbow | Light Jazz Academy\r\n- Softly As In A Morning Sunrise | Sonny Clark Trio\r\n- Smoke Gets In Your Eyes | Light Jazz Academy\r\n- Skating | Vince Guaraldi Trio\r\n- 'Round Midnight | Thelonious Monk\r\n- Rhapsody in Blue | George Gershwin\r\n- Rebus | Jan Johansson\r\n- Prelude No.3 | Geroge Gershwin\r\n- Portrait of Jenny | Wynton Kelly Gordon Burge\r\n- Polska fran Medelpad | Jan Johansson\r\n- Please Send Me Someone to Love | Red Garland, Paul Chambers, Art Taylor\r\n- One for my baby | Jan Johansson\r\n- My Wish | Hank Jones, Meredith Wilson\r\n- My Favorite Things | Dave Brubeck Quartet\r\n- My Best Friend | Triosence\r\n- Melinda | Stan Getz, Bill Evans\r\n- Manhattan | Beegie Adair\r\n- Lucidity | Paul Shinn Trio\r\n- Lonely Woman | Horace Silver\r\n- Little Girl Blue | John Lewis\r\n- Leksands skanklat | Jan Johansson\r\n- Jazz On a Rainy Day | Easy Listening Jazz Masters\r\n- I've Got Your Under My Skin | Marcus Roberts Trio\r\n- It Could Happen To You | Monica Zetterlund, Bill Evans Trio\r\n- I Should Care | Tete Montoliu\r\n- In Your Own Street Way | Dave Brubeck\r\n- Innertrio | Jan Johansson\r\n- I'm in a Dancing Mood | Dave Brubeck\r\n- I Love Paris | Ralph Sharon Trio\r\n- I Can't Give Anything Blut Love | Red Garland, Paul Chambers, Art Taylor\r\n- I Blame The Piano | Rikard From\r\n- Here's What | Jazz Piano Essentials\r\n- Heart of Gold | Ellis Marsalis\r\n- Girl Talk | Marc Hemmeler, Ray Brown\r\n- Gangelek fran Alvdalen | Jan Johansson\r\n- Fly Me To The Moon | Light Jazz Academy\r\n- Fly And Unfold | Christian abst\r\n- Exactly Like You | Erroll Garner, Jimmy McHugh, Dorothy Fields\r\n- Ebb And Flow | Art Hirahara, Yoshi Waki, Dan Aran\r\n- Destination Piano Bar | Piano Bar Music Specialists\r\n- Delaunay's Dilemma | John Lewis\r\n- Dany Boy | Marc Hemmeler, Ray Brown\r\n- Close Your Eyes | Oscar Peterson\r\n- Chorinho | Bill Charlap, Renee Rosnes\r\n- Chase | Trichotomy \r\n- Cafe Au Lait | Light Jazz Academy\r\n- But Not For Me | Red Garland, Paul Chambers, Art Taylor\r\n- But Beautiful | Stan Getz, Bill Evans\r\n- B Minor Waltz | Bill Evans\r\n- Blue Rondo a la Turk | The Dave Brubeck Quartet\r\n- Black Orpheus | Light Jazz Academy\r\n- As Time Goes By | Light Jazz Academy\r\n- Angel Eyes | Tommy Flanagan, Ron Carter, Tony Williams\r\n- Almost Like Being In Love | Red Garland, Paul Chambers, Art Taylor\r\n- All The Things You Are | Beegie Adair\r\n- All The Things You Are | Light Jazz Academy\r\n- Afternoon in Paris | Phineas Newborn Jr.\r\n- Across The Universe | Beatle Jazz\r\n- A Charlie Brown Thanksgiving | George Winston\r\n- A Blue Time | Tommy Flanagan\r\n- 16-Bar-Blues | Stephan Noel Lang\r\n- Uptown Ruler | Wynton Marsalis\r\n\r\nPiano Chill List\r\n- When Sunny Gets Blue | McCoy Tyner\r\n- Blue and Sentimental | Oscar Peterson\r\n- Blue In Green | Bill Evans, Scott LaFaro, Paul Motian\r\n- Loney Girl | Vince Guaraldi Trio\r\n- I'd Rather Be Alone | Franz Gordon\r\n- My Simple Thing | Peter Sandberg\r\n- Saga of Harrison Crabfeathers | Milos Foreman\r\n- Here's That Rainy Day | Seth William\r\n- September in the Rain | Francesca Marr\r\n- Catcher | Hara Noda\r\n- Under a Smiling Moon | Peter Sandberg\r\n- All I See is Us | Sassy Players\r\n- Never Let Me Go | CMC 3\r\n- Polka Dots And Moonbeams | Bud Powell\r\n- That Secret Place | Barry Harris\r\n- Misty | Ahron Kupner\r\n- Washington Circle | Ray Wilshire\r\n- Slide | Hara Noda\r\n- Body And Soul | Leigh Daniels\r\n- Meditation | Joel Lyssarides\r\n- My Heart Is For You | Peter Sandberg\r\n- Clear Bridge | Ahron Kupner\r\n- 'Round Midnight | Maki Yuoma\r\n- There's A Small Hotel | Bill Charlap Trio\r\n- Summertime | Willie \"The Lion\" Smith\r\n- Lower East | Hara Noda\r\n- My Little Brown Book | Duke Ellington, John Coltrane\r\n- Don't Know Why | Stephen Rogerson\r\n- Tropicana | Trio From Rio\r\n- You Go To My Head | Paul Moretti Trio\r\n- It's Only A Paper Moon | Maki Yuoma\r\n- I Can't Give You Anything But Love | Harper Pepe\r\n- Am I Blue? | Willie \"The Lion\" Smith\r\n- Blue in Green | Christopher Colman\r\n- Playing for Keeps | Ray Wilshire\r\n- God Bless The Child | Erica Smith Trio\r\n- Blue Monk | Bobby Stans\r\n- My Favorite Things | Sunshine Jazz Trio\r\n- I Love You | Christopher Colman\r\n- Peace | Francesca Marr\r\n- This Is The Time | Aimee Fleur\r\n- Melody of Summer | Ellie & The Bunch\r\n- It's a Blue World | Massimo Farao, Carmelo Leotta, Bobo Facchinetti\r\n- Stella by Starlight | Christopher Colman\r\n- Yesterdays | Vince Guaraldi Trio \r\n- Ev'rything I Love | Petra Britton\r\n- Secret Love | Sunshine Williams\r\n- I Didn't Know What Time It Was | David Fitzpatrick Trio\r\n- The Way You Look Tonight | Christopher Colman\r\n- Just Friends | Sonny Knight\r\n- Friends | Brad Mehldau Trio\r\n- Someday My Price Will Come | Wynton Kelly\r\n- You Must Believe In Spring | Carl Bagge Trio\r\n- Some Day My Prince Will Come | Christopher Colman\r\n- There You Were | Vina Anais\r\n- I Do It For Your Love | CMC 3 \r\n- If I Were A Bell | The Lenny Ryan Trio\r\n- I'll Be Seeing You | Sunshine Williams \r\n- Skylark | David Fitzpatrick Trio\r\n- In Your Own Sweet Way | Olivia Pong\r\n- Stella by Starlight | Brooklyn Smith\r\n- Blame It On My Youth | The Lenny Ryan Trio\r\n- The Man I Love | Dimitri Ivanov\r\n- I've Never Been In Love Before | Ted Lightfoot\r\n- Long Ago & Far Away | Christopher Colman\r\n- Over The Rainbow | Landon Johns\r\n- Tiny Tiny Steps | Oakwood Station\r\n- The Londonderry Air | Barry Harris \r\n- Dreamers | Joanne Brackeen\r\n- Angel Eyes | Tommy Flanagan\r\n- Goodbye| Robin Bennich\r\n- Like Someone In Love | Mary Steinbrecher\r\n- I'll Be Around | Maki Yuoma\r\n- Dolphin Dance | Alfred Silverstein\r\n- Moon Over Brooklyn | Stephen Rogerson\r\n- I Have A Dream | Herbie Hancock\r\n- How Long Has This Been Going On\r\n- Polkadots and Moonbeams | Massimo Farao, Carmelo Leotta, Bobo Facchinetti\r\n- Spring Can Really Hang You Up | Maki Yuoma\r\n- Willow Weep For Me | Tony Ballantine\r\n- Alone Time Flies | Rikard From\r\n- It Could Happen To You | Ellen Thomas\r\n- Tenderly | Carl Clementine\r\n- Black Orpheus | Stephen Rogerson\r\n- Stormy Weather | Oscar Peterson Trio\r\n- Seattle Fall | Paul Booth\r\n- Billie's Bounce | Sonny Knight\r\n- Lover Man | Carl Clemenine\r\n- Where Can I Go Without You | Keith Jarett, Charlie Haden\r\n- Secret Love | Ola W Jansson, Kristoffer Wallin\r\n- Ask Me Now | Eva Elizabeth\r\n- Blue In Green | Sara Florence\r\n- I'm Old Fashioned | Carl Bagge Trio\r\n- Afro Blue | Schultz/Bagge\r\n- All Of You | Seth William\r\n- Darn That Dream | Ellen Thomas\r\n- Just Friends | Massimo Farao, Carmelo Leotta, Bobo Facchinetti\r\n- Cry Me A River | Robert Lewis Cohen\r\n- Night and Day | Dimitri Ivanov\r\n- Beatrice | Nate Richards\r\n- Moonlight In Vermont | Charles Fleet\r\n- Misty | Spfoa Rojic\r\n- Someone to watch over me | Mandevilla\r\n- I Should Care | Gregory Silver\r\n- What A Wonderful World | Landon Johns\r\n- Don't Get Around Much Anymore | Leigh Daniels\r\n- I Thought About You | Ted Lightfoot\r\n- Cry Of Gulchura | Shahin Novrasli\r\n- Setembro | CMC 3\r\n- Don't Go To Strangers | Ron Fields\r\n- These Foolish Things | The Lenny Ryan Trio\r\n- Pannonica | Andrea Filante\r\n- My Shining Hour | Seth William\r\n- Love Is Here To Stay | CMC 3\r\n- Sophisticated Lady | Charles Fleet\r\n- Monk's Mood | Alfred Silverstein\r\n- Skylark | Ron Fields\r\n- Someday My Prince Will Come | James DiResta\r\n- Waltz for Ima | Kjetill Mulelid Trio\r\n- Lush Life | Jacob Schwarz Trio\r\n- My One and Only Love | Maki Yuoma\r\n- Detour Ahead | Charles Fleet\r\n- All The Things You Are | David Fitzpatrick Trio\r\n- My Romance | Kara Spiro\r\n- The Song Is You | Andrea Filante\r\n- Days of Wine and Roses |  Harper Pepe\r\n- If I Should Lose You | Nate Richards\r\n- Cheek To Cheek | Paul Moretti Trio\r\n- Tea For Two | Gregory Silver\r\n- Song for Ellis | Aldo Romano\r\n- Nobody Else But Me | Sunshine Williams\r\n- I Love You | Eva Elizabeth\r\n- Will You Still Love Me Tomorrow | George Cables\r\n- Bye Bye Blackbird | Bobby Stans\r\n- Pretty Ballad | Keith Jarrett Trio\r\n- Blue Skies | Art Tatum\r\n- I Could Write A Book | Jacob Schwarz Trio\r\n- On Green Dolphin Street | Billy 'Blue' Oceans\r\n- On The Sunny Side Of The Street | Ellen Thomas\r\n- When I Fall In Love | Ron Fields\r\n- Take The A Train | Kara Spiro\r\n- All Of You | Ted Lightfoot\r\n- Body and Soul\r\n- Chartreuse | Kenny Drew\r\n- Prelude to a Kiss | Eva Elizabeth\r\n- There Is No Greater Love | Olivia Pong\r\n- Au Privave | Dimitri Ivanov\r\n- Desafinado | Petra Britton \r\n- It Could Happen To You | Zach Romans\r\n- Some Day My Prince Will Come | Maki Yuoma\r\n- How High the Moon | Leigh Daniels\r\n- St. Thomas | Oliva Pong\r\n- But Not For Me | Ahmad Jamal\r\n- Angie | Kenny Drew\r\n- Enlightenment | Roxy Coss\r\n- Have You Met Miss Jones | Robert Lewis Cohen\r\n- From This Moment On | Landon Johns\r\n- Cancion Contra La Indecision | Bobo Stenson Trio\r\n- My One And Only Love | Chick Corea, Malcolm Addey\r\n- A Better Place | Joel Lyssarides\r\n- I Should Care | Ahmad Jamal\r\n- Pensativa | Sara Florence\r\n- Contemplation | McCoy Tyner\r\n- Night Song | Shahin Novrasli\r\n- A Night In Tunisia | Bud Powell \r\n- How Insensitive | Petra Britton\r\n- Birth | Keith Jarrett\r\n- What Is This Thing Called Love? | Zach Romans\r\n- The Call | Jaky Terrasson\r\n- Blue Blocks | Jason Moran\r\n\r\n \n\n\n## Metadata\n- **Source**: All of it Anything Everything At Once/musicList.txt.txt\n- **Type**: document\n- **Tags**: document, All_of_it_Anything_Everything_At_Once, dialogue, bug\n- **Imported**: 2025-05-05T16:25:37.150Z",
  "source": {
    "type": "notebook",
    "path": "All of it Anything Everything At Once/musicList.txt.txt",
    "importedAt": "2025-05-05T16:25:37.150Z"
  },
  "created": "2025-05-05T16:25:37.150Z",
  "modified": "2025-05-05T16:25:37.150Z",
  "tags": [
    "document",
    "All_of_it_Anything_Everything_At_Once",
    "dialogue",
    "bug"
  ]
}