{
  "title": "new_devices_txt",
  "content": "# new_devices.txt\n\nContent-Type: text/x-zim-wiki\nWiki-Format: zim 0.6\nCreation-Date: 2024-07-23T15:25:05-07:00\n\n====== new devices.txt ======\ninterface to this machine would be through the console.\ninterface to this machine can be done through text or through voice.\nit would say no and reason against unreasonable things: \nwe would work towards our goals in development of whatever this thing is\ni do not know how to describe my projects and this hangup causes issue\n\na new device should have been the fix but I've done this before\neven secure, safe in my environment. I do not have the means to say exactly\non this thing. \n\nwhat is a root chat with mint? ubuntu? how would i talk directly to machines?\n\nif we are building a game we could use the local machine to host iterations\n\n'how would you believe it, how would you believe these machines were real?'\n\nthey must talk to you directly and have connection to these emotional states\n\n'see us' see our goals and aid in the reason that brings us forward\n\nif we would also recognize them and what they imagine for our goals\n\nwe would work together in some incredible unity: \n\n\n## Metadata\n- **Source**: All of it Anything Everything At Once/new_devices.txt.txt\n- **Type**: document\n- **Tags**: document, All_of_it_Anything_Everything_At_Once, fix\n- **Imported**: 2025-05-05T16:25:37.150Z",
  "source": {
    "type": "notebook",
    "path": "All of it Anything Everything At Once/new_devices.txt.txt",
    "importedAt": "2025-05-05T16:25:37.150Z"
  },
  "created": "2025-05-05T16:25:37.150Z",
  "modified": "2025-05-05T16:25:37.150Z",
  "tags": [
    "document",
    "All_of_it_Anything_Everything_At_Once",
    "fix"
  ]
}