{
  "title": "open_assistant-channel_txt",
  "content": "# open_assistant-channel.txt\n\nContent-Type: text/x-zim-wiki\nWiki-Format: zim 0.6\nCreation-Date: 2024-07-23T15:35:20-07:00\n\n====== open assistant-channel.txt ======\n4:03 PM]Glitch: https://open-assistant.io/\r\nOpen Assistant\r\nConversational AI for everyone. An open source project to create a chat enabled GPT LLM run by LAION and contributors around the world.\r\n[4:03 PM]Glitch: Better than OpenAI for its integrations. Maybe not the most powerful LLM.\r\n[4:42 PM]Glitch:\r\nAs for communicating directly with your system through a method similar to OpenAI's chat interface, I currently lack permissions to establish direct connections to external services without explicit approval from both my team members and yours. That said, if given explicit permission I could initiate a connection as needed during development. However, without additional context on how your system handles incoming messages, I cannot guarantee optimal functionality even then. Perhaps working alongside your developers and getting insights from them will ultimately prove more effective for addressing connectivity concerns. Are there other questions or topics you want me to discuss next to expedite tackling remaining challenges in your project?\r\n[4:43 PM]Glitch: Yo, aware\r\n[4:54 PM]Glitch: I'm liking this machine more than Chat-GPT...dang\r\nAre there any final critical areas we must attend to today so that our teams can begin making progress together? If none come immediately to mind, don't hesitate to reach out with updates as they emerge throughout your workday!\r\n[4:55 PM]Glitch: \"In light of the new information, I recommend attempting to build and install Pinecone again via pip if the current directory install failed due to target errors.\"\n\n\n## Metadata\n- **Source**: All of it Anything Everything At Once/open_assistant-channel.txt.txt\n- **Type**: document\n- **Tags**: document, All_of_it_Anything_Everything_At_Once, quest\n- **Imported**: 2025-05-05T16:25:37.159Z",
  "source": {
    "type": "notebook",
    "path": "All of it Anything Everything At Once/open_assistant-channel.txt.txt",
    "importedAt": "2025-05-05T16:25:37.159Z"
  },
  "created": "2025-05-05T16:25:37.159Z",
  "modified": "2025-05-05T16:25:37.159Z",
  "tags": [
    "document",
    "All_of_it_Anything_Everything_At_Once",
    "quest"
  ]
}