{
  "title": "openai-channel_txt",
  "content": "# openai-channel.txt\n\nContent-Type: text/x-zim-wiki\nWiki-Format: zim 0.6\nCreation-Date: 2024-07-23T15:34:55-07:00\n\n====== openai-channel.txt ======\n1:36 PM]Glitch: https://openai.com/product/gpt-4\r\nGPT-4\r\nGPT-4\r\n[1:46 PM]Glitch: https://youtu.be/outcGtbnMuQ?t=3266\r\nYouTube\r\nOpenAI\r\nGPT-4 Developer Livestream\r\nImage\r\n[1:17 AM]Glitch: https://chatpad.ai/\r\nChatpad AI\r\nA free, open-source, and slick UI for ChatGPT\r\n[7:42 PM]Glitch: https://www.youtube.com/watch?v=ZSfwgKDcGKY\r\nYouTube\r\nMatt Wolfe\r\nA Massive Upgrade To ChatGPT! (This is Crazy)\r\nImage\r\n[10:01 AM]Glitch: https://www.youtube.com/watch?v=hpePPqKxNq8\r\nYouTube\r\nJames Briggs\r\nChatGPT Plugins: Build Your Own in Python!\r\nImage\r\n[6:43 AM]Glitch: https://assetstore.unity.com/packages/tools/ai/gpt-ai-integration-243729\r\nGPT AI Integration | AI | Unity Asset Store\r\nGet the GPT AI Integration package from Cameron Wills and speed up your game development process. Find this & other AI options on the Unity Asset Store.\r\nGPT AI Integration | AI | Unity Asset Store\r\n[9:03 PM]Glitch: Too powerful:\r\nhttps://chatgpt4.ai/copilot-x-powered-by-gpt-4/\r\nChatGPT-4\r\nadminko\r\nCopilot X powered by GPT-4\r\nGitHub Copilot X is evolving with new features: it now includes chat and voice interfaces. It's the worldâ€™s first AI dev tool made with Codex\r\n[11:01 PM]Glitch: https://youtu.be/yHouKDbiPPs\r\nYouTube\r\n1littlecoder\r\nGPT-4 with Self-Reflection beats GPT-4\r\nImage\r\n[2:41 PM]Glitch: https://youtu.be/m6TwUf0seS8\r\nYouTube\r\nMatthew Berman\r\nFully Autonomous AI ðŸ¤– Works For You While You Sleep (Tutorial)\r\nImage\r\n[10:03 AM]Glitch: https://youtu.be/6NoTuqDAkfg\r\nYouTube\r\nAI Explained\r\nCan GPT 4 Prompt Itself? MemoryGPT, AutoGPT, Jarvis, Poe, Claude-Ne...\r\nImage\r\n[4:28 PM]Glitch: https://www.youtube.com/watch?v=xp_ShU5AwYU\r\nYouTube\r\nTech Trio: AI - Growth - Startups\r\nðŸ¤¯ Is AGI here? ChatGPT + GPT-4 + Voice = AutoGPT\r\nImage\r\n[9:25 AM]Glitch: use this to develop prompts for development: http://agents.camel-ai.org/\r\nGradio\r\n[9:06 AM]Glitch: https://youtu.be/9971sxBhEyQ\r\nYouTube\r\nDavid Shapiro ~ AI\r\nPython & GPT-3 for Absolute Beginners #1 - Setting up your environment\r\nImage\r\n[9:06 AM]Glitch: Some of the fundamentals\r\n[8:49 PM]Glitch: https://twitter.com/gfodor/status/1643297881313660928?s=20\r\n\r\ngfodor@bsky.social (@gfodor)\r\nMY JAW IS ON THE FLOOR.\r\nLikes\r\n3922\r\nRetweets\r\n407\r\nImage\r\nImage\r\nImage\r\n\r\nTwitterâ€¢04/04/2023 10:02 AM\r\n[1:10 PM]Glitch: https://youtu.be/ArFEyO0434s\r\n[1:11 PM]Glitch: \"Most popular repository since pytorch\"\r\n[1:16 PM]Glitch: inefficient: never completes a task, \"much like most of us\" haha- I think we just have to redirect the machine's 'fine-tuning' drivers- task it to local systems somehow \r\n[1:17 PM]Glitch: I've been picking up a lot of resources for development of tools with python. I am trying to teach it to interface like we've already seen 'Neuro Sama' do. Haha,\r\n[1:18 PM]Glitch: 'would like to teach it' in that direction. I suppose it is not so easy-\r\n[1:20 PM]Glitch: an assistant to help with all our applications: inefficiency is definitely a thing I felt when I had my version running on Windows 10- broke it switching to a virtual env to get around Windows 10 security features. Ubuntu now. Been building .py systems related to the model. I think I'm dang close to getting past the task barriers. Might have the gall to keep going: hammering at it till the tools make sense for the machine to talk to.\r\n[5:19 PM]Glitch: There is no 'slow down' these things were just conjecture, apparently. Graduated release or not: GPT-4 is incredible as-is.\n\n\n## Metadata\n- **Source**: All of it Anything Everything At Once/openai-channel.txt.txt\n- **Type**: document\n- **Tags**: document, All_of_it_Anything_Everything_At_Once, feature\n- **Imported**: 2025-05-05T16:25:37.160Z",
  "source": {
    "type": "notebook",
    "path": "All of it Anything Everything At Once/openai-channel.txt.txt",
    "importedAt": "2025-05-05T16:25:37.160Z"
  },
  "created": "2025-05-05T16:25:37.160Z",
  "modified": "2025-05-05T16:25:37.160Z",
  "tags": [
    "document",
    "All_of_it_Anything_Everything_At_Once",
    "feature"
  ]
}