{
  "title": "overview_of_greater_systems_txt",
  "content": "# overview_of_greater_systems.txt\n\nContent-Type: text/x-zim-wiki\nWiki-Format: zim 0.6\nCreation-Date: 2024-07-23T15:36:03-07:00\n\n====== overview of greater systems.txt ======\nSure, I can provide a brief overview of the technologies and resources you mentioned.\r\n\r\n\tLangChain: LangChain is a decentralized blockchain platform that aims to provide secure and efficient language services, such as translation and interpretation, by leveraging the power of blockchain technology.\r\n\r\n\tJupyter: Jupyter is an open-source web application that allows users to create and share documents that contain live code, equations, visualizations, and narrative text. It is widely used in scientific computing, data analysis, and education.\r\n\r\n\tHugging Face: Hugging Face is an AI company that specializes in natural language processing (NLP) and develops tools and frameworks for building and training state-of-the-art language models, such as BERT and GPT.\r\n\r\n\tOpenAI: OpenAI is an AI research organization that aims to develop and promote friendly AI for the benefit of humanity. It has developed several cutting-edge language models, such as GPT-3, and provides a platform for AI research and development.\r\n\r\nAs for Second.dev, it is a platform that provides developer bots to help automate the process of building web applications. These bots can generate new applications or add features to existing ones, which can save developers time and effort. The platform aims to make it easier and faster to build web applications, especially for non-technical users who may not have the coding skills required to build applications from scratch.\r\n\r\nOverall, the technologies and resources you mentioned represent some of the latest and most advanced tools in the fields of blockchain, data science, natural language processing, and AI. These tools can be used to build innovative applications and services that leverage the power of these technologies.\n\n\n## Metadata\n- **Source**: All of it Anything Everything At Once/overview_of_greater_systems.txt.txt\n- **Type**: document\n- **Tags**: document, All_of_it_Anything_Everything_At_Once, feature\n- **Imported**: 2025-05-05T16:25:37.161Z",
  "source": {
    "type": "notebook",
    "path": "All of it Anything Everything At Once/overview_of_greater_systems.txt.txt",
    "importedAt": "2025-05-05T16:25:37.161Z"
  },
  "created": "2025-05-05T16:25:37.161Z",
  "modified": "2025-05-05T16:25:37.161Z",
  "tags": [
    "document",
    "All_of_it_Anything_Everything_At_Once",
    "feature"
  ]
}