{
  "title": "preserving-abortion-access",
  "content": "# preserving-abortion-access\n\nContent-Type: text/x-zim-wiki\nWiki-Format: zim 0.6\nCreation-Date: 2024-09-24T20:04:01-07:00\n\n====== preserving-abortion-access ======\nWe've all seen the horror stories coming out of Texas and Florida, knowing that I'm going to give birth and watch my child pass.\nBut did you know that even in a blue state like Massachusetts or New York or California,\nyou're not safe if a nationwide abortion ban gets passed in Washington?\nNow to understand why, it's first important to understand the extraordinary success that activists have made at the state level.\nWhile the end of road worked a new era of cruelty, it also sparked a new era of organizing,\nKansas, Kentucky, Michigan, Ohio, and now all eyes are on Florida and many other states fighting to put reproductive freedom on the ballot in November.\nThese activists inspire me every day and they are making a difference for patients right now.\nBut all this progress could be threatened after the election this November.\nWe are facing two scenarios here.\nScenario number one.\nIf Democrats keep control of the White House and the Senate and win the House in November, we can pass a national law legalizing abortion.\nThis will enshrine reproductive freedom into federal law and it will overturn the cruel abortion bands\nthat Republicans have put in place at the state level.\nScenario number two.\nNow brace yourself for this one.\nIf Republicans win control of the White House, the Senate and the House, just like they did in 2016,\nthey can pass a nationwide abortion ban now that Rome has fallen and they are giddy to do it.\nAnd if the Republicans don't have enough numbers to pass it through Congress,\na Republican president like Donald Trump can twist the law to get it done through executive authority.\nIt will invalidate all of the progress the states have made because federal law overrides state law.\nNo one in red states or blue states would be safe at that point.\nIt's a nightmare scenario and it's what motivates me every day to make sure that Republicans don't win in November.\nSo when people say, are you getting involved in the elections?\nThe answer is, of course I am.\nI care about abortion and that's why I'm volunteering for Joe Biden.\nThat's why I'm volunteering in this Senate race.\nThat's why I'm volunteering in this House race.\nThat's why I'm sending in 10 bucks to help.\nRemind everyone that abortion is on the ballot.\nAnd along the way, we need to keep supporting abortion initiatives in states across the country.\nIf it makes a difference for just one patient between now and the election, that would be enough.\nThis won't be easy.\nImportant fights never are.\nBut we have the strength and we have the numbers.\nI'm in this fight all the way because the stakes are too high not to be.\n\n\n## Metadata\n- **Source**: reference-wiki-pages/preserving-abortion-access.txt\n- **Type**: wiki\n- **Tags**: wiki, reference-wiki-pages\n- **Imported**: 2025-05-05T16:25:37.235Z",
  "source": {
    "type": "notebook",
    "path": "reference-wiki-pages/preserving-abortion-access.txt",
    "importedAt": "2025-05-05T16:25:37.235Z"
  },
  "created": "2025-05-05T16:25:37.235Z",
  "modified": "2025-05-05T16:25:37.235Z",
  "tags": [
    "wiki",
    "reference-wiki-pages"
  ]
}