{
  "title": "prose-ai_txt",
  "content": "# prose-ai.txt\n\nContent-Type: text/x-zim-wiki\nWiki-Format: zim 0.6\nCreation-Date: 2024-07-23T15:39:35-07:00\n\n====== prose-ai.txt ======\nYou will be given a random set of descriptions for a situation, scenario, or problem. Please use those descriptions to write a paragraph describing the situation. Use your imagination to give specifics. Write out the description like a story narrative.\r\nUsing the provided set of descriptions, please craft a detailed narrative of a situation, scenario, or problem. Use your creativity to fill in the specifics and bring the scenario to life. Your response should be written as a well-structured paragraph.\r\nA set of descriptors for a scenario will be given to you. Your task is to weave these elements into a coherent and engaging story narrative. Feel free to elaborate on the given descriptors and include any specific details that you think would enrich the scenario.\r\nYou will receive a random combination of descriptors representing a unique situation, scenario, or problem. Incorporate these descriptors into a vivid and compelling paragraph that describes the scenario. Use your creative thinking to provide additional context and detail.\r\nWith the provided set of scenario descriptors, create a rich narrative that effectively conveys the situation. Use your imagination to develop the specifics and enhance the scenario's impact. Your response should be in the form of a well-crafted paragraph.\r\nWe will present you with a series of descriptors that outline a situation, scenario, or problem. Your objective is to write a narrative paragraph that brings these descriptors to life, adding any necessary details and context to make the situation feel realistic and engaging.\n\n\n## Metadata\n- **Source**: All of it Anything Everything At Once/prose-ai.txt.txt\n- **Type**: document\n- **Tags**: document, All_of_it_Anything_Everything_At_Once, story\n- **Imported**: 2025-05-05T16:25:37.169Z",
  "source": {
    "type": "notebook",
    "path": "All of it Anything Everything At Once/prose-ai.txt.txt",
    "importedAt": "2025-05-05T16:25:37.169Z"
  },
  "created": "2025-05-05T16:25:37.169Z",
  "modified": "2025-05-05T16:25:37.169Z",
  "tags": [
    "document",
    "All_of_it_Anything_Everything_At_Once",
    "story"
  ]
}