{
  "title": "random_idea_txt",
  "content": "# random_idea.txt\n\nContent-Type: text/x-zim-wiki\nWiki-Format: zim 0.6\nCreation-Date: 2024-07-23T15:39:55-07:00\n\n====== random idea.txt ======\nif your machine is the only way to run a multiplayer server for the game:\nleave it empty: build what you need and clear the machine of anything else\nthis might set you free if people enjoy spending time here\nto keep things performant, let yourself and the other developers build\n(realtime) if you can: we would build places for the players to explore\n\nthe mechanics have to be world-changing. elevators, lifts, trolleys, pully systems: finite, but state changing\n\nif you fix a clock tower, it might remain functional for a few days: break again, maybe someone comes back to fix it\n\nimagine ways for the world to shift about: some areas are mobile, other areas are just versatile in their positioning\n\n\n## Metadata\n- **Source**: All of it Anything Everything At Once/random_idea.txt.txt\n- **Type**: document\n- **Tags**: document, All_of_it_Anything_Everything_At_Once, mechanic, fix\n- **Imported**: 2025-05-05T16:25:37.171Z",
  "source": {
    "type": "notebook",
    "path": "All of it Anything Everything At Once/random_idea.txt.txt",
    "importedAt": "2025-05-05T16:25:37.171Z"
  },
  "created": "2025-05-05T16:25:37.171Z",
  "modified": "2025-05-05T16:25:37.171Z",
  "tags": [
    "document",
    "All_of_it_Anything_Everything_At_Once",
    "mechanic",
    "fix"
  ]
}