{
  "title": "randomnotes_txt",
  "content": "# randomnotes.txt\n\nContent-Type: text/x-zim-wiki\nWiki-Format: zim 0.6\nCreation-Date: 2024-08-15T21:54:59-07:00\n\n====== randomnotes.txt ======\nYellow - Unorganized Notes\r\nGreen - Tips and useful information\r\nBlue - Active writing and editing\r\nPurple - Notes about the FPS game\r\nPink - Technical information\r\nWhite - Miscellaneous Notes\r\n\r\nMetallic Rebuke\r\n\r\nLanky dog\r\n\r\nWolf pack leader is scarred and battle worn\r\n\r\nKado the right answer\r\n\r\nAlex Cohen\r\n\r\nFitness for 10\r\n\r\nArchives building, Canadian archives library. Native american enrollment number.\r\n\r\nArcade Fire\r\n\r\nSAIB in your arms\r\n\r\nBuzzbrad check Hamilton, Ontario\r\nBuzzbrad Mcmaster University\r\n\r\nsouthern Ontario\r\n\r\nBoneco P400 HEPA & Activated Carbon Air Purifier, Multicolor.\r\n\r\nListen to Free WIll by Sam Harris!!!\r\n\r\nInevitable - Kevin Kelly\r\n\r\nMother Jones\r\n\r\nReady Player 1\r\n\r\nwwwwwwwwwwCluster Grenade Glow Blue, explodes mid air, and drops four other grenades that explode on impact\r\n\r\nCarbonite Freeze Gun\r\n\r\nHello, I would like to increase my credit limit.\r\n\r\nI'd like to improve my utilization\r\n\r\nPlan produce review\r\n\r\nSong of the Sea\r\nThe Breadwinner\r\n\r\nTomppabeats - you're cute\r\nFlica - Wasteland\r\n\r\nHal Clement Hard Science Fiction\r\n\r\nMission of Gravity\r\n\r\nBrowsers Corner\r\n\r\nThe lense men series EE doc smith\r\n\r\nDavid Drake\r\n\r\nBlood test panel\r\nBlood test for metabolism rate\r\n\r\nMiami showdown\r\n\r\n40 ounces of freedom\r\n\r\nkhan academy pixar storytelling\r\n\r\nphal\r\n\r\nArmmagedon film (pay attention to character introduction)\r\nJohn Wick films\r\n\r\nGigwalk\r\nRazer Synapse\r\nLunaStar563\r\nAre you afraid of monsters?\r\nGargantia\r\nThe Iorn druid Chronicles\r\nDresdin Filed\r\nHow to create a mind\r\nThe myth of evil\r\nNoragami\r\nRichard Dawkins - The greatest show on Earth\r\n$150 Ashley\r\nProfessor Richard Wolf\r\nLeviathan Wakes\r\nSnow Crash\r\nHull Zero Three\r\nBeyond good and evil - fredrich niche\r\nThe prince by machiaveli\r\nsteam boat bill jr - buster keaton\r\nGardens of the moon\r\nHumans from an alien perspective\r\nYager\r\nAdd to my watch list\r\n- Soldier\r\n- Screamers\r\n- Babylon 5\r\n- The Andromeda Strain\n\n\n## Metadata\n- **Source**: All of it Anything Everything At Once/randomnotes.txt.txt\n- **Type**: document\n- **Tags**: document, All_of_it_Anything_Everything_At_Once, character-design, story\n- **Imported**: 2025-05-05T16:25:37.171Z",
  "source": {
    "type": "notebook",
    "path": "All of it Anything Everything At Once/randomnotes.txt.txt",
    "importedAt": "2025-05-05T16:25:37.171Z"
  },
  "created": "2025-05-05T16:25:37.171Z",
  "modified": "2025-05-05T16:25:37.171Z",
  "tags": [
    "document",
    "All_of_it_Anything_Everything_At_Once",
    "character-design",
    "story"
  ]
}