{
  "title": "sprite-atlas_txt",
  "content": "# sprite-atlas.txt\n\nContent-Type: text/x-zim-wiki\nWiki-Format: zim 0.6\nCreation-Date: 2024-07-22T19:51:48-07:00\n\n====== sprite-atlas.txt ======\nThe error message is indicating that the AssetReferenceSpriteAtlas namespace or type cannot be found. This might be because the UnityEngine.U2D.AddressableAssets package is not installed or imported into the project, or the package is outdated. Here are some recommendations to resolve this error: \r\n\r\n1. Import the UnityEngine.U2D.AddressableAssets package: \r\n\r\n\ta. Open the Unity Package Manager by going to Window -> Package Manager.\r\n\t\r\n\tb. Search for the \"2D Sprite\" package and import it into your project.\r\n\t\r\n\tc. Import the Addressables package by searching for it in the Package Manager and importing it into your project. \r\n\t\r\n\td. If the package is already installed, try deleting it and re-importing it to resolve any errors or conflicts.\r\n\r\n2. Verify that you have added the correct namespace for the AssetReferenceSpriteAtlas class. You can try adding this line of code at the top of your script: \r\n\r\n\tusing UnityEngine.U2D.AddressableAssets;\r\n\r\n\tThis will allow you to access the AssetReferenceSpriteAtlas class.\r\n\r\nHere's the updated version of the script with the recommended changes:\r\n\r\n\r\nusing System.Collections.Generic;\r\nusing System.Threading.Tasks;\r\nusing UnityEngine;\r\nusing UnityEngine.AddressableAssets;\r\nusing UnityEngine.AddressableAssets.ResourceLocators;\r\nusing UnityEngine.AddressableAssets.ResourceProviders;\r\nusing UnityEngine.ResourceManagement.AsyncOperations;\r\nusing UnityEngine.U2D.AddressableAssets; // Added namespace import\r\n\r\npublic class ObjectDiscoveryManager : MonoBehaviour\r\n{\r\n\t[SerializeField] private AssetReferenceSpriteAtlas[] spriteAtlases;\r\n\r\n\tprivate readonly List<AsyncOperationHandle<SpriteAtlas>> _loadingSpriteAtlases =\r\n\t\tnew List<AsyncOperationHandle<SpriteAtlas>>();\r\n\r\n\tprivate async void Start()\r\n\t{\r\n\t\tawait LoadSpriteAtlases();\r\n\t\t// Do something after sprite atlases are loaded\r\n\t}\r\n\r\n\tprivate async Task LoadSpriteAtlases()\r\n\t{\r\n\t\t// Get all locations for the sprite atlas asset references\r\n\t\tvar locations = new List<IResourceLocation>();\r\n\t\tforeach (var assetReference in spriteAtlases)\r\n\t\t{\r\n\t\t\tlocations.AddRange(await Addressables.LoadResourceLocationsAsync(assetReference));\r\n\t\t}\r\n\r\n\t\t// Create a group operation to load all sprite atlases\r\n\t\tvar loadingOperation = Addressables.LoadAssetsAsync<SpriteAtlas>(locations, null,\r\n\t\t\tAddressables.MergeMode.Complete);\r\n\r\n\t\t// Wait for all sprite atlases to load and add them to the list of loaded sprite atlases\r\n\t\tforeach (var handle in await loadingOperation.Task)\r\n\t\t{\r\n\t\t\t_loadingSpriteAtlases.Add(handle);\r\n\t\t}\r\n\t}\r\n\r\n\tprivate async void OnDestroy()\r\n\t{\r\n\t\t// Unload all loaded sprite atlases\r\n\t\tforeach (var handle in _loadingSpriteAtlases)\r\n\t\t{\r\n\t\t\tawait Addressables.Release(handle);\r\n\t\t}\r\n\t}\r\n}\r\n \r\n\r\nI hope this helps. Let me know if you have any further questions or concerns!\n\n\n## Metadata\n- **Source**: All of it Anything Everything At Once/sprite-atlas.txt.txt\n- **Type**: document\n- **Tags**: document, All_of_it_Anything_Everything_At_Once, location, quest\n- **Imported**: 2025-05-05T16:25:37.197Z",
  "source": {
    "type": "notebook",
    "path": "All of it Anything Everything At Once/sprite-atlas.txt.txt",
    "importedAt": "2025-05-05T16:25:37.197Z"
  },
  "created": "2025-05-05T16:25:37.197Z",
  "modified": "2025-05-05T16:25:37.197Z",
  "tags": [
    "document",
    "All_of_it_Anything_Everything_At_Once",
    "location",
    "quest"
  ]
}