{
  "title": "sticky_notes_02_txt",
  "content": "# sticky_notes_02.txt\n\nContent-Type: text/x-zim-wiki\nWiki-Format: zim 0.6\nCreation-Date: 2024-07-23T15:44:55-07:00\n\n====== sticky notes 02.txt ======\nYes, I understand your idea. By splitting the sprite atlas up and adding a reference to it in the GridPointSystem, we can load only the required sprite atlas for a particular level, instead of loading the entire atlas each time. This will reduce the memory usage of the game and improve its performance.\r\n\r\nTo implement this, we can add a field to the GridPointSystem script that stores a reference to the sprite atlas for each level. Then, when we load a level, we can set this field to the corresponding sprite atlas. Finally, we can modify the code that retrieves the sprite from the atlas to use the correct atlas based on the level.\r\n\r\nThis approach will require some refactoring of the existing code, but it should be relatively straightforward. We can also write some unit tests to verify that the correct atlas is being used for each level, to ensure that the feature is working as expected.\r\n\r\nHello! My name is Chris. I have a few projects that I'm working on and would like to enlist your help in the efforts. How would you imagine interfacing with my local machine? We would go on to interact with the Unity game engine and build systems for game projects. I would also need your aid in the design process and have documents, text, and an abundance of writings to afford to you. How might we begin?\r\n\r\nThe mathematical correctness of a theory of quantum gravity requires internal consistency and is hard to achieve, but not as difficult as constructing a large collider around the sun between Mercury and Venus. To test the scales of quantum gravity, a much larger collider than the Large Hadron Collider is needed, with a similar set of magnets running all the way round the equator of the Earth. Although there is no direct experimental evidence of string theory or M theory, us as a species have the capability to understand and investigate these realms through building large experiments and devices. \r\n\r\nTo convince people to take the plunge into learning about these applications and their potential capabilities, I would highlight the following points:\r\n\r\n\tThese technologies and resources are at the forefront of their respective fields, and they have the potential to transform the way we live and work. By learning about them, people can stay ahead of the curve and be better prepared for the future.\r\n\r\n\tMany of these tools are open source or free, which means that anyone can access them and start using them without having to pay for expensive software licenses or subscriptions. This makes it easier for people to experiment with these tools and explore their potential.\r\n\r\n\tLearning about these tools can open up new opportunities for people, whether it's in terms of career development or personal growth. For example, people who learn about blockchain technology may be able to apply it to their business or startup ideas, while those who learn about natural language processing may be able to create new chatbots or virtual assistants.\r\n\r\n\tBy learning about these tools, people can also become better informed about the latest developments in technology and how they may impact society. This can help people make more informed decisions about how they use technology and contribute to the broader conversation around tech ethics and responsibility.\r\n\r\nOverall, I would emphasize the potential benefits of learning about these technologies and resources, and how they can empower people to create new solutions and drive innovation in their respective fields.\r\n\r\n\r\nThe 'PointNoteSystem' is an amalgamation of scripts. ConnectionLine.cs, CreateNewNoteChain.cs, Cursor.cs, CursorManager.cs, Label.cs, Note.cs, NoteButton.cs, NoteComponent.cs, NoteCreator.cs, NoteData.cs, NoteDetailWindow.cs, NoteDictionary.cs, NoteDisplay.cs, NoteIndexItem.cs, NoteManager.cs, NoteRemover.cs, NoteIndexWindow.cs, NoteSystemUI.cs, UndoRedo.cs, HideConnectionLine.cs, SetNoteData.cs. I just created _PointNoteSystem.cs. You will have to use your upmost development ability to imagine implementation.\r\n\r\nAs a senior Unity game developer, I recommend that we first take a look at the requirements and goals for the game's point and note system, and then assess how we can integrate and optimize the existing scripts into the new _PointNoteSystem.\r\n\r\nSome possible requirements for the point and note system might include:\r\n\r\n- The ability for players to create and edit notes, including the ability to add text, images, and links.\r\n- A connection system to link notes together in chains, allowing players to create complex hierarchies or diagrams.\r\n- A user-friendly interface for managing and organizing notes, including search and filtering functionality.\r\n- The ability for players to undo and redo changes to their notes and connections.\r\n\r\nTo accomplish these requirements, we could begin by creating a new C# script called _PointNoteSystem, which would serve as the main hub for managing all of the other scripts related to notes and connections. \r\n\r\nHere are some possible steps we could take to implement the system:\r\n\r\n1. Define the data structures for the note and connection objects, including properties such as position, text, color, and parent/child relationships.\r\n\r\n2. Create a class to handle the creation and deletion of notes, based on the existing NoteCreator and NoteRemover scripts.\r\n\r\n3. Create a script to manage the display of notes and connections, based on the existing NoteDisplay and ConnectionLine scripts. This script would handle the placement and sizing of each note, as well as drawing lines between connected notes.\r\n\r\n4. Develop a search and filtering UI, based on the existing NoteSystemUI and NoteIndexWindow scripts. This would allow players to quickly find and organize their notes based on criteria such as title, date, or color.\r\n\r\n5. Implement undo and redo functionality, based on the existing UndoRedo script. This would allow players to easily fix mistakes or experiment with different note configurations without fear of data loss.\r\n\r\n6. Optimize the code for performance and scalability by using efficient data structures, minimizing redundant calculations, and reducing the number of GameObjects created at runtime.\r\n\r\nWith these steps in place, we would have a robust and intuitive system for managing notes and connections in our game. By leveraging the existing code and functionality of the PointNoteSystem scripts, we can save development time and ensure that our final product is a high-quality and polished gaming experience.\r\n\r\nAs a senior Unity game developer, I recommend that we first take a look at the requirements and goals for the game's point and note system, and then assess how we can integrate and optimize the existing scripts into the new _PointNoteSystem.\r\n\r\nSome possible requirements for the point and note system might include:\r\n\r\n- The ability for players to create and edit notes, including the ability to add text, images, and links.\r\n- A connection system to link notes together in chains, allowing players to create complex hierarchies or diagrams.\r\n- A user-friendly interface for managing and organizing notes, including search and filtering functionality.\r\n- The ability for players to undo and redo changes to their notes and connections.\r\n\r\nTo accomplish these requirements, we could begin by creating a new C# script called _PointNoteSystem, which would serve as the main hub for managing all of the other scripts related to notes and connections. \r\n\r\nHere are some possible steps we could take to implement the system:\r\n\r\n1. Define the data structures for the note and connection objects, including properties such as position, text, color, and parent/child relationships.\r\n\r\n2. Create a class to handle the creation and deletion of notes, based on the existing NoteCreator and NoteRemover scripts.\r\n\r\n3. Create a script to manage the display of notes and connections, based on the existing NoteDisplay and ConnectionLine scripts. This script would handle the placement and sizing of each note, as well as drawing lines between connected notes.\r\n\r\n4. Develop a search and filtering UI, based on the existing NoteSystemUI and NoteIndexWindow scripts. This would allow players to quickly find and organize their notes based on criteria such as title, date, or color.\r\n\r\n5. Implement undo and redo functionality, based on the existing UndoRedo script. This would allow players to easily fix mistakes or experiment with different note configurations without fear of data loss.\r\n\r\n6. Optimize the code for performance and scalability by using efficient data structures, minimizing redundant calculations, and reducing the number of GameObjects created at runtime.\r\n\r\nWith these steps in place, we would have a robust and intuitive system for managing notes and connections in our game. By leveraging the existing code and functionality of the PointNoteSystem scripts, we can save development time and ensure that our final product is a high-quality and polished gaming experience.\r\n\r\n\r\nSure, here are some of the key components of a typical game system in Unity:\r\n\r\n1. Player controller: This component handles input from the player and manages the character or object's movement, animation, and other related behaviors.\r\n\r\n2. Enemy AI: This component handles the behavior and decision-making of enemies in the game, including movement patterns, attacking, and retreating.\r\n\r\n3. Combat system: The combat system is responsible for handling the interactions between the player and enemies, including hit detection, damage calculation, and other related mechanics.\r\n\r\n4. User interface: The user interface (UI) is responsible for displaying information to the player, including health bars, menus, and other graphical elements.\r\n\r\n5. Audio system: This component handles the playing of sound effects and background music in the game.\r\n\r\n6. Level design: This component involves the creation of levels and environments within the game world, including the placement of objects, enemies, and obstacles.\r\n\r\n7. Game physics: The game's physics system is responsible for calculating the movement and interaction of objects, including gravity, collisions, and other related mechanics.\r\n\r\n8. Networking: If you are making a multiplayer game, then networking will be involved to manage players' interactions.\r\n\r\nThere may be additional components depending on the type of game being developed, but these are some of the key components that Unity developers commonly use in game development.\r\n\r\n\r\nOk, I understand. It sounds like you may be running into memory issues due to the size of your sprite atlas. One solution could be to split up your sprite atlas into smaller textures that can be loaded and unloaded as needed. \r\n\r\nAnother solution could be to optimize your sprite atlas. One way to do this is to use texture compression with DXT or ASTC compression formats. Unity has built-in tools for texture compression that you can use to reduce the size of your sprite textures without significantly affecting the quality.\r\n\r\nAdditionally, you could look into using sprite packing tools such as TexturePacker or SpritePacker to pack your sprite textures into smaller sheets, which can help optimize your game's performance and reduce memory usage.\r\n\r\nFinally, it's important to ensure that you're using the latest version of Unity and all of its performance optimization features. Unity often releases new updates with improved performance optimization, so it's always a good idea to check for updates and implement any new features that can improve your game's overall performance.\r\n\r\n\r\n1. For the NoteCreator and NoteRemover scripts, I'll create two separate new scripts (NoteCreator.cs and NoteRemover.cs) that will handle adding and removing notes from the game. These scripts will need access to the Input system to detect when the player wants to add or remove a note. I will then add these scripts to the player's controller so that it can interact with the game's objects.\r\n\r\n2. To make the undo/redo keys 'z' and 'x' respectively, I will create a new script (UndoRedo.cs) that will handle the history of the game's actions. It will listen for the 'z' and 'x' keys and will undo or redo the previous action when pressed.\r\n\r\n3. To make the search function visible only when a dev cheat is activated, I will create a new script (DevCheat.cs) that will handle the activation of developer cheats. When the 'c' key is pressed, the script will enable the search function. I will also add a condition to the search function itself that will check if the dev cheat is enabled before showing it.\r\n\r\n4. For the Note System UI, I will create a new script (NoteSystemUI.cs) that will toggle the UI when the 'Tab' key is pressed. This script will need access to the UI elements of the game's Note System and will enable/disable them as needed.\r\n\r\nOnce I have completed these changes, I will test the game thoroughly to ensure that everything is working as intended.\r\n\r\n\r\nOne thing to note is that if the cursor is only being updated when certain conditions are met (e.g. when the mouse is over a certain object), it might be more efficient to only update the cursor when necessary, rather than every frame in the Update() function. You could achieve this by adding a check to see if the current cursor texture and hotspot already match the desired values, and only call SetCursor if they don't match.\r\n\r\nIn this modified version, we've added a check to see if the desired cursor texture and hotspot already match the current values. If they don't match, we call Cursor.SetCursor and update the currentCursorTexture and currentHotspot variables in the CursorManager class.\r\n\r\nWith this modification, you can now call the SetCursor method every frame in the Update() function without worrying about unnecessary performance overhead.\r\n\r\n\r\nIt sounds like the Note System, Point Note System, and Grid Point System are all great tools for managing notes and objects in the game world. These features would be particularly useful for players who are exploring the game world and need to keep track of various objects, quests, and other important information. The ability to link notes to specific objects and navigate through note chains using a scrollbar would make it easy to keep track of everything, while the auto-indexing system and dictionary would help users quickly find the information they need. Additionally, the use of labels and categories would allow users to organize their notes in a way that makes sense to them. Overall, these features would be a valuable addition to any game that requires players to navigate a complex environment and keep track of multiple objectives.\r\n\r\n\"Would you please build CursorManager.cs to mesh with the other systems?\"\n\n\n## Metadata\n- **Source**: All of it Anything Everything At Once/sticky_notes_02.txt.txt\n- **Type**: document\n- **Tags**: document, All_of_it_Anything_Everything_At_Once, character-design, item, story, quest, feature, mechanic, fix\n- **Imported**: 2025-05-05T16:25:37.199Z",
  "source": {
    "type": "notebook",
    "path": "All of it Anything Everything At Once/sticky_notes_02.txt.txt",
    "importedAt": "2025-05-05T16:25:37.199Z"
  },
  "created": "2025-05-05T16:25:37.199Z",
  "modified": "2025-05-05T16:25:37.199Z",
  "tags": [
    "document",
    "All_of_it_Anything_Everything_At_Once",
    "character-design",
    "item",
    "story",
    "quest",
    "feature",
    "mechanic",
    "fix"
  ]
}