{
  "title": "sum_notes_txt",
  "content": "# sum_notes.txt\n\nContent-Type: text/x-zim-wiki\nWiki-Format: zim 0.6\nCreation-Date: 2024-07-23T15:45:22-07:00\n\n====== sum notes.txt ======\nCheat layer for everything\r\n\r\nUse Khan Academy to learn\r\n(What do you need to know, what do you need?)\r\n\r\nBuild your game with the player perspective in mind.\r\n\r\nGet a rasberry pi start a server\r\nbuild your website\r\n\r\nTranscribe all the relevant youtube videos \r\nuse them to train the model\r\n\r\ntranscribe your recordings\r\n\r\ndiscern the relevant data\r\n\r\noffload all the online saves (discord) (google drive)\r\n(setup dropbox)\r\n\r\ndecide how to use your drives\r\n- reorganize your data\r\n\r\nReach out to CycadaAcolyte. Has not left me added. To suggest that I might be damned a friend because I used the art generation tools. He has not known my circumstance. I would not so be afforded to art from him. And it was so much, so much art all at once. To see these things as an artist might be absolutely deadful. But to stagnate because I could not imagine further what I wanted to build though I have to talent to find this myself? \r\n\r\nIs it a sin to enable everyone to do everything? He sees a loss of business, I have not the ability to afford his talent though I would not see the reason at a loss of a friend and colleague. \r\n\r\nOkay, this is where you are at. \r\n\r\n- You are pushing your local repositories on Ubuntu\r\n- You are waitng for this to finish so you may apply the Unity collaborate feature as  GitHub repository and (inventing) a new system for updating on save.\r\n\r\nYou have found another background task. Depositing the entire discord server: cleaning it up, organizing it\r\n\r\nYou are also searching in these things for what they are, how I may further organize, store, or make use of the text. This will not go to operation!! bring all of these resources to local organization, do not extend research into extant action you will get lost.\r\n\r\nThis is going to be very difficult. You are searching through memory that needs to be brought back to people. \r\n\r\nNot everything here is important or needs to be backed up. Tell about a thing specifically and you may not lose context.\r\n\r\nYou have found another main goal. We are to transcibe my collection of books. Right now they are saved to Google Drive but we will need to find another resources that is non-discoverable. We might use github and apply random names to the documents. Then source them with names elsewhere.\n\n\n## Metadata\n- **Source**: All of it Anything Everything At Once/sum_notes.txt.txt\n- **Type**: document\n- **Tags**: document, All_of_it_Anything_Everything_At_Once, feature\n- **Imported**: 2025-05-05T16:25:37.200Z",
  "source": {
    "type": "notebook",
    "path": "All of it Anything Everything At Once/sum_notes.txt.txt",
    "importedAt": "2025-05-05T16:25:37.200Z"
  },
  "created": "2025-05-05T16:25:37.200Z",
  "modified": "2025-05-05T16:25:37.200Z",
  "tags": [
    "document",
    "All_of_it_Anything_Everything_At_Once",
    "feature"
  ]
}