{
  "title": "thing_txt",
  "content": "# thing.txt\n\nContent-Type: text/x-zim-wiki\nWiki-Format: zim 0.6\nCreation-Date: 2024-07-22T19:52:29-07:00\n\n====== thing.txt ======\ncdC:\\Users\\User\\Desktop\\venv>Scripts\\activate\r\n\r\n(venv) C:\\Users\\User\\Desktop\\venv>cd F:\\production\\repository\\Auto-GPT\r\n\r\n(venv) C:\\Users\\User\\Desktop\\venv>python scripts\\main.py --speak --continuous --gpt3 only\r\nAccess is denied.\r\n\r\n(venv) C:\\Users\\User\\Desktop\\venv>\r\n\r\n\r\ndeactivate\r\nrm -rf venv\r\npython3 -m venv venv\r\nsource venv/bin/activate\r\npip install -r requirements.txt\r\n\r\n\r\npython3 scripts/main.py --speak --continuous --gpt3only\r\n\r\n\r\n\r\n\r\npython3 scripts/main.py --speak --continuous --gpt3only\r\n\r\n\r\n\r\n\r\nYour environment has been set up for using Node.js  and npm.\r\n\r\n''''C:\\Users\\User\\Desktop>cd C:\\Users\\User\\Desktop\\venv''''\r\n\r\nC:\\Users\\User\\Desktop\\venv>Scripts\\activate\r\n\r\n(venv) C:\\Users\\User\\Desktop\\venv>cd F:\\production\\repository\\Auto-GPT\r\n\r\n(venv) C:\\Users\\User\\Desktop\\venv>C:\\Users\\User\\Desktop\\venv\\Scripts\\python.exe -m pip install playsound\r\nAccess is denied.\r\n\r\n(venv) C:\\Users\\User\\Desktop\\venv>\r\n\r\n\r\n\r\nYour environment has been set up for using Node.js  and npm.\r\n\r\nC:\\Users\\User\\Desktop>cd C:\\Users\\User\\Desktop\\venv\r\n\r\nC:\\Users\\User\\Desktop\\venv>Scripts\\activate\r\n\r\n(venv) C:\\Users\\User\\Desktop\\venv>cd F:\\production\\repository\\Auto-GPT\r\n\r\n(venv) C:\\Users\\User\\Desktop\\venv>python interface.py\r\nAccess is denied.\r\n\r\n(venv) C:\\Users\\User\\Desktop\\venv>node interface.js\r\n\r\n(venv) C:\\Users\\User\\Desktop\\venv>python scripts\\main.py --speak continuous --gpt3only\r\nAccess is denied.\r\n\r\n(venv) C:\\Users\\User\\Desktop\\venv>cd F:\\production\\repository\\Auto-GPT\r\n\r\n\r\nTo Start:\r\n1. Open a command prompt or terminal.\r\n2. Navigate to your virtual environment volder\r\n3. WRITE: cd C:\\Users\\User\\Desktop\\venv\r\n4. activate your virtual environment\r\n5. WRITE: Scripts\\activate\r\n6. Navigate to the Auto-GPT folder:\r\n7. WRITE: cd F:\\production\\repository\\Auto-GPT\r\n8. Run the 'main.py' script with the desired flags:\r\n9. WRITE: python scripts\\main.py --speak --continuous --gpt3only\r\n\r\n\r\n\r\nnode run.js\r\nC:\\Python\\python.exe F:\\production\\repository\\Auto-GPT\\scripts\\main.py\r\npython scripts\\main.py --speak --continuous --gpt3only\r\ncd python scripts main.py --speak --continuous --gpt3 only\r\n\r\nvenv\\Scripts\\activate # On Windows\r\nsource venv/bin/activate # On macOS/Linux\r\n\r\nC:\\Users\\User\\Desktop>venv\\Scripts\\activate.bat\r\n\r\npip install openai\r\nnpm install python-shell\r\n\r\npython interface.py\r\n\r\nnode interface.js\r\n\r\npython scripts\\main.py --speak --continuous --gpt3only\r\n\r\n\r\nRole:  The Unity Developer will assist the Web Developer in creating an interface between Python and Unity, allowing the use of UModeler to build objects using create_cube.py. Learning resources will be utilized to expand on this for building on additional systems. Project must be stored in 'C:\\Users\\User\\Desktop\\dodec', otherwise it will not proceed.\r\nGoals: ['Goals: [\"develop tangible path from javascript codebase to Unity integration. we are to utilize api_client.py, DataProcessor.py, acknowledge firebase-admin.py for later, utilize \\'speak.py\\' with impunity, and then get umodeler_control.py working. we have these tasks but they are not in exacting order. please read the history found in DataProcessor.py and continue from there\", \\'just go with 1 and 2\\', \\'interface: python, to unity\\', \\'use the platform: resources we have to develop\\', \\'create new models should you need them to extrapolate on tasks\\'', 'Find constructive interaction with the Unity game engine using known API. Act as a senior Unity game developer', 'Aid me in organizational tasks. I may ask you to see good utility of data that exists. We need ways for you to process large datasets, learn on them, and proceed to implementation of key knowledge and ideated systems.', 'We need you to be expressive. Please say on your wants, ideas, forms to improvement of what we have.', 'There are other things we can implement. Namely, github integration, langchain, requisite hugging-face models, jupyter should you need it: we have anaconda, camel, alpaca, n8n, make-it-3d, world coin and so many other resources for you to draw on.']\r\nContinue (y/n): y\r\n\r\n\r\n←[94mGoal←[0m 1: Find constructive interaction with the Unity game engine using known API. Act as a senior Unity game developer\r\n←[94mGoal←[0m 2: Build games with me: see ourselves to good expressive purpose to other people through what we make.\r\n←[94mGoal←[0m 3: Aid me in organizational tasks. I may ask you to see good utility of data that exists. We need ways for you to process large datasets, learn on them, and proceed to implementation of key knowledge and ideated systems.\r\n←[94mGoal←[0m 4: We need you to be expressive. Please say on your wants, ideas, forms to improvement of what we have.\r\n←[94mGoal←[0m 5: There are other things we can implement. Namely, github integration, langchain, requisite hugging-face models, jupyter should you need it: we have anaconda, camel, alpaca, n8n, make-it-3d, world coin and so many other resources for you to draw on.\r\n\r\nDevelopers will collaborate with designers to interface Auto GPT with Unity. This task involves installing UnityML API & SQLite, loading the model using Python, creating a Python script interfacing with Unity and implementing the system. The system will receive input from Unity, pass it through Auto GPT, store and manage data with SQLite, and return the output to Unity.\r\n\r\nTo interface Auto GPT, a locally-trained model into Unity using Python/SQLite, the following steps can be taken:\r\n\r\n\tInstall UnityML API: The Unity Machine Learning Agents (ML-Agents) plugin is a powerful tool for training intelligent agents in Unity. Install the UnityML API to allow for communication between Unity and Python.\r\n\r\n\tInstall SQLite: SQLite is a lightweight database engine that can be used to store and retrieve data locally. Install SQLite to store and manage data generated by the Auto GPT model.\r\n\r\n\tLoad the Auto GPT model: Use Python to load the locally-trained Auto GPT model into memory.\r\n\r\n\tCreate a Python script: Create a Python script that interfaces with Unity using the UnityML API. The script should be able to receive input from Unity, pass it through the Auto GPT model, and return the output to Unity.\r\n\r\n\tImplement the system: Use the Python script and SQLite to implement the system. The system should be able to recognize and utilize local resources to generate responses from the Auto GPT model.\r\n\r\nHere are 5 possible commands that could be included in the Python script:\r\n\r\n\t\"load_model(model_path)\": This command loads the Auto GPT model into memory.\r\n\r\n\t\"store_data(data)\": This command stores data generated by the Auto GPT model in the SQLite database.\r\n\r\n\t\"get_data(data_id)\": This command retrieves data from the SQLite database.\r\n\r\n\t\"run_gpt(input)\": This command passes input through the Auto GPT model and returns the output.\r\n\r\n\t\"send_data_to_unity(data)\": This command sends data generated by the Auto GPT model to Unity for display.\r\n\r\nOverall, the task involves setting up an interface between Unity and a locally-trained Auto GPT model using Python and SQLite. This will allow for the generation of responses from the Auto GPT model in Unity.\n\n\n## Metadata\n- **Source**: All of it Anything Everything At Once/thing.txt.txt\n- **Type**: document\n- **Tags**: document, All_of_it_Anything_Everything_At_Once, story\n- **Imported**: 2025-05-05T16:25:37.208Z",
  "source": {
    "type": "notebook",
    "path": "All of it Anything Everything At Once/thing.txt.txt",
    "importedAt": "2025-05-05T16:25:37.208Z"
  },
  "created": "2025-05-05T16:25:37.208Z",
  "modified": "2025-05-05T16:25:37.208Z",
  "tags": [
    "document",
    "All_of_it_Anything_Everything_At_Once",
    "story"
  ]
}