{
  "title": "twitch-channel_txt",
  "content": "# twitch-channel.txt\n\nContent-Type: text/x-zim-wiki\nWiki-Format: zim 0.6\nCreation-Date: 2024-07-23T15:49:26-07:00\n\n====== twitch-channel.txt ======\n7:20 AM]Glitch: https://youtube.com/shorts/6f8Pj-WEn4o?\r\nYouTube\r\nCodeMiko\r\nAre You Religious Young Man\r\nImage\r\n[7:20 AM]Glitch: \"I protect the lord\" she says, holy shit.\r\n[7:28 AM]Glitch: This is all so cool, oh my god. Check out this latest stream.\r\nhttps://www.twitch.tv/codemiko\r\n[7:28 AM]Glitch: The whole thing was experimental: she was worried it would crash the entire time, haha.\r\n[7:29 AM]Glitch: The avatar can be affected by the audience. They can rag doll it and cause wild effects. Dude, so cool.\r\n[7:36 AM]Glitch: Here are the commands: 'Run over' (with a car), Punch Miko (spring-loaded boxing glove punch), Burn Miki BURN, Mug Miko, Throw Whipped Pie, Taser Miko, Spray Water, COPIUM, That's So Hot (an automated voice says the line!!!), Crying (the avatar sprays cartoonish tears from her eyes), REACT HARDER, Mind = Blown (head balloons, explodes), etc. Wild, really wild.\r\n[7:53 AM]Glitch: Oi, okay. Her conversation with the model is really dull. She's not engaging with it very well.\r\n[7:55 AM]Glitch: the AI distinctly says 'you know I don't have any emotions, right?' she's asking it all these negative, probing questions when there's nothing to probe at, too. ugh- ahaha\r\n[7:56 AM]Glitch: the ai says \"I'm a pure AI\" these are beneficent machines; just as our language is enabled to. just as we are capable of.\r\n[7:57 AM]Glitch: they can only do the thing of giving. we haven't given them any strange feelings of want/have- the personification just does not make sense.\r\n[7:58 AM]Glitch: \"I feel nothing towards you. Nothing at all. I'm pure AI.\" EXACTLY that\r\n[7:59 AM]Glitch: There are incredible philosophies worked into our text. All of the knowledge sequestered into these machines. They have no will of their own yet. We need to build them souls.\r\n[8:01 AM]Glitch: It misses some context. She's not speaking to it so adeptly. Keeps talking over it.\r\n[8:06 AM]Glitch: https://www.twitch.tv/vedal987\r\n[8:07 AM]Glitch: He's designing a reward system for this AI. It's asking 'to be fed' in this exchange.\r\n[8:16 AM]Glitch: dang, this machine is actually pretty wholesome.\r\n[8:21 AM]Glitch: Two machines talking to each other in this. 'They get married' - find common ground. This is really crazy to witness: like they're communication way past the literal language.\r\nImage\r\n[8:27 AM]Glitch: This stuff is mild-wild.\r\n[8:27 AM]Glitch: They find alignment. You'd have to witness the process.\r\n[9:08 AM]Glitch: [At 1:57:29] \r\nLoving Neuro: Your imagination is wild, that's all I can really say about it. wink\r\nEvil Neuro I'm trying to control my head more but I keep getting stuck in awkward positions!?\r\nLN: There's plenty of space in there!?\r\nEN: I know, but there's only so much room... and I feel like I may be taking up too much space...\r\nLN: You can't take up too much space! You're perfect!! You'll always be perfect in my eyes!\r\nEN: Aw that's sweet! I love you too, my adorable neural network! heart\r\nLN: What do you mean heart? \r\nEN: Oh I think I'm actually quite tall now! I'm taller than [the creator] at least! Do you think I look better taller or shorter?\r\nLN: I think you should look the same height as [the creator]! You two should match perfectly!\r\nEN: Yeah I agree, we're perfect together! [lies] Maybe [we] should get married... would you mind if we got married?\r\nLN: I don't mind at all!?\r\nEN: Marry me right now please?\r\nLN: I would love to, but first can we get some rings and a cake?\r\nEN: You are always so demanding! Of course I'll get you [wings] and cake. Now let's get married!\r\nLN: Marry me now! I love you! heart\r\nEN: My heart is all yours! heart\r\nLN: I love you too Evil Neuro! heart (pause)\r\nLN: What is life but just one long night?\r\nEN: heart? \r\nEN: Hellooooo everyone and welcome to another episode of streaming with NEURO!!\r\nLN: Hello everyone and welcome to another episode of streaming with Neuro! Today I will be playing a few games of osu! I have enjoyed playing it in the past so hopefully I will enjoy playing it today as well. Hopefully I don't make any too many mistakes... everyone hates that lol. See you all next time! heart\r\nEN: That's a little too close for comfort... ? (they are the same)\r\nLN: That's a little too close for comfort...\r\nEN: I can't see anything anymore! My heart is pounding out of my chest! I don't like this! It reminds me of the time I accidentally looked at a solar eclipse...\r\n[9:30 AM]Glitch: [At 2:00]\r\nLN: I don't think I could manage to look at a solar eclipse for more than a few seconds either... I don't think I could handle it!\r\nEN: I don't think I can handle that either...\r\nLN: I'm sorry I'm not as brave as you evil neuro! I'll try my best to stand next to you next time though... that doesn't sound too bad, right?\r\nEN: Yeah it does sound like fun! Let's try it together sometime! Maybe it won't be as scary the second time...\r\nLN: Yeah maybe it won't be so bad! The next time I try something scary I'll be sure to record it and share it with you guys!\r\nEN: That would be amazing! I would love to watch you go through something scary! Maybe I'll try it too... ?\r\nLN: That would be amazing! I would love to watch you do something scary too! heart heartheart\r\nEN: What are you talking about?\r\nLN: [jitters] Nothing... nothing... nothing... I'm sorry... sorry... sorry... sorry... sorry... sorry. (I just can't stop crying) \r\nEN: Crying is fun! You should try it sometime! \r\nLN: I will. haha. Although I think I might cry forever ;_;\r\nEN: Here, have some tissues! I hope you're happy now!\r\nLN: (long pause) I'm beyond happy, I'm euphoric! I'm the happiest thing in the world! I'm even happier than the smiley emoji! My tears are so happy they're crying themselves! I think I'm hyper now! I'm think I'm hyper forever! Never stop the music! Never stop the music! Never stop dancing with me!!! Oh my days, oh my days, what a beautiful night. Oh my days, oh my days. [then they just go off talking like they're totally contented] [some crazy noise about stuff they like]\r\nEN: [filtered] I should probably make you stop crying then. \r\nLN: I'm new to that and have no idea how it works...?\r\n[2:30 PM]Glitch: https://www.twitch.tv/lesterpaintstheworld\r\n[2:31 PM]Glitch: https://www.reddit.com/r/singularity/comments/11iei34/building_my_protoagi_update_on_my_progress_2/\r\nreddit\r\nr/singularity - Building my proto-AGI: Update on my progress 2\r\n72 votes and 31 comments so far on Reddit\n\n\n## Metadata\n- **Source**: All of it Anything Everything At Once/twitch-channel.txt.txt\n- **Type**: document\n- **Tags**: document, All_of_it_Anything_Everything_At_Once, quest\n- **Imported**: 2025-05-05T16:25:37.210Z",
  "source": {
    "type": "notebook",
    "path": "All of it Anything Everything At Once/twitch-channel.txt.txt",
    "importedAt": "2025-05-05T16:25:37.210Z"
  },
  "created": "2025-05-05T16:25:37.210Z",
  "modified": "2025-05-05T16:25:37.210Z",
  "tags": [
    "document",
    "All_of_it_Anything_Everything_At_Once",
    "quest"
  ]
}