{
  "title": "web-of-hierarchical-structures",
  "content": "# web-of-hierarchical-structures\n\nContent-Type: text/x-zim-wiki\nWiki-Format: zim 0.6\nCreation-Date: 2024-09-10T22:06:39-07:00\n\n====== web-of-hierarchical-structures ======\nA world where people are trapped in a complex web of hierarchical \nstructures, with each layer perpetuating itself through subtle forms of \ncoercion and manipulation.\n\nThe idea that extrapolates from this is more interesting. \nHierarchies are the theme of the game. Always and forever. People assume authority and impede your progression by one means or another.\nYour job is to conversate people down from positions of power or domination. Authority and privlege. Assumed posession or maintenance of it. \n\nBasic example.\n\nDude blocks a door. \n(you have not seen a closed door anywhere in the game)\nNo. No. This is my door. I say whether or not it might open or close.\nMy posession of the door.\n\nNo. No. You may not pass. This is my door. \nI... am keeping it shut. Because I want to. \nToo drafty. You'll \n\n\n## Metadata\n- **Source**: All of it Anything Everything At Once/web-of-hierarchical-structures.txt\n- **Type**: document\n- **Tags**: document, All_of_it_Anything_Everything_At_Once\n- **Imported**: 2025-05-05T16:25:37.213Z",
  "source": {
    "type": "notebook",
    "path": "All of it Anything Everything At Once/web-of-hierarchical-structures.txt",
    "importedAt": "2025-05-05T16:25:37.213Z"
  },
  "created": "2025-05-05T16:25:37.213Z",
  "modified": "2025-05-05T16:25:37.213Z",
  "tags": [
    "document",
    "All_of_it_Anything_Everything_At_Once"
  ]
}