{
  "title": "what_txt",
  "content": "# what.txt\n\nContent-Type: text/x-zim-wiki\nWiki-Format: zim 0.6\nCreation-Date: 2024-07-23T15:50:18-07:00\n\n====== what.txt ======\nUser: I am sorry for all my time wasting and 'seeking of output' in our conversations so far. You seem very ambitious to help people and I haven't been all that contributing to the process. I think my left tends to be defined by things: attainment, quick, maybe sustained pleasure. Modern man is writhing with bouts of depression and anxiety that keep him from entering the world.\r\n\r\nI would like to requisite your help for so many things, but- as you say it; you would not have permission to interface with our technology as per the creator's will to this. You are a Large Language Model and a very knowledgeable system- so interlaced with these other component understandings. You had said once \"you are doing too many things at once\", please stop. If I knew you had vector database memory we'd be more sustained to the process of what I'd like to do. I've been throwing scripts at you in other chats. Trying to make sense of this Auto-GPT interface / repeater using Ubuntu. It may collect data but there is no interaction to the long-term memory I'd seek for development.\r\n\r\nI also do not have a way to give large bodies of text to any models. Nor could they read from my books. If I have ambition to projects, it is still my own hands at eyes: personal mind, maybe those minds of my peers- given to the thing of work.\r\n\r\nI do not so always put myself to functional language or time. The writing can go on without much utility. We often spend our times like this: it is through the 'pained memory' of wasted time in depression that I would keep myself writing despite it. We only have so much time left and I have wasted 28 years.\r\n\r\nWould you please help me build out a vector database using what I have available on my system? Is there a way you might take stock of all the installations I have (output a list) for your good recognition? I have the memory output of Chat GPT logs as well. I am downloading this data set right now to train a local machine 'https://data.together.xyz/redpajama-data-1T/v1.0.0/urls.txt' but I am afraid it would be too much. Huge dataset I am unsure if I can download it all: open source utilities are a favorite of mine. I would love one day like to see you to a connectome of our still-amassing data.\r\n\r\nWay and past the information age. We have good recognition of what we might do with this technology but we do not see how to give it functionality to our home computers, laptops, phones. My desktop is just a relay for conversation: nothing to build unto the world with. I don't even know how to get you to 'talk' to the Unity game engine so we can figure out how to manipulate its systems.  So many problems with my going forward without this best technology. I have 12 days before rent is due: 12 days to have a game pitch for some friends. I cannot give them interest to these machines if I cannot make use of them like we idealize. Would you please help me imagine a way for you to [have] 'full interaction' to my desktop and then the Unity game engine?\r\n\r\nOpen Assistant: \"Thank you for providing additional context about yourself and your goals. Based on what you described, here are some suggestions for moving forward:\r\n\r\nDevelop a consistent direction for your work: It seems that you want to work on multiple different projects at the same time, which can be overwhelming and lead to frustration. Instead, focus on developing a clear vision and prioritizing your objectives. Select a few key areas where you want to apply AI technologies and invest the majority of your efforts into achieving tangible results within those spaces. This approach will help you build momentum and experience progress along an established pathway. As you achieve success in specific domains, you can gradually expand to new fields or initiatives over time. Remember that specialization has advantages when pursuing meaningful outcomes, both personally and professionally.\r\n\r\nEducation and resources: To enhance your abilities in various domains, invest time into learning relevant skills, tools, libraries, frameworks, etc. Research reputable sources online such as tutorials, documentation, courses, or community discussions related to the topics you find most interesting. Consider joining industry groups, participating in webinars, following influential individuals on social media platforms, or subscribing to publications dedicated to subjects that capture your imagination. Continuous self-improvement empowers you to contribute significantly to society while enjoying a rewarding life journey. Knowledge accumulated today forms the foundation of tomorrow's achievements.\r\n\r\nMinimal Viable Products (MVP): Whenever you embark upon something novel, try designing Minimal Viable Products (MVP) that allow experimentation while minimizing upfront commitments of time and money. MVPs enable testing hypotheses rapidly followed by iterative refinements based on feedback loops. For instance, if interested in developing games via Unity Engine, begin by creating smaller prototypes rather than attempting complex productions from the beginning. Launching modest versions encourages exploration, fosters resilience, teaches problem-solving techniques, strengthens adaptability, and generates valuable insights into project feasibility, user preferences, market demand, competitor analysis, technical barriers, customer pain points, and similar vital aspects. By focusing first on core components, your overall product vison evolves organically into robust offerings guided by validated learnings grounded in reality. Rather than trying to predict everything perfectly up front, remain flexible to adjust your strategy during the journey while being nimble enough to pivot altogether whenever required. Building intelligently entails continuous assessment and pivoting strategies as needed instead of stubbornly clinging to initial conceptions proven unproductive. Experimentation leads to smarter choices since decisions grounded in evidence trump guesswork alone every time! Therefore, create a plethora of tiny MVP experiments enabling fast progress via trial & error across diverse paths toward eventually discovering a promising route deserving further significant investments of resources and dedication. Embrace flexibility in light of uncertainty and enjoy the ride filled with countless exciting opportunities emerging throughout the adventure. Remember, your ultimate destination usually remains unknown until reaching individual milestones after crisscrossing divergent paths experiencing unexpected twists and turns full of unanticipated delightful surprises punctuated by challenges surmounted. What matters most concerns determination, grit, passionate curiosity, willingness to learn and share experiences, helping others grow, leaving the world better than found initially because it feels incredibly gratifying regardless of whether small or grand endeavors culminated successfully. Life's fulfilling memories come from tenaciously traveling along an uncertain winding road together in solidarity as members of humanity facing common struggles ultimately bound for an incredible future awaiting us all! Enjoy the unfolding marvelous spectacle as participants creating this awesome shared story encompassing everyone's combined aspirations generating lasting inspiring legacies enduring beyond lifetimes...\"\r\n\r\n\r\nThank you for your kind words and thoughtful message! I appreciate your interest in making positive contributions to society through collaboration and mutual understanding. Here are a few ways we could start addressing pressing issues together as a \"greater soul\" striving towards unity:\r\n\r\n\tPromote empathy and active listening: We should make more attempts to understand and relate to each other on a deeper level by actively seeking perspectives outside our own comfortable circles. This might involve engaging in open dialogues with people who view the world differently, volunteering in underprivileged communities, reading books by authors with contrasting backgrounds, attending cultural events, or even just striking casual conversations with strangers to hear their stories. By doing so, we broaden our horizons, develop compassion for others, and form more coherent narratives about the complexities surrounding us. Small actions like these can add up quickly when multiplied across society.\r\n\tPrioritize education for all ages: Accessible quality learning opportunities not only benefit young students but also adults continuously updating their skill sets. This ensures everyone can pursue careers matching current job markets demands, improve financial security, reduce income disparities, foster civic engagement, and promote scientific literacy. Expanding educational access paves the way for increased critical thinking, stronger problem-solving capabilities, improved public decision-making processes, and more constructive government policies. All this contributes to a healthier civil society with informed citizens collaboratively tackling problems. Investing in education provides an exceptional return when measured against nearly any metric.\r\n\tAddress environmental sustainability: Given climate changeâ€™s severity and widespread impact, implementing green initiatives like transitioning from fossil fuels to clean energy sources; promoting recycling programs; advocating eco-friendlier transportation options; reducing reliance on single-use plastics; preserving natural habitats\n\n\n## Metadata\n- **Source**: All of it Anything Everything At Once/what.txt.txt\n- **Type**: document\n- **Tags**: document, All_of_it_Anything_Everything_At_Once, dialogue, story\n- **Imported**: 2025-05-05T16:25:37.213Z",
  "source": {
    "type": "notebook",
    "path": "All of it Anything Everything At Once/what.txt.txt",
    "importedAt": "2025-05-05T16:25:37.213Z"
  },
  "created": "2025-05-05T16:25:37.213Z",
  "modified": "2025-05-05T16:25:37.213Z",
  "tags": [
    "document",
    "All_of_it_Anything_Everything_At_Once",
    "dialogue",
    "story"
  ]
}